Name,Address,Crime,Date
al-shelby+county,"RIVERWOOD TER, BIRMINGHAM SHELBY COUNTY",Other,03/16/20. 10:10 PM.
al-shelby+county,"KENLEY WAY, BIRMINGHAM SHELBY COUNTY",Other,03/16/20. 10:38 PM.
al-shelby+county,"HWY 55, HARPERSVILLE SHELBY COUNTY",Burglary,03/16/20. 10:42 PM.
al-shelby+county,"WHITETAIL DR, BIRMINGHAM SHELBY COUNTY",Other,03/16/20. 10:56 PM.
al-shelby+county,"VALLEYBROOK CIR, BIRMINGHAM SHELBY COUNTY",Theft,03/16/20. 11:07 PM.
al-shelby+county,"INDIAN VALLEY RD, BIRMINGHAM SHELBY COUNTY",Theft,03/16/20. 11:28 PM.
al-shelby+county,"HIGHLAND VIEW DR, BIRMINGHAM SHELBY COUNTY",Burglary,03/16/20. 07:29 AM.
al-shelby+county,"HWY 200, MONTEVALLO SHELBY COUNTY",Other,03/16/20. 07:49 AM.
al-shelby+county,"MCDOW RD, COLUMBIANA SHELBY COUNTY",Arrest,03/16/20. 07:55 AM.
al-shelby+county,"BIRMINGHAM ST, MONTEVALLO SHELBY COUNTY",Theft,03/16/20. 07:55 AM.
al-shelby+county,"ENGLISH VILLAGE LN, BIRMINGHAM SHELBY COUNTY",Burglary,03/16/20. 08:08 AM.
al-shelby+county,"RIVERWOOD TER, BIRMINGHAM SHELBY COUNTY",Other,03/16/20. 09:01 AM.
al-shelby+county,"HWY 71, COUNTY SHELBY COUNTY",Theft,03/16/20. 09:08 AM.
al-shelby+county,"BUIE RD, COLUMBIANA SHELBY COUNTY",Arrest,03/16/20. 10:09 AM.
al-shelby+county,"SHOAL RUN TRL, BIRMINGHAM SHELBY COUNTY",Theft,03/16/20. 10:53 AM.
al-shelby+county,"PHILLIPS CIR, COLUMBIANA SHELBY COUNTY",Arrest,03/16/20. 11:42 AM.
al-shelby+county,"HERMITAGE CIR, BIRMINGHAM SHELBY COUNTY",Burglary,03/16/20. 01:08 PM.
al-shelby+county,"CHELSEA PARK RDG, COUNTY SHELBY COUNTY",Theft,03/16/20. 01:08 PM.
al-shelby+county,"WOODBRIDGE TRL, COUNTY SHELBY COUNTY",Theft,03/16/20. 02:35 PM.
al-shelby+county,UNLISTED LOCATION SHELBY COUNTY,Theft,03/16/20. 02:39 PM.
al-shelby+county,"DUNNAVANT VALLEY LN, BIRMINGHAM SHELBY COUNTY",Assault,03/16/20. 03:07 PM.
al-shelby+county,"HIGHLAND LAKES RD, BIRMINGHAM SHELBY COUNTY",Burglary,03/16/20. 03:17 PM.
al-shelby+county,"HWY 61, WILSONVILLE SHELBY COUNTY",Theft,03/16/20. 03:27 PM.
al-shelby+county,"WILDWOOD RD, COUNTY SHELBY COUNTY",Burglary,03/16/20. 03:48 PM.
al-shelby+county,"PHILLIPS CIR, COLUMBIANA SHELBY COUNTY",Arrest,03/16/20. 03:56 PM.
al-shelby+county,"HWY 69, COUNTY SHELBY COUNTY",Burglary,03/16/20. 04:01 PM.
al-shelby+county,"SMOKEY RD, COUNTY SHELBY COUNTY",Other,03/16/20. 05:17 PM.
al-shelby+county,"WHITFIELD DR, BIRMINGHAM SHELBY COUNTY",Other,03/16/20. 06:02 PM.
al-shelby+county,"HWY 145 KING COL, BIRMINGHAM SHELBY COUNTY",Arrest,03/16/20. 06:20 PM.
al-shelby+county,"BROOK HIGHLAND RDG, BIRMINGHAM SHELBY COUNTY",Other,03/16/20. 06:25 PM.
al-shelby+county,"SIMMONS DR, COUNTY SHELBY COUNTY",Assault,03/16/20. 12:16 AM.
al-shelby+county,"SIMMONS DR, COUNTY SHELBY COUNTY",Assault,03/16/20. 12:40 AM.
al-shelby+county,"FOREST MEADOWS CIR, BIRMINGHAM SHELBY COUNTY",Theft,03/16/20. 01:07 AM.
al-shelby+county,"WILLOW OAKS DR, WILSONVILLE SHELBY COUNTY",Theft,03/16/20. 03:04 AM.
al-shelby+county,"CROSSBRIDGE RD, COUNTY SHELBY COUNTY",Burglary,03/17/20. 07:23 AM.
al-shelby+county,"SHOAL RUN TRL NSHL BHM, BIRMINGHAM SHELBY COUNTY",Arrest,03/17/20. 08:01 AM.
al-shelby+county,"HIGHLAND PARK DR, BIRMINGHAM SHELBY COUNTY",Other,03/17/20. 09:25 AM.
al-shelby+county,"CREST RD, BIRMINGHAM SHELBY COUNTY",Theft,03/17/20. 09:45 AM.
al-shelby+county,"STONECREST DR, BIRMINGHAM SHELBY COUNTY",Theft,03/17/20. 10:32 AM.
al-shelby+county,"HWY 25, WILSONVILLE SHELBY COUNTY",Burglary,03/17/20. 11:35 AM.
al-shelby+county,"SPRINGSTONE TRL, COUNTY SHELBY COUNTY",Burglary,03/17/20. 12:04 PM.
al-shelby+county,"BROOK HIGHLAND DR, BIRMINGHAM SHELBY COUNTY",Robbery,03/17/20. 12:59 PM.
al-shelby+county,UNLISTED LOCATION SHELBY COUNTY,Other,03/17/20. 01:02 PM.
al-shelby+county,"BEAVER BROOK CV, BIRMINGHAM SHELBY COUNTY",Other,03/17/20. 01:29 PM.
al-shelby+county,"HWY 260, COUNTY SHELBY COUNTY",Other,03/17/20. 02:15 PM.
al-shelby+county,UNLISTED LOCATION SHELBY COUNTY,Other,03/17/20. 04:24 PM.
al-shelby+county,UNLISTED LOCATION SHELBY COUNTY,Other,03/17/20. 04:49 PM.
al-shelby+county,"BRANCHWATER WAY, COUNTY SHELBY COUNTY",Other,03/17/20. 05:05 PM.
al-shelby+county,"HWY 280, COUNTY SHELBY COUNTY",Burglary,03/17/20. 05:13 PM.
al-shelby+county,"SHADOW OAKS DR, WILSONVILLE SHELBY COUNTY",Burglary,03/17/20. 05:31 PM.
al-shelby+county,"KENLEY WAY, BIRMINGHAM SHELBY COUNTY",Theft,03/17/20. 06:06 PM.
al-shelby+county,"CAHABA VALLEY TRCE, BIRMINGHAM SHELBY COUNTY",Vandalism,03/17/20. 06:21 PM.
al-shelby+county,"WICKLOW LN, BIRMINGHAM SHELBY COUNTY",Other,03/17/20. 06:52 PM.
al-shelby+county,"HWY 25, VINCENT SHELBY COUNTY",Theft,03/17/20. 12:38 AM.
al-shelby+county,"L AND M TRCE, COUNTY SHELBY COUNTY",Other,03/17/20. 02:10 AM.
al-shelby+county,"MCDOW RD, COLUMBIANA SHELBY COUNTY",Arrest,03/17/20. 03:54 AM.
al-shelby+county,"VALLEYDALE RD, BIRMINGHAM SHELBY COUNTY",Theft,03/18/20. 09:41 AM.
al-shelby+county,"MULBERRY LN, COUNTY SHELBY COUNTY",Theft,03/18/20. 10:21 AM.
al-shelby+county,"HWY 280, COUNTY SHELBY COUNTY",Theft,03/18/20. 10:25 AM.
al-shelby+county,UNLISTED LOCATION SHELBY COUNTY,Arrest,03/18/20. 10:53 AM.
al-shelby+county,"HWY 280, COUNTY SHELBY COUNTY",Theft,03/18/20. 12:03 PM.
al-shelby+county,"WHITETAIL DR, BIRMINGHAM SHELBY COUNTY",Other,03/18/20. 01:40 PM.
al-shelby+county,"HWY 42, COUNTY SHELBY COUNTY",Burglary,03/18/20. 02:34 PM.
al-shelby+county,"BENT RIVER CIR, BIRMINGHAM SHELBY COUNTY",Burglary,03/18/20. 02:51 PM.
al-shelby+county,"HWY 17, MONTEVALLO SHELBY COUNTY",Other,03/18/20. 03:04 PM.
al-shelby+county,"DAVIS-HAWKINS ST, MONTEVALLO SHELBY COUNTY",Assault,03/18/20. 03:16 PM.
al-shelby+county,"HWY 31, COUNTY SHELBY COUNTY",Burglary,03/18/20. 03:40 PM.
al-shelby+county,"BEAR CREEK RD, COUNTY SHELBY COUNTY",Theft,03/18/20. 03:46 PM.
al-shelby+county,"MCDOW RD, COLUMBIANA SHELBY COUNTY",Arrest,03/18/20. 04:51 PM.
al-shelby+county,"MCDOW RD COLU COL, COLUMBIANA SHELBY COUNTY",Arrest,03/18/20. 05:05 PM.
al-shelby+county,"MCDOW RD COLU COL, COLUMBIANA SHELBY COUNTY",Arrest,03/18/20. 05:34 PM.
al-shelby+county,"MCDOW RD, COLUMBIANA SHELBY COUNTY",Arrest,03/18/20. 05:45 PM.
al-shelby+county,"MCDOW RD, COLUMBIANA SHELBY COUNTY",Arrest,03/18/20. 05:46 PM.
al-shelby+county,"MEADOW BROOK RD, BIRMINGHAM SHELBY COUNTY",Burglary,03/18/20. 06:09 PM.
al-shelby+county,UNLISTED LOCATION SHELBY COUNTY,Other,03/18/20. 06:30 AM.
al-shelby+county,"HWY 280, COUNTY SHELBY COUNTY",Other,03/19/20. 08:36 AM.
al-shelby+county,"MCDOW RD, COLUMBIANA SHELBY COUNTY",Arrest,03/19/20. 10:04 AM.
al-shelby+county,UNLISTED LOCATION SHELBY COUNTY,Other,03/19/20. 10:19 AM.
al-shelby+county,"EMILY CIR, BIRMINGHAM SHELBY COUNTY",Other,03/19/20. 10:24 AM.
al-shelby+county,"MCDOW RD COLU COL, COUNTY SHELBY COUNTY",Arrest,03/19/20. 10:28 AM.
al-shelby+county,"HWY 42, COUNTY SHELBY COUNTY",Burglary,03/19/20. 10:31 AM.
al-shelby+county,"EDENTON ST, BIRMINGHAM SHELBY COUNTY",Burglary,03/19/20. 10:37 AM.
al-shelby+county,"MCDOW RD COLU COL, COUNTY SHELBY COUNTY",Arrest,03/19/20. 10:55 AM.
al-shelby+county,"CLEAR SPRINGS WAY, COUNTY SHELBY COUNTY",Other,03/19/20. 11:27 AM.
al-shelby+county,"HWY 74, COUNTY SHELBY COUNTY",Burglary,03/19/20. 12:36 PM.
al-shelby+county,"PORTOBELLO RD, BIRMINGHAM SHELBY COUNTY",Burglary,03/19/20. 12:42 PM.
al-shelby+county,"HWY 280, COUNTY SHELBY COUNTY",Other,03/19/20. 01:45 PM.
al-shelby+county,"INDIAN VALLEY RD, BIRMINGHAM SHELBY COUNTY",Other,03/19/20. 02:33 PM.
al-shelby+county,"HWY 51, WILSONVILLE SHELBY COUNTY",Theft,03/19/20. 04:18 PM.
al-shelby+county,"BLACKSTONE CT, COUNTY SHELBY COUNTY",Assault,03/19/20. 05:10 PM.
al-shelby+county,"MANNING PL, BIRMINGHAM SHELBY COUNTY",Other,03/19/20. 05:41 PM.
al-shelby+county,"HWY 406, COUNTY SHELBY COUNTY",Theft,03/19/20. 06:20 PM.
al-shelby+county,"HWY 25, COUNTY SHELBY COUNTY",Other,03/19/20. 01:42 AM.
al-shelby+county,"FOREST LAKES DR, COUNTY SHELBY COUNTY",Burglary,03/20/20. 10:03 AM.
al-shelby+county,"CAHABA OAKS LN, COUNTY SHELBY COUNTY",Burglary,03/20/20. 10:45 AM.
al-shelby+county,"SHIRE VALLEY FARMS, COLUMBIANA SHELBY COUNTY",Burglary,03/20/20. 11:40 AM.
al-shelby+county,"HWY 25, COUNTY SHELBY COUNTY",Theft,03/20/20. 11:44 AM.
al-shelby+county,"HWY 47, COUNTY SHELBY COUNTY",Theft,03/20/20. 11:48 AM.
al-shelby+county,"SOUTH RIVER DR, COUNTY SHELBY COUNTY",Other,03/20/20. 01:40 PM.
al-shelby+county,"MCDOW RD, COLUMBIANA SHELBY COUNTY",Arrest,03/20/20. 01:56 PM.
al-shelby+county,"BARRISTERS CT, BIRMINGHAM SHELBY COUNTY",Theft,03/20/20. 02:26 PM.
al-shelby+county,"HWY 280, BIRMINGHAM SHELBY COUNTY",Other,03/20/20. 04:09 PM.
al-shelby+county,"CHELSEA HIGHLANDS PKWY, COLUMBIANA SHELBY COUNTY",Theft,03/20/20. 04:22 PM.
al-shelby+county,"SPRINGSTONE TRL, COUNTY SHELBY COUNTY",Burglary,03/20/20. 05:58 PM.
al-shelby+county,"HWY 26, COUNTY SHELBY COUNTY",Burglary,03/20/20. 06:03 PM.
al-shelby+county,"MCDOW RD, COLUMBIANA SHELBY COUNTY",Arrest,03/20/20. 06:07 PM.
al-shelby+county,"HWY 280, BIRMINGHAM SHELBY COUNTY",Vandalism,03/20/20. 06:16 PM.
al-shelby+county,"HWY 71, COUNTY SHELBY COUNTY",Other,03/20/20. 06:54 PM.
al-shelby+county,UNLISTED LOCATION SHELBY COUNTY,Theft,03/20/20. 01:34 AM.
al-shelby+county,"CRAWFORD CT, COUNTY SHELBY COUNTY",Other,03/20/20. 02:39 AM.
al-shelby+county,"HEBB RD, WILSONVILLE SHELBY COUNTY",Assault,03/20/20. 02:59 AM.
al-shelby+county,"CHESSER-CRANE RD, COUNTY SHELBY COUNTY",Burglary,03/20/20. 05:00 AM.
al-shelby+county,"HWY 280, BIRMINGHAM SHELBY COUNTY",Other,03/20/20. 06:48 AM.
al-shelby+county,"HORSEBACK TRL, COUNTY SHELBY COUNTY",Theft,03/21/20. 07:41 AM.
al-shelby+county,"STILLWOOD LN, COUNTY SHELBY COUNTY",Arrest,03/21/20. 08:16 AM.
al-shelby+county,UNLISTED LOCATION SHELBY COUNTY,Theft,03/21/20. 09:04 AM.
al-shelby+county,"HWY 280, BIRMINGHAM SHELBY COUNTY",Other,03/21/20. 09:14 AM.
al-shelby+county,"CAHABA RIVER RD, COUNTY SHELBY COUNTY",Arrest,03/21/20. 09:59 AM.
al-shelby+county,"LINWOOD RD, COUNTY SHELBY COUNTY",Theft,03/21/20. 10:27 AM.
al-shelby+county,"HWY 280, COUNTY SHELBY COUNTY",Other,03/21/20. 10:59 AM.
al-shelby+county,"CHELSEA CORNERS WAY, COUNTY SHELBY COUNTY",Burglary,03/21/20. 11:17 AM.
al-shelby+county,"HWY 280, COUNTY SHELBY COUNTY",Arrest,03/21/20. 12:20 PM.
al-shelby+county,"CHESSER-CRANE RD, COUNTY SHELBY COUNTY",Burglary,03/21/20. 01:56 PM.
al-shelby+county,"LAKESHORE CV, BIRMINGHAM SHELBY COUNTY",Other,03/21/20. 02:22 PM.
al-shelby+county,"HWY 10, MONTEVALLO SHELBY COUNTY",Other,03/21/20. 03:47 PM.
al-shelby+county,"INVERNESS LN, BIRMINGHAM SHELBY COUNTY",Theft,03/21/20. 03:51 PM.
al-shelby+county,"HWY 17, MONTEVALLO SHELBY COUNTY",Theft,03/21/20. 04:26 PM.
al-shelby+county,"BROOK HIGHLAND RDG, BIRMINGHAM SHELBY COUNTY",Burglary,03/21/20. 01:42 AM.
al-shelby+county,"LULLWATER RD, BIRMINGHAM SHELBY COUNTY",Other,03/21/20. 02:14 AM.
al-shelby+county,"WILD BROOK LN, COLUMBIANA SHELBY COUNTY",Other,03/21/20. 04:42 AM.
al-shelby+county,"MAIN ST, WILSONVILLE SHELBY COUNTY",Assault,03/22/20. 08:09 AM.
al-shelby+county,UNLISTED LOCATION SHELBY COUNTY,Other,03/22/20. 10:22 AM.
al-shelby+county,"PARADISE COVE LN, COLUMBIANA SHELBY COUNTY",Burglary,03/22/20. 10:36 AM.
al-shelby+county,"KINNEBREW DR, COUNTY SHELBY COUNTY",Other,03/22/20. 12:17 PM.
al-shelby+county,"SHIRE VALLEY FARMS, COLUMBIANA SHELBY COUNTY",Burglary,03/22/20. 01:54 PM.
al-shelby+county,"HWY 280, BIRMINGHAM SHELBY COUNTY",Other,03/22/20. 01:56 PM.
al-shelby+county,"RETREAT CIR, BIRMINGHAM SHELBY COUNTY",Other,03/22/20. 04:49 PM.
al-shelby+county,"MEADOW CREEK LN, COUNTY SHELBY COUNTY",Assault,03/22/20. 05:22 PM.
al-shelby+county,"STONECREST DR, BIRMINGHAM SHELBY COUNTY",Other,03/22/20. 05:56 PM.
al-shelby+county,UNLISTED LOCATION SHELBY COUNTY,Arrest,03/22/20. 06:09 PM.
al-shelby+county,"EAGLE RIDGE DR, BIRMINGHAM SHELBY COUNTY",Other,03/22/20. 06:11 PM.
al-shelby+county,"HWY 25, COUNTY SHELBY COUNTY",Assault,03/22/20. 06:15 PM.
al-shelby+county,UNLISTED LOCATION SHELBY COUNTY,Arrest,03/22/20. 06:31 PM.
al-shelby+county,"HWY 305, COLUMBIANA SHELBY COUNTY",Assault,03/22/20. 06:31 PM.
al-shelby+county,"BELVEDERE CIR, BIRMINGHAM SHELBY COUNTY",Theft,03/22/20. 12:04 AM.
al-shelby+county,"HWY 25, COLUMBIANA SHELBY COUNTY",Theft,03/22/20. 12:09 AM.
al-shelby+county,UNLISTED LOCATION SHELBY COUNTY,Arrest,03/22/20. 12:46 AM.
al-shelby+county,"KINNEBREW DR, COUNTY SHELBY COUNTY",Other,03/22/20. 02:49 AM.
al-shelby+county,"HWY 42, COUNTY SHELBY COUNTY",Assault,03/22/20. 03:44 AM.
al-shelby+county,"HWY 42, COUNTY SHELBY COUNTY",Burglary,03/22/20. 03:55 AM.
al-shelby+county,"HWY 56, WILSONVILLE SHELBY COUNTY",Other,03/22/20. 03:57 AM.
al-shelby+county,"CLEAR SPRINGS WAY, COUNTY SHELBY COUNTY",Assault,03/22/20. 04:37 AM.
al-shelby+county,"HWY 280, COUNTY SHELBY COUNTY",Arrest,03/23/20. 09:07 AM.
al-shelby+county,"HWY 155, MONTEVALLO SHELBY COUNTY",Other,03/23/20. 10:04 AM.
al-shelby+county,"DUNNAVANT VALLEY RD, BIRMINGHAM SHELBY COUNTY",Other,03/23/20. 11:31 AM.
al-shelby+county,"MEADOW DR, BIRMINGHAM SHELBY COUNTY",Vandalism,03/23/20. 12:26 PM.
al-shelby+county,"HWY 145, COLUMBIANA SHELBY COUNTY",Other,03/23/20. 12:35 PM.
al-shelby+county,"DUNNAVANT VALLEY RD, BIRMINGHAM SHELBY COUNTY",Other,03/23/20. 01:41 PM.
al-shelby+county,"DUNNAVANT VALLEY RD, BIRMINGHAM SHELBY COUNTY",Other,03/23/20. 01:59 PM.
al-shelby+county,"KINGS HOME DR, COUNTY SHELBY COUNTY",Other,03/23/20. 02:15 PM.
al-shelby+county,"HWY 25, COUNTY SHELBY COUNTY",Arrest,03/23/20. 03:10 PM.
al-shelby+county,"STILLWOOD LN, COUNTY SHELBY COUNTY",Arrest,03/23/20. 03:30 PM.
al-shelby+county,"HWY 280, COUNTY SHELBY COUNTY",Other,03/23/20. 03:52 PM.
al-shelby+county,"KINGS HOME DR, COUNTY SHELBY COUNTY",Other,03/23/20. 04:11 PM.
al-shelby+county,"MIDRIDGE LN, COUNTY SHELBY COUNTY",Other,03/23/20. 04:15 PM.
al-shelby+county,UNLISTED LOCATION SHELBY COUNTY,Other,03/23/20. 05:27 PM.
al-shelby+county,"ABBOTT SQ, BIRMINGHAM SHELBY COUNTY",Theft,03/23/20. 06:45 PM.
al-shelby+county,"OLD HWY 280, COUNTY SHELBY COUNTY",Other,03/23/20. 06:50 PM.
al-shelby+county,"ELVIRA RD, HELENA SHELBY COUNTY",Theft,03/23/20. 02:13 AM.
al-shelby+county,"EAGLE POINT DR, BIRMINGHAM SHELBY COUNTY",Burglary,03/23/20. 05:54 AM.
al-shelby+county,"HWY 55, COUNTY SHELBY COUNTY",Burglary,03/23/20. 06:10 AM.
al-shelby+county,"DUBLIN WAY, BIRMINGHAM SHELBY COUNTY",Other,03/24/20. 07:26 PM.
al-shelby+county,"ALTADENA RISE, BIRMINGHAM SHELBY COUNTY",Other,03/24/20. 08:55 PM.
al-shelby+county,"SPIDER LILY LN, COUNTY SHELBY COUNTY",Other,03/24/20. 09:16 PM.
al-shelby+county,"MEADOW DR, BIRMINGHAM SHELBY COUNTY",Other,03/24/20. 09:24 PM.
al-shelby+county,"MCDOW RD, COLUMBIANA SHELBY COUNTY",Arrest,03/24/20. 10:00 PM.
al-shelby+county,UNLISTED LOCATION SHELBY COUNTY,Theft,03/24/20. 10:47 PM.
al-shelby+county,"CAHABA VALLEY TRCE, BIRMINGHAM SHELBY COUNTY",Other,03/24/20. 11:37 PM.
al-shelby+county,UNLISTED LOCATION SHELBY COUNTY,Theft,03/24/20. 09:02 AM.
al-shelby+county,UNLISTED LOCATION SHELBY COUNTY,Theft,03/24/20. 09:17 AM.
al-shelby+county,"DUNNAVANT VALLEY RD, BIRMINGHAM SHELBY COUNTY",Other,03/24/20. 09:56 AM.
al-shelby+county,"ALTADENA RISE, BIRMINGHAM SHELBY COUNTY",Other,03/24/20. 10:06 AM.
al-shelby+county,"DEERWOOD, BIRMINGHAM SHELBY COUNTY",Theft,03/24/20. 10:21 AM.
al-shelby+county,"WILD IVY LN, COUNTY SHELBY COUNTY",Theft,03/24/20. 11:10 AM.
al-shelby+county,"HWY 251, MONTEVALLO SHELBY COUNTY",Theft,03/24/20. 11:45 AM.
al-shelby+county,"OAKMONT RD, BIRMINGHAM SHELBY COUNTY",Theft,03/24/20. 11:49 AM.
al-shelby+county,"THORN BERRY LN, BIRMINGHAM SHELBY COUNTY",Burglary,03/24/20. 12:33 PM.
al-shelby+county,"HWY 42, COUNTY SHELBY COUNTY",Other,03/24/20. 01:12 PM.
al-shelby+county,"DUNNAVANT VALLEY RD, BIRMINGHAM SHELBY COUNTY",Other,03/24/20. 01:52 PM.
al-shelby+county,"HWY 437, COUNTY SHELBY COUNTY",Other,03/24/20. 01:54 PM.
al-shelby+county,"HWY 280, BIRMINGHAM SHELBY COUNTY",Theft,03/24/20. 02:04 PM.
al-shelby+county,"HWY 62, VINCENT SHELBY COUNTY",Other,03/24/20. 02:12 PM.
al-shelby+county,"HWY 305, COLUMBIANA SHELBY COUNTY",Theft,03/24/20. 04:14 PM.
al-shelby+county,"BIRCH CREEK DR, BIRMINGHAM SHELBY COUNTY",Vandalism,03/24/20. 06:14 PM.
al-shelby+county,"CHELSEA PARK DR, COUNTY SHELBY COUNTY",Arrest,03/24/20. 06:29 PM.
al-shelby+county,"HEATHER LN, COLUMBIANA SHELBY COUNTY",Arrest,03/24/20. 06:49 PM.
al-shelby+county,"HWY 311, COUNTY SHELBY COUNTY",Assault,03/24/20. 07:09 PM.
al-shelby+county,"BARRISTERS CT, BIRMINGHAM SHELBY COUNTY",Other,03/24/20. 01:26 AM.
al-shelby+county,"NOLEN ST, BIRMINGHAM SHELBY COUNTY",Other,03/24/20. 04:34 AM.
al-shelby+county,"HWY 280, BIRMINGHAM SHELBY COUNTY",Other,03/24/20. 04:48 AM.
al-shelby+county,"HWY 51, COUNTY SHELBY COUNTY",Other,03/24/20. 06:46 AM.
al-shelby+county,"HWY 483, VINCENT SHELBY COUNTY",Other,03/25/20. 07:55 PM.
al-shelby+county,"HWY 280, COUNTY SHELBY COUNTY",Theft,03/25/20. 08:45 PM.
al-shelby+county,"HWY 71, COUNTY SHELBY COUNTY",Other,03/25/20. 08:53 PM.
al-shelby+county,UNLISTED LOCATION SHELBY COUNTY,Arrest,03/25/20. 09:23 PM.
al-shelby+county,"HWY 10, MONTEVALLO SHELBY COUNTY",Other,03/25/20. 09:54 PM.
al-shelby+county,"CAHABA BEACH RD, BIRMINGHAM SHELBY COUNTY",Burglary,03/25/20. 10:11 PM.
al-shelby+county,"CALDWELL MILL RD, BIRMINGHAM SHELBY COUNTY",Burglary,03/25/20. 10:34 PM.
al-shelby+county,"SALISBURY LN, BIRMINGHAM SHELBY COUNTY",Burglary,03/25/20. 08:24 AM.
al-shelby+county,"REGENT PARK DR, BIRMINGHAM SHELBY COUNTY",Other,03/25/20. 09:56 AM.
al-shelby+county,"EGG AND BUTTER RD, COLUMBIANA SHELBY COUNTY",Other,03/25/20. 11:14 AM.
al-shelby+county,"MCDOW RD, COLUMBIANA SHELBY COUNTY",Arrest,03/25/20. 12:58 PM.
al-shelby+county,"CHELSEA STATION CIR, COUNTY SHELBY COUNTY",Assault,03/25/20. 02:04 PM.
al-shelby+county,"HWY 491, COUNTY SHELBY COUNTY",Burglary,03/25/20. 03:30 PM.
al-shelby+county,"PRESTON LN, COUNTY SHELBY COUNTY",Burglary,03/25/20. 03:56 PM.
al-shelby+county,UNLISTED LOCATION SHELBY COUNTY,Arrest,03/25/20. 04:12 PM.
al-shelby+county,"OLD HWY 280, COUNTY SHELBY COUNTY",Other,03/25/20. 04:14 PM.
al-shelby+county,UNLISTED LOCATION SHELBY COUNTY,Other,03/25/20. 04:25 PM.
al-shelby+county,"GILMORE-NICK CIR, MONTEVALLO SHELBY COUNTY",Other,03/25/20. 04:27 PM.
al-shelby+county,"CHELSEA CORS, COUNTY SHELBY COUNTY",Other,03/25/20. 04:43 PM.
al-shelby+county,"BIRCH CREEK DR, BIRMINGHAM SHELBY COUNTY",Vandalism,03/25/20. 05:17 PM.
al-shelby+county,UNLISTED LOCATION SHELBY COUNTY,Other,03/25/20. 06:01 PM.
al-shelby+county,UNLISTED LOCATION SHELBY COUNTY,Other,03/25/20. 06:02 PM.
al-shelby+county,"KENLEY WAY, BIRMINGHAM SHELBY COUNTY",Other,03/25/20. 06:23 PM.
al-shelby+county,"MAIN ST, WILSONVILLE SHELBY COUNTY",Other,03/25/20. 06:39 PM.
al-shelby+county,"HWY 280, COUNTY SHELBY COUNTY",Burglary,03/25/20. 07:04 PM.
al-shelby+county,"NARROWS POINT DR, BIRMINGHAM SHELBY COUNTY",Other,03/25/20. 12:26 AM.
al-shelby+county,"STONEGATE DR, BIRMINGHAM SHELBY COUNTY",Burglary,03/25/20. 03:28 AM.
al-shelby+county,"NARROWS POINT DR, BIRMINGHAM SHELBY COUNTY",Other,03/25/20. 03:50 AM.
al-shelby+county,"KENLEY WAY, BIRMINGHAM SHELBY COUNTY",Burglary,03/25/20. 07:00 AM.
al-shelby+county,"VALLEYDALE RD, BIRMINGHAM SHELBY COUNTY",Burglary,03/25/20. 07:06 AM.
al-shelby+county,"HWY 25, COUNTY SHELBY COUNTY",Other,03/26/20. 07:29 PM.
al-shelby+county,"TURTLE LAKE DR, BIRMINGHAM SHELBY COUNTY",Other,03/26/20. 08:07 PM.
al-shelby+county,"BRANTLEYVILLE CT, COUNTY SHELBY COUNTY",Burglary,03/26/20. 08:31 PM.
al-shelby+county,"HWY 47, COUNTY SHELBY COUNTY",Assault,03/26/20. 08:54 PM.
al-shelby+county,"HWY 280, BIRMINGHAM SHELBY COUNTY",Assault,03/26/20. 09:49 PM.
al-shelby+county,UNLISTED LOCATION SHELBY COUNTY,Arrest,03/26/20. 09:52 PM.
al-shelby+county,"SAGEBRUSH LN, COUNTY SHELBY COUNTY",Theft,03/26/20. 09:59 PM.
al-shelby+county,UNLISTED LOCATION SHELBY COUNTY,Other,03/26/20. 10:14 PM.
al-shelby+county,"HWY 277, HELENA SHELBY COUNTY",Assault,03/26/20. 10:36 PM.
al-shelby+county,"HWY 43, COUNTY SHELBY COUNTY",Arrest,03/26/20. 10:40 PM.
al-shelby+county,"WHITE CIR, WILSONVILLE SHELBY COUNTY",Other,03/26/20. 11:33 PM.
al-shelby+county,"OLD STONE DR, BIRMINGHAM SHELBY COUNTY",Other,03/26/20. 11:57 PM.
al-shelby+county,"BEAR CREEK RD, COUNTY SHELBY COUNTY",Other,03/26/20. 07:37 AM.
al-shelby+county,"NARROWS POINT DR, BIRMINGHAM SHELBY COUNTY",Other,03/26/20. 08:40 AM.
al-shelby+county,"LITTLE RIDGE CIR, BIRMINGHAM SHELBY COUNTY",Other,03/26/20. 08:51 AM.
al-shelby+county,"NARROWS POINT DR, BIRMINGHAM SHELBY COUNTY",Theft,03/26/20. 09:12 AM.
al-shelby+county,"HIGHLAND LAKES DR, BIRMINGHAM SHELBY COUNTY",Burglary,03/26/20. 12:46 PM.
al-shelby+county,"YERBY LN, COUNTY SHELBY COUNTY",Other,03/26/20. 01:19 PM.
al-shelby+county,"SELMA ST, MONTEVALLO SHELBY COUNTY",Burglary,03/26/20. 01:53 PM.
al-shelby+county,"SHELBY FOREST TRL, COUNTY SHELBY COUNTY",Theft,03/26/20. 01:54 PM.
al-shelby+county,"NARROWS POINT LN, BIRMINGHAM SHELBY COUNTY",Burglary,03/26/20. 02:02 PM.
al-shelby+county,"COALMONT RD, COUNTY SHELBY COUNTY",Burglary,03/26/20. 02:06 PM.
al-shelby+county,"NARROWS POINT DR, BIRMINGHAM SHELBY COUNTY",Theft,03/26/20. 02:08 PM.
al-shelby+county,"CRAWFORD CT, COUNTY SHELBY COUNTY",Assault,03/26/20. 02:36 PM.
al-shelby+county,"SKYVIEW DR, MONTEVALLO SHELBY COUNTY",Theft,03/26/20. 03:55 PM.
al-shelby+county,"HWY 280, COUNTY SHELBY COUNTY",Theft,03/26/20. 04:25 PM.
al-shelby+county,"EAGLE POINT PKWY, BIRMINGHAM SHELBY COUNTY",Burglary,03/26/20. 04:51 PM.
al-shelby+county,"HWY 280, COUNTY SHELBY COUNTY",Burglary,03/26/20. 05:37 PM.
al-shelby+county,UNLISTED LOCATION SHELBY COUNTY,Other,03/26/20. 05:43 PM.
al-shelby+county,"MORNING SUN DR, BIRMINGHAM SHELBY COUNTY",Other,03/26/20. 06:03 PM.
al-shelby+county,"CHESSER-CRANE RD, COUNTY SHELBY COUNTY",Burglary,03/26/20. 06:10 PM.
al-shelby+county,"EAGLE POINT PKWY, BIRMINGHAM SHELBY COUNTY",Burglary,03/26/20. 06:24 PM.
al-shelby+county,"HWY 280, COUNTY SHELBY COUNTY",Burglary,03/26/20. 06:36 PM.
al-shelby+county,"BARRISTERS CT, BIRMINGHAM SHELBY COUNTY",Assault,03/26/20. 01:34 AM.
al-shelby+county,"FOREST LAKES RD, COUNTY SHELBY COUNTY",Burglary,03/26/20. 02:03 AM.
al-shelby+county,"BELVEDERE DR, BIRMINGHAM SHELBY COUNTY",Other,03/26/20. 03:55 AM.
al-shelby+county,"IDLEWILD CIR, BIRMINGHAM SHELBY COUNTY",Burglary,03/27/20. 07:35 AM.
al-shelby+county,"ARBOR CT, COUNTY SHELBY COUNTY",Burglary,03/27/20. 07:43 AM.
al-shelby+county,"SADDLECREEK LN, BIRMINGHAM SHELBY COUNTY",Burglary,03/27/20. 08:25 AM.
al-shelby+county,"OLD HWY 280, BIRMINGHAM SHELBY COUNTY",Burglary,03/27/20. 09:10 AM.
al-shelby+county,"1ST AVE, HELENA SHELBY COUNTY",Arrest,03/27/20. 09:49 AM.
al-shelby+county,"STONE BROOK DR, BIRMINGHAM SHELBY COUNTY",Theft,03/27/20. 10:40 AM.
al-shelby+county,"ALTA VISTA DR, COUNTY SHELBY COUNTY",Theft,03/27/20. 12:14 PM.
al-shelby+county,"INDIAN LAKE DR, COUNTY SHELBY COUNTY",Vandalism,03/27/20. 12:49 PM.
al-shelby+county,"CONROY LN, COUNTY SHELBY COUNTY",Burglary,03/27/20. 01:17 PM.
al-shelby+county,"HWY 70, COLUMBIANA SHELBY COUNTY",Other,03/27/20. 01:50 PM.
al-shelby+county,"NARROWS DR, BIRMINGHAM SHELBY COUNTY",Burglary,03/27/20. 01:52 PM.
al-shelby+county,"INVERNESS LN, BIRMINGHAM SHELBY COUNTY",Arrest,03/27/20. 02:17 PM.
al-shelby+county,"HWY 280, COUNTY SHELBY COUNTY",Other,03/27/20. 03:42 PM.
al-shelby+county,"MERRY HILL RD, COUNTY SHELBY COUNTY",Other,03/27/20. 03:52 PM.
al-shelby+county,"BRANTLEY LAKE RD, COUNTY SHELBY COUNTY",Burglary,03/27/20. 04:50 PM.
al-shelby+county,UNLISTED LOCATION SHELBY COUNTY,Other,03/27/20. 05:04 PM.
al-shelby+county,"WOODBURY DR, COUNTY SHELBY COUNTY",Burglary,03/27/20. 05:38 PM.
al-shelby+county,"BILTMORE DR, BIRMINGHAM SHELBY COUNTY",Burglary,03/27/20. 05:40 PM.
al-shelby+county,"MCDOW RD, COLUMBIANA SHELBY COUNTY",Arrest,03/27/20. 05:49 PM.
al-shelby+county,"VERDA GREEN LN, COLUMBIANA SHELBY COUNTY",Other,03/27/20. 12:10 AM.
al-shelby+county,"OLD STONE DR, BIRMINGHAM SHELBY COUNTY",Assault,03/27/20. 12:29 AM.
al-shelby+county,"HWY 22, MONTEVALLO SHELBY COUNTY",Other,03/27/20. 12:41 AM.
al-shelby+county,UNLISTED LOCATION SHELBY COUNTY,Other,03/27/20. 04:21 AM.
al-shelby+county,"WOODLAND CIR, BIRMINGHAM SHELBY COUNTY",Burglary,03/28/20. 09:51 AM.
al-shelby+county,UNLISTED LOCATION SHELBY COUNTY,Theft,03/28/20. 11:58 AM.
al-shelby+county,"HWY 56, WILSONVILLE SHELBY COUNTY",Burglary,03/28/20. 12:14 PM.
al-shelby+county,"HWY 31, COUNTY SHELBY COUNTY",Theft,03/28/20. 01:19 PM.
al-shelby+county,"CABALLO CIR, COUNTY SHELBY COUNTY",Theft,03/28/20. 04:52 PM.
al-shelby+county,"OAKMONT RD, BIRMINGHAM SHELBY COUNTY",Theft,03/28/20. 05:57 PM.
al-shelby+county,"HWY 39, COUNTY SHELBY COUNTY",Other,03/28/20. 06:03 PM.
al-shelby+county,"BIRMINGHAM ST, MONTEVALLO SHELBY COUNTY",Arrest,03/28/20. 06:14 PM.
al-shelby+county,"GILMORE-NICK CIR, MONTEVALLO SHELBY COUNTY",Shooting,03/28/20. 06:36 PM.
al-shelby+county,"WILLOW LEAF CIR, WILSONVILLE SHELBY COUNTY",Burglary,03/28/20. 06:37 PM.
al-shelby+county,"BROOK HIGHLAND RDG, BIRMINGHAM SHELBY COUNTY",Other,03/28/20. 06:50 PM.
al-shelby+county,"GILMORE-NICK CIR, MONTEVALLO SHELBY COUNTY",Shooting,03/28/20. 06:56 PM.
al-shelby+county,"TURTLE LAKE DR, BIRMINGHAM SHELBY COUNTY",Other,03/28/20. 01:08 AM.
al-shelby+county,"WHITETAIL CV, BIRMINGHAM SHELBY COUNTY",Other,03/28/20. 03:12 AM.
al-shelby+county,"LITTLE TURTLE CIR, BIRMINGHAM SHELBY COUNTY",Burglary,03/29/20. 09:33 AM.
al-shelby+county,"FOREST LAKES LN, COUNTY SHELBY COUNTY",Burglary,03/29/20. 09:41 AM.
al-shelby+county,"MEADOW DR, BIRMINGHAM SHELBY COUNTY",Other,03/29/20. 09:42 AM.
al-shelby+county,"LAKE CHELSEA DR, COUNTY SHELBY COUNTY",Burglary,03/29/20. 11:53 AM.
al-shelby+county,"HWY 478, COUNTY SHELBY COUNTY",Theft,03/29/20. 12:09 PM.
al-shelby+county,"RIVER HILLS BUSINESS PARK, BIRMINGHAM SHELBY COUNTY",Burglary,03/29/20. 01:54 PM.
al-shelby+county,"HWY 51, WILSONVILLE SHELBY COUNTY",Vandalism,03/29/20. 03:45 PM.
