Name,Address,Crime,Date
al-shelby+county,"INDIAN CREST DR, COUNTY SHELBY COUNTY",Assault,04/24/20. 03:45 PM.
al-shelby+county,"STONECREST DR, BIRMINGHAM SHELBY COUNTY",Other,04/24/20. 04:00 PM.
al-shelby+county,"HWY 280, BIRMINGHAM SHELBY COUNTY",Burglary,04/24/20. 05:30 PM.
al-shelby+county,"HWY 280, BIRMINGHAM SHELBY COUNTY",Burglary,04/24/20. 06:43 PM.
al-shelby+county,"RIVER TREE CIR, HARPERSVILLE SHELBY COUNTY",Other,04/24/20. 12:58 AM.
al-shelby+county,"COALMONT RD, COUNTY SHELBY COUNTY",Theft,04/24/20. 01:27 AM.
al-shelby+county,"BROOK HIGHLAND DR, BIRMINGHAM SHELBY COUNTY",Theft,04/24/20. 01:29 AM.
al-shelby+county,"FOREST LAKES RD, COUNTY SHELBY COUNTY",Burglary,04/24/20. 04:23 AM.
al-shelby+county,"RIVER BIRCH WAY, BIRMINGHAM SHELBY COUNTY",Burglary,04/25/20. 09:44 AM.
al-shelby+county,"BRISSTOL LN, BIRMINGHAM SHELBY COUNTY",Burglary,04/25/20. 09:53 AM.
al-shelby+county,"CEDAR LN, BIRMINGHAM SHELBY COUNTY",Burglary,04/25/20. 10:02 AM.
al-shelby+county,"CEDAR LN, BIRMINGHAM SHELBY COUNTY",Burglary,04/25/20. 10:10 AM.
al-shelby+county,"STRATFORD RD, BIRMINGHAM SHELBY COUNTY",Burglary,04/25/20. 10:14 AM.
al-shelby+county,"CHELSEA PARK TRL, COUNTY SHELBY COUNTY",Other,04/25/20. 10:46 AM.
al-shelby+county,"HWY 50, COUNTY SHELBY COUNTY",Theft,04/25/20. 12:16 PM.
al-shelby+county,"HWY 17, MONTEVALLO SHELBY COUNTY",Assault,04/25/20. 12:44 PM.
al-shelby+county,"INDIAN VALLEY RD, BIRMINGHAM SHELBY COUNTY",Burglary,04/25/20. 01:28 PM.
al-shelby+county,"HWY 43, COUNTY SHELBY COUNTY",Theft,04/25/20. 01:35 PM.
al-shelby+county,"APPLECROSS RD, BIRMINGHAM SHELBY COUNTY",Burglary,04/25/20. 02:09 PM.
al-shelby+county,"MEADOW DR, BIRMINGHAM SHELBY COUNTY",Assault,04/25/20. 02:21 PM.
al-shelby+county,"DEAD HOLLOW RD, HARPERSVILLE SHELBY COUNTY",Burglary,04/25/20. 03:28 PM.
al-shelby+county,"KELHAM GROVE WAY, BIRMINGHAM SHELBY COUNTY",Burglary,04/25/20. 03:42 PM.
al-shelby+county,"COALMONT RD, COUNTY SHELBY COUNTY",Burglary,04/25/20. 04:02 PM.
al-shelby+county,"CAMBRIAN WAY, BIRMINGHAM SHELBY COUNTY",Burglary,04/25/20. 04:04 PM.
al-shelby+county,"HWY 36, COUNTY SHELBY COUNTY",Burglary,04/25/20. 04:51 PM.
al-shelby+county,"MT LAUREL AVE, BIRMINGHAM SHELBY COUNTY",Theft,04/25/20. 05:07 PM.
al-shelby+county,"RIVER HILLS BUSINESS PARK, BIRMINGHAM SHELBY COUNTY",Burglary,04/25/20. 05:37 PM.
al-shelby+county,"HOLLY WAY, COUNTY SHELBY COUNTY",Burglary,04/25/20. 05:58 PM.
al-shelby+county,"SOMERSET LN, BIRMINGHAM SHELBY COUNTY",Theft,04/25/20. 06:08 PM.
al-shelby+county,"MCDOW RD, COLUMBIANA SHELBY COUNTY",Assault,04/25/20. 06:24 PM.
al-shelby+county,"ASHTON WOODS DR, COUNTY SHELBY COUNTY",Burglary,04/25/20. 07:02 PM.
al-shelby+county,"COLUMBIA CIR, BIRMINGHAM SHELBY COUNTY",Other,04/25/20. 12:18 AM.
al-shelby+county,"GREENHILL PKWY, BIRMINGHAM SHELBY COUNTY",Other,04/25/20. 01:08 AM.
al-shelby+county,"HWY 54, MONTEVALLO SHELBY COUNTY",Burglary,04/25/20. 01:48 AM.
al-shelby+county,UNLISTED LOCATION SHELBY COUNTY,Other,04/25/20. 02:07 AM.
al-shelby+county,"KELLER LN, VINCENT SHELBY COUNTY",Other,04/25/20. 04:24 AM.
al-shelby+county,"LAKESIDE DR, BIRMINGHAM SHELBY COUNTY",Burglary,04/25/20. 05:12 AM.
al-shelby+county,"COUNTY SERVICES DR, COUNTY SHELBY COUNTY",Theft,04/25/20. 05:50 AM.
al-shelby+county,"HWY 280, BIRMINGHAM SHELBY COUNTY",Other,04/25/20. 06:05 AM.
al-shelby+county,"CHESAPEAKE CV, BIRMINGHAM SHELBY COUNTY",Theft,04/26/20. 08:46 AM.
al-shelby+county,"CEDAR LN, BIRMINGHAM SHELBY COUNTY",Burglary,04/26/20. 08:58 AM.
al-shelby+county,"MCDOW RD, COLUMBIANA SHELBY COUNTY",Arrest,04/26/20. 10:41 AM.
al-shelby+county,"NABORS DR, COUNTY SHELBY COUNTY",Other,04/26/20. 11:39 AM.
al-shelby+county,"HWY 50 VAND VAN, MONTEVALLO SHELBY COUNTY",Theft,04/26/20. 01:15 PM.
al-shelby+county,"BIRMINGHAM ST, MONTEVALLO SHELBY COUNTY",Other,04/26/20. 01:17 PM.
al-shelby+county,"STONERIDGE LN, COUNTY SHELBY COUNTY",Other,04/26/20. 03:11 PM.
al-shelby+county,"BETHLEHEM CHURCH RD, COUNTY SHELBY COUNTY",Other,04/26/20. 03:18 PM.
al-shelby+county,"RIVER HILLS BUSINESS PARK, BIRMINGHAM SHELBY COUNTY",Burglary,04/26/20. 03:26 PM.
al-shelby+county,"HWY 280, BIRMINGHAM SHELBY COUNTY",Theft,04/26/20. 03:26 PM.
al-shelby+county,"HWY 77, COLUMBIANA SHELBY COUNTY",Other,04/26/20. 05:09 PM.
al-shelby+county,"REYNOLDS CEMETERY RD, MONTEVALLO SHELBY COUNTY",Assault,04/26/20. 06:36 PM.
al-shelby+county,"HWY 47, COUNTY SHELBY COUNTY",Other,04/26/20. 06:58 PM.
al-shelby+county,"HWY 280, BIRMINGHAM SHELBY COUNTY",Burglary,04/26/20. 07:09 PM.
al-shelby+county,"CAHABA VALLEY RD, BIRMINGHAM SHELBY COUNTY",Theft,04/26/20. 12:53 AM.
al-shelby+county,UNLISTED LOCATION SHELBY COUNTY,Burglary,04/26/20. 01:18 AM.
al-shelby+county,"HWY 280, COUNTY SHELBY COUNTY",Theft,04/26/20. 01:58 AM.
al-shelby+county,"MAIN ST, WILSONVILLE SHELBY COUNTY",Burglary,04/26/20. 05:27 AM.
al-shelby+county,"HWY 280, COUNTY SHELBY COUNTY",Burglary,04/26/20. 07:13 AM.
al-shelby+county,"WELLSTONE CIR, BIRMINGHAM SHELBY COUNTY",Theft,04/27/20. 08:48 AM.
al-shelby+county,"SKYLARK DR, BIRMINGHAM SHELBY COUNTY",Theft,04/27/20. 10:54 AM.
al-shelby+county,"MORRIS ESTATES DR, WILSONVILLE SHELBY COUNTY",Other,04/27/20. 11:19 AM.
al-shelby+county,"KENLEY WAY, BIRMINGHAM SHELBY COUNTY",Other,04/27/20. 11:21 AM.
al-shelby+county,"HWY 55, WILSONVILLE SHELBY COUNTY",Burglary,04/27/20. 12:53 PM.
al-shelby+county,"WAYHIGH LN, BIRMINGHAM SHELBY COUNTY",Theft,04/27/20. 02:05 PM.
al-shelby+county,"MCDOW RD, COLUMBIANA SHELBY COUNTY",Arrest,04/27/20. 02:17 PM.
al-shelby+county,"HWY 280, BIRMINGHAM SHELBY COUNTY",Assault,04/27/20. 03:13 PM.
al-shelby+county,"MCDOW RD, COLUMBIANA SHELBY COUNTY",Arrest,04/27/20. 03:22 PM.
al-shelby+county,"EAGLE RIDGE DR, BIRMINGHAM SHELBY COUNTY",Other,04/27/20. 03:38 PM.
al-shelby+county,"REYNOLDS CEMETERY RD, MONTEVALLO SHELBY COUNTY",Other,04/27/20. 04:49 PM.
al-shelby+county,"HWY 87, CALERA SHELBY COUNTY",Theft,04/27/20. 04:57 PM.
al-shelby+county,"REYNOLDS CEMETERY RD, MONTEVALLO SHELBY COUNTY",Other,04/27/20. 05:58 PM.
al-shelby+county,"HWY 480, COUNTY SHELBY COUNTY",Assault,04/27/20. 06:19 PM.
al-shelby+county,"ISLAND CIR, COUNTY SHELBY COUNTY",Theft,04/27/20. 06:53 PM.
al-shelby+county,"LODGE DR, MONTEVALLO SHELBY COUNTY",Other,04/27/20. 06:54 PM.
al-shelby+county,"OAK BRANCH LN, COUNTY SHELBY COUNTY",Burglary,04/27/20. 03:12 AM.
al-shelby+county,"MCDOW RD, COLUMBIANA SHELBY COUNTY",Other,04/27/20. 03:48 AM.
al-shelby+county,UNLISTED LOCATION SHELBY COUNTY,Other,04/28/20. 09:28 AM.
al-shelby+county,"BIRMINGHAM ST, MONTEVALLO SHELBY COUNTY",Assault,04/28/20. 11:16 AM.
al-shelby+county,"HWY 22, MONTEVALLO SHELBY COUNTY",Other,04/28/20. 12:11 PM.
al-shelby+county,"HWY 280, COUNTY SHELBY COUNTY",Other,04/28/20. 01:01 PM.
al-shelby+county,UNLISTED LOCATION SHELBY COUNTY,Other,04/28/20. 01:38 PM.
al-shelby+county,"NARROWS PKWY, BIRMINGHAM SHELBY COUNTY",Burglary,04/28/20. 01:39 PM.
al-shelby+county,"HWY 62, VINCENT SHELBY COUNTY",Arrest,04/28/20. 01:58 PM.
al-shelby+county,"PROVIDENCE PARK, BIRMINGHAM SHELBY COUNTY",Burglary,04/28/20. 02:07 PM.
al-shelby+county,"APPLECROSS RD, BIRMINGHAM SHELBY COUNTY",Other,04/28/20. 02:09 PM.
al-shelby+county,"MCDOW RD, COLUMBIANA SHELBY COUNTY",Arrest,04/28/20. 02:20 PM.
al-shelby+county,"MCDOW RD, COLUMBIANA SHELBY COUNTY",Arrest,04/28/20. 03:11 PM.
al-shelby+county,UNLISTED LOCATION SHELBY COUNTY,Other,04/28/20. 03:43 PM.
al-shelby+county,"MEADOWLARK DR, BIRMINGHAM SHELBY COUNTY",Theft,04/28/20. 04:12 PM.
al-shelby+county,"LIME CREEK LN, COUNTY SHELBY COUNTY",Theft,04/28/20. 04:30 PM.
al-shelby+county,"NARROWS CREEK DR, BIRMINGHAM SHELBY COUNTY",Theft,04/28/20. 04:40 PM.
al-shelby+county,"ASHTON WOODS DR, COUNTY SHELBY COUNTY",Burglary,04/28/20. 06:13 PM.
al-shelby+county,"HWY 280, BIRMINGHAM SHELBY COUNTY",Burglary,04/28/20. 06:31 PM.
al-shelby+county,"SIMPSON RD WILS WIL, MONTEVALLO SHELBY COUNTY",Arrest,04/28/20. 06:31 PM.
al-shelby+county,"HWY 259, MONTEVALLO SHELBY COUNTY",Other,04/28/20. 07:01 PM.
al-shelby+county,"TURTLE LAKE DR, BIRMINGHAM SHELBY COUNTY",Arrest,04/28/20. 07:14 PM.
al-shelby+county,"CREST RD, COUNTY SHELBY COUNTY",Theft,04/28/20. 07:16 PM.
al-shelby+county,UNLISTED LOCATION SHELBY COUNTY,Other,04/28/20. 12:19 AM.
al-shelby+county,"AUTUMN VIEW DR, COUNTY SHELBY COUNTY",Vandalism,04/28/20. 12:27 AM.
al-shelby+county,"KENLEY WAY, BIRMINGHAM SHELBY COUNTY",Other,04/28/20. 12:38 AM.
al-shelby+county,"HWY 280, BIRMINGHAM SHELBY COUNTY",Theft,04/28/20. 12:44 AM.
al-shelby+county,"CHISM CIR, MONTEVALLO SHELBY COUNTY",Shooting,04/28/20. 12:48 AM.
al-shelby+county,UNLISTED LOCATION SHELBY COUNTY,Other,04/28/20. 04:07 AM.
al-shelby+county,"HWY 28, COLUMBIANA SHELBY COUNTY",Other,04/29/20. 07:33 PM.
al-shelby+county,"KINNEBREW DR, COUNTY SHELBY COUNTY",Other,04/29/20. 09:32 PM.
al-shelby+county,"HWY 11, COUNTY SHELBY COUNTY",Theft,04/29/20. 10:04 PM.
al-shelby+county,"HWY 280, BIRMINGHAM SHELBY COUNTY",Burglary,04/29/20. 10:27 PM.
al-shelby+county,"TURTLE LAKE DR, BIRMINGHAM SHELBY COUNTY",Assault,04/29/20. 11:29 PM.
al-shelby+county,"HWY 5, WILSONVILLE SHELBY COUNTY",Other,04/29/20. 08:12 AM.
al-shelby+county,"HWY 308, COUNTY SHELBY COUNTY",Other,04/29/20. 09:56 AM.
al-shelby+county,"MCDOW RD, COLUMBIANA SHELBY COUNTY",Arrest,04/29/20. 10:08 AM.
al-shelby+county,"MULBERRY ST, MONTEVALLO SHELBY COUNTY",Other,04/29/20. 10:56 AM.
al-shelby+county,UNLISTED LOCATION SHELBY COUNTY,Other,04/29/20. 11:08 AM.
al-shelby+county,"HWY 280, BIRMINGHAM SHELBY COUNTY",Burglary,04/29/20. 11:19 AM.
al-shelby+county,"RIDGEVIEW LAKE RD, COUNTY SHELBY COUNTY",Burglary,04/29/20. 11:38 AM.
al-shelby+county,"SEVEN BARKS RD, BIRMINGHAM SHELBY COUNTY",Theft,04/29/20. 12:08 PM.
al-shelby+county,"INVERNESS CENTER PKWY, BIRMINGHAM SHELBY COUNTY",Theft,04/29/20. 01:45 PM.
al-shelby+county,"RIVER HILLS BUSINESS PARK, BIRMINGHAM SHELBY COUNTY",Other,04/29/20. 02:06 PM.
al-shelby+county,"VIOLET DR, COUNTY SHELBY COUNTY",Other,04/29/20. 03:19 PM.
al-shelby+county,UNLISTED LOCATION SHELBY COUNTY,Assault,04/29/20. 03:26 PM.
al-shelby+county,"OLD CALDWELL MILL RD, BIRMINGHAM SHELBY COUNTY",Burglary,04/29/20. 03:31 PM.
al-shelby+county,"CHELSEA CORNERS WAY, COUNTY SHELBY COUNTY",Theft,04/29/20. 12:21 AM.
al-shelby+county,"HWY 10, MONTEVALLO SHELBY COUNTY",Theft,04/29/20. 01:29 AM.
al-shelby+county,"HWY 11, COUNTY SHELBY COUNTY",Burglary,04/29/20. 03:16 AM.
al-shelby+county,"HWY 46, COUNTY SHELBY COUNTY",Other,04/29/20. 03:52 AM.
al-shelby+county,"GRANT ST, MONTEVALLO SHELBY COUNTY",Shooting,04/29/20. 04:41 AM.
al-shelby+county,"HAMPTON PL, BIRMINGHAM SHELBY COUNTY",Assault,04/30/20. 09:59 AM.
al-shelby+county,"HWY 31, COUNTY SHELBY COUNTY",Theft,04/30/20. 01:35 PM.
al-shelby+county,"GORMAN PARK RD, VINCENT SHELBY COUNTY",Other,04/30/20. 02:31 PM.
al-shelby+county,"APPLECROSS RD, BIRMINGHAM SHELBY COUNTY",Burglary,04/30/20. 02:58 PM.
al-shelby+county,"SHORE FRONT LN, WILSONVILLE SHELBY COUNTY",Burglary,04/30/20. 03:34 PM.
al-shelby+county,"BROOK HIGHLAND RDG, BIRMINGHAM SHELBY COUNTY",Burglary,04/30/20. 04:05 PM.
al-shelby+county,"SUNNY MEADOWS DR, BIRMINGHAM SHELBY COUNTY",Arrest,04/30/20. 04:26 PM.
al-shelby+county,UNLISTED LOCATION SHELBY COUNTY,Arrest,04/30/20. 05:34 PM.
al-shelby+county,"HWY 39, COUNTY SHELBY COUNTY",Theft,04/30/20. 05:36 PM.
al-shelby+county,"HIGHLAND LAKES TRL, BIRMINGHAM SHELBY COUNTY",Theft,04/30/20. 05:53 PM.
al-shelby+county,"HWY 313, COLUMBIANA SHELBY COUNTY",Assault,04/30/20. 06:36 PM.
al-shelby+county,"HWY 25, WILSONVILLE SHELBY COUNTY",Burglary,04/30/20. 12:01 AM.
al-shelby+county,"HWY 280, BIRMINGHAM SHELBY COUNTY",Other,04/30/20. 12:04 AM.
al-shelby+county,"APPLECROSS RD, BIRMINGHAM SHELBY COUNTY",Other,04/30/20. 12:14 AM.
al-shelby+county,"MAIN ST, WILSONVILLE SHELBY COUNTY",Burglary,04/30/20. 05:08 AM.
al-shelby+county,"BELCHER DR, BIRMINGHAM SHELBY COUNTY",Burglary,05/01/20. 11:54 AM.
al-shelby+county,"HWY 280, BIRMINGHAM SHELBY COUNTY",Theft,05/01/20. 12:02 PM.
al-shelby+county,"HWY 280, BIRMINGHAM SHELBY COUNTY",Theft,05/01/20. 12:38 PM.
al-shelby+county,"GARRETT RD, VINCENT SHELBY COUNTY",Burglary,05/01/20. 01:10 PM.
al-shelby+county,"HERITAGE VIEW RD, BIRMINGHAM SHELBY COUNTY",Burglary,05/01/20. 01:47 PM.
al-shelby+county,"HWY 10, MONTEVALLO SHELBY COUNTY",Burglary,05/01/20. 01:50 PM.
al-shelby+county,"LYDIAS LN, WILSONVILLE SHELBY COUNTY",Theft,05/01/20. 01:57 PM.
al-shelby+county,"BELCHER DR, BIRMINGHAM SHELBY COUNTY",Theft,05/01/20. 02:16 PM.
al-shelby+county,"HWY 433, COUNTY SHELBY COUNTY",Theft,05/01/20. 02:19 PM.
al-shelby+county,"HONEYSUCKLE RD, HELENA SHELBY COUNTY",Other,05/01/20. 02:52 PM.
al-shelby+county,"PERTHSHIRE CT HOOV BHM, COUNTY SHELBY COUNTY",Assault,05/01/20. 02:59 PM.
al-shelby+county,"HWY 70, COLUMBIANA SHELBY COUNTY",Assault,05/01/20. 04:17 PM.
al-shelby+county,"SOUTH SHADES CREST RD, COUNTY SHELBY COUNTY",Other,05/01/20. 05:08 PM.
al-shelby+county,"HWY 47, COUNTY SHELBY COUNTY",Other,05/01/20. 05:15 PM.
al-shelby+county,"KINGS RANCH DR, WILSONVILLE SHELBY COUNTY",Other,05/01/20. 06:53 PM.
al-shelby+county,"STONECREST DR, BIRMINGHAM SHELBY COUNTY",Other,05/01/20. 02:14 AM.
al-shelby+county,UNLISTED LOCATION SHELBY COUNTY,Theft,05/01/20. 03:43 AM.
al-shelby+county,"OLD STONE DR, BIRMINGHAM SHELBY COUNTY",Assault,05/01/20. 03:58 AM.
al-shelby+county,"SCARLET LN, COUNTY SHELBY COUNTY",Theft,05/02/20. 10:15 PM.
al-shelby+county,UNLISTED LOCATION SHELBY COUNTY,Other,05/02/20. 10:24 PM.
al-shelby+county,"MCDOW RD, COLUMBIANA SHELBY COUNTY",Arrest,05/02/20. 10:28 PM.
al-shelby+county,"STONEGATE DR, BIRMINGHAM SHELBY COUNTY",Burglary,05/02/20. 10:55 PM.
al-shelby+county,"GREENHILL PKWY, BIRMINGHAM SHELBY COUNTY",Other,05/02/20. 11:00 PM.
al-shelby+county,"DUSTY HOLLOW RD, COLUMBIANA SHELBY COUNTY",Assault,05/02/20. 11:16 PM.
al-shelby+county,"VALLEYDALE RD, BIRMINGHAM SHELBY COUNTY",Burglary,05/02/20. 07:53 AM.
al-shelby+county,"HWY 31, CALERA SHELBY COUNTY",Burglary,05/02/20. 08:21 AM.
al-shelby+county,"LELA BELL LN, HARPERSVILLE SHELBY COUNTY",Arrest,05/02/20. 08:53 AM.
al-shelby+county,"HWY 32, WILSONVILLE SHELBY COUNTY",Theft,05/02/20. 01:06 PM.
al-shelby+county,"WAYHIGH LN, BIRMINGHAM SHELBY COUNTY",Theft,05/02/20. 01:54 PM.
al-shelby+county,"HWY 42, COUNTY SHELBY COUNTY",Other,05/02/20. 01:57 PM.
al-shelby+county,"CAHABA OAKS TRL, COUNTY SHELBY COUNTY",Burglary,05/02/20. 02:25 PM.
al-shelby+county,"SILVER LN, COUNTY SHELBY COUNTY",Assault,05/02/20. 02:37 PM.
al-shelby+county,UNLISTED LOCATION SHELBY COUNTY,Assault,05/02/20. 02:42 PM.
al-shelby+county,"HWY 51, WILSONVILLE SHELBY COUNTY",Theft,05/02/20. 03:58 PM.
al-shelby+county,"HUNT CLIFF RD, BIRMINGHAM SHELBY COUNTY",Other,05/02/20. 03:59 PM.
al-shelby+county,"CAHABA BEACH RD, BIRMINGHAM SHELBY COUNTY",Theft,05/02/20. 04:16 PM.
al-shelby+county,"FISHERMAN CV, COUNTY SHELBY COUNTY",Assault,05/02/20. 05:02 PM.
al-shelby+county,"HWY 57, VINCENT SHELBY COUNTY",Other,05/02/20. 05:09 PM.
al-shelby+county,"HWY 145, COLUMBIANA SHELBY COUNTY",Assault,05/02/20. 05:29 PM.
al-shelby+county,"OLD MILL CT, COUNTY SHELBY COUNTY",Theft,05/02/20. 05:51 PM.
al-shelby+county,"SUNNY MEADOWS DR, BIRMINGHAM SHELBY COUNTY",Other,05/02/20. 06:49 PM.
al-shelby+county,"MCDOW RD COLU COL, BIRMINGHAM SHELBY COUNTY",Arrest,05/02/20. 01:05 AM.
al-shelby+county,"BROOK HIGHLAND PKWY, BIRMINGHAM SHELBY COUNTY",Theft,05/02/20. 01:21 AM.
al-shelby+county,"CLEAR SPRINGS WAY, COUNTY SHELBY COUNTY",Theft,05/02/20. 01:29 AM.
al-shelby+county,UNLISTED LOCATION SHELBY COUNTY,Theft,05/02/20. 02:04 AM.
al-shelby+county,"TRUSS CURRY CIR SHEL SHE, BIRMINGHAM SHELBY COUNTY",Arrest,05/02/20. 03:23 AM.
al-shelby+county,"CHELSEA STATION DR, COUNTY SHELBY COUNTY",Other,05/02/20. 04:19 AM.
al-shelby+county,"BIRMINGHAM ST, MONTEVALLO SHELBY COUNTY",Other,05/02/20. 07:12 AM.
al-shelby+county,"VALLEYDALE RD, BIRMINGHAM SHELBY COUNTY",Theft,05/03/20. 09:22 AM.
al-shelby+county,"DEWBERRY LN, COUNTY SHELBY COUNTY",Arrest,05/03/20. 09:47 AM.
al-shelby+county,"SUNSET LN CALE CAL, BIRMINGHAM SHELBY COUNTY",Arrest,05/03/20. 10:05 AM.
al-shelby+county,"HIGHVIEW WAY CALE CAL, BIRMINGHAM SHELBY COUNTY",Arrest,05/03/20. 10:19 AM.
al-shelby+county,"HERON CV, WILSONVILLE SHELBY COUNTY",Theft,05/03/20. 10:30 AM.
al-shelby+county,UNLISTED LOCATION SHELBY COUNTY,Other,05/03/20. 11:01 AM.
al-shelby+county,"WESTOVER RD, COUNTY SHELBY COUNTY",Burglary,05/03/20. 11:26 AM.
al-shelby+county,"HWY 61, WILSONVILLE SHELBY COUNTY",Burglary,05/03/20. 11:30 AM.
al-shelby+county,"WEATHER VANE RD, CALERA SHELBY COUNTY",Arrest,05/03/20. 11:55 AM.
al-shelby+county,"HAWTHORN ST, BIRMINGHAM SHELBY COUNTY",Other,05/03/20. 12:30 PM.
al-shelby+county,"KENLEY WAY, BIRMINGHAM SHELBY COUNTY",Other,05/03/20. 01:41 PM.
al-shelby+county,"MEADOW BROOK RD, BIRMINGHAM SHELBY COUNTY",Burglary,05/03/20. 02:00 PM.
al-shelby+county,"RANDOLPH RD, MONTEVALLO SHELBY COUNTY",Other,05/03/20. 02:16 PM.
al-shelby+county,"INVERNESS CENTER PKWY, BIRMINGHAM SHELBY COUNTY",Theft,05/03/20. 03:11 PM.
al-shelby+county,"SNOW DR, COUNTY SHELBY COUNTY",Burglary,05/03/20. 03:55 PM.
al-shelby+county,UNLISTED LOCATION SHELBY COUNTY,Assault,05/03/20. 03:57 PM.
al-shelby+county,"BELVEDERE CV, BIRMINGHAM SHELBY COUNTY",Other,05/03/20. 03:59 PM.
al-shelby+county,"CAHABA VALLEY RD, BIRMINGHAM SHELBY COUNTY",Other,05/03/20. 05:38 PM.
al-shelby+county,UNLISTED LOCATION SHELBY COUNTY,Arrest,05/03/20. 06:07 PM.
al-shelby+county,"DUSTY HOLLOW RD, COLUMBIANA SHELBY COUNTY",Burglary,05/03/20. 12:51 AM.
al-shelby+county,"CHELSEA CROSSROADS, COUNTY SHELBY COUNTY",Theft,05/03/20. 01:08 AM.
al-shelby+county,"CHELSEA RD, COUNTY SHELBY COUNTY",Theft,05/03/20. 01:50 AM.
al-shelby+county,"HWY 25, WILSONVILLE SHELBY COUNTY",Theft,05/03/20. 02:17 AM.
al-shelby+county,"HWY 280, COUNTY SHELBY COUNTY",Other,05/03/20. 02:27 AM.
al-shelby+county,"ATCHISON DR, COUNTY SHELBY COUNTY",Burglary,05/03/20. 03:05 AM.
al-shelby+county,"CHELSEA PARK TRL, COUNTY SHELBY COUNTY",Theft,05/03/20. 03:28 AM.
al-shelby+county,"CUMMINGS DR, MONTEVALLO SHELBY COUNTY",Assault,05/03/20. 03:57 AM.
al-shelby+county,"ALLEN DR, COUNTY SHELBY COUNTY",Other,05/03/20. 04:05 AM.
al-shelby+county,"BIRMINGHAM ST, MONTEVALLO SHELBY COUNTY",Burglary,05/04/20. 08:04 AM.
al-shelby+county,UNLISTED LOCATION SHELBY COUNTY,Arrest,05/04/20. 09:08 AM.
al-shelby+county,"MCDOW RD, COLUMBIANA SHELBY COUNTY",Arrest,05/04/20. 11:08 AM.
al-shelby+county,"HWY 55, COUNTY SHELBY COUNTY",Assault,05/04/20. 12:33 PM.
al-shelby+county,"SHADOW OAKS DR, WILSONVILLE SHELBY COUNTY",Burglary,05/04/20. 01:59 PM.
al-shelby+county,"PARKVIEW CIR, BIRMINGHAM SHELBY COUNTY",Other,05/04/20. 02:38 PM.
al-shelby+county,"HWY 280, BIRMINGHAM SHELBY COUNTY",Other,05/04/20. 03:16 PM.
al-shelby+county,"HWY 50, COUNTY SHELBY COUNTY",Arrest,05/04/20. 04:06 PM.
al-shelby+county,"BULLET LN, WILSONVILLE SHELBY COUNTY",Other,05/04/20. 07:12 PM.
al-shelby+county,"CAMP BRANCH CIR, COUNTY SHELBY COUNTY",Theft,05/04/20. 12:18 AM.
al-shelby+county,"WHITETAIL DR, BIRMINGHAM SHELBY COUNTY",Burglary,05/04/20. 12:40 AM.
al-shelby+county,"SPRING CREEK CAMP RD, COUNTY SHELBY COUNTY",Other,05/04/20. 01:16 AM.
al-shelby+county,"CAHABA PARK CIR, BIRMINGHAM SHELBY COUNTY",Burglary,05/04/20. 02:19 AM.
al-shelby+county,"ST MICHAELS CT, COUNTY SHELBY COUNTY",Other,05/04/20. 03:36 AM.
al-shelby+county,UNLISTED LOCATION SHELBY COUNTY,Theft,05/04/20. 03:40 AM.
al-shelby+county,"HOLLYBROOK RD, COLUMBIANA SHELBY COUNTY",Arrest,05/05/20. 08:12 AM.
al-shelby+county,"LENNOX BLVD, COUNTY SHELBY COUNTY",Burglary,05/05/20. 08:35 AM.
al-shelby+county,"HOLLYBROOK RD, COLUMBIANA SHELBY COUNTY",Arrest,05/05/20. 09:02 AM.
al-shelby+county,"CHELSEA PARK DR, COUNTY SHELBY COUNTY",Theft,05/05/20. 10:13 AM.
al-shelby+county,"SIMPSON RD, WILSONVILLE SHELBY COUNTY",Arrest,05/05/20. 10:58 AM.
al-shelby+county,"PINEYWOOD RD, BIRMINGHAM SHELBY COUNTY",Other,05/05/20. 03:03 PM.
al-shelby+county,"HWY 280, COUNTY SHELBY COUNTY",Other,05/05/20. 04:36 PM.
al-shelby+county,"VALE DR, BIRMINGHAM SHELBY COUNTY",Burglary,05/05/20. 06:00 PM.
al-shelby+county,"CAHABA BEACH RD, BIRMINGHAM SHELBY COUNTY",Burglary,05/05/20. 06:11 PM.
al-shelby+county,"RIVER RD, HELENA SHELBY COUNTY",Shooting,05/05/20. 06:17 PM.
al-shelby+county,"HWY 22, MONTEVALLO SHELBY COUNTY",Other,05/05/20. 06:37 PM.
al-shelby+county,"HWY 28, COLUMBIANA SHELBY COUNTY",Other,05/05/20. 05:45 AM.
al-shelby+county,"STONECREST DR, BIRMINGHAM SHELBY COUNTY",Arrest,05/05/20. 06:38 AM.
al-shelby+county,"PARADISE COVE LN, COLUMBIANA SHELBY COUNTY",Burglary,05/06/20. 07:52 AM.
al-shelby+county,"HWY 39, COUNTY SHELBY COUNTY",Burglary,05/06/20. 08:40 AM.
al-shelby+county,"BUCK HORN CV, BIRMINGHAM SHELBY COUNTY",Other,05/06/20. 09:07 AM.
al-shelby+county,"HEATHERBROOKE PKWY, BIRMINGHAM SHELBY COUNTY",Theft,05/06/20. 09:46 AM.
al-shelby+county,"SILVER LN, COUNTY SHELBY COUNTY",Assault,05/06/20. 10:01 AM.
al-shelby+county,"MCDOW RD, COLUMBIANA SHELBY COUNTY",Arrest,05/06/20. 10:03 AM.
al-shelby+county,UNLISTED LOCATION SHELBY COUNTY,Vandalism,05/06/20. 10:30 AM.
al-shelby+county,"CHELSEA STATION CIR, COUNTY SHELBY COUNTY",Theft,05/06/20. 12:03 PM.
al-shelby+county,"VALENTINE LN, WILSONVILLE SHELBY COUNTY",Other,05/06/20. 01:43 PM.
al-shelby+county,"HWY 280, BIRMINGHAM SHELBY COUNTY",Burglary,05/06/20. 02:52 PM.
al-shelby+county,"CRYSTAL LAKE DR, COUNTY SHELBY COUNTY",Other,05/06/20. 03:05 PM.
al-shelby+county,"HWY 478, COUNTY SHELBY COUNTY",Theft,05/06/20. 03:08 PM.
al-shelby+county,"HWY 280, COUNTY SHELBY COUNTY",Theft,05/06/20. 03:36 PM.
al-shelby+county,"HWY 74, COUNTY SHELBY COUNTY",Theft,05/06/20. 03:59 PM.
al-shelby+county,"HARRIS AND WRIGHT DR, BIRMINGHAM SHELBY COUNTY",Assault,05/06/20. 04:17 PM.
al-shelby+county,"HWY 56, WILSONVILLE SHELBY COUNTY",Arrest,05/06/20. 04:51 PM.
al-shelby+county,"HWY 54, MONTEVALLO SHELBY COUNTY",Theft,05/06/20. 05:19 PM.
al-shelby+county,"HWY 99, COUNTY SHELBY COUNTY",Other,05/06/20. 05:51 PM.
al-shelby+county,"MCDOW RD, COLUMBIANA SHELBY COUNTY",Arrest,05/06/20. 06:22 PM.
al-shelby+county,"MISTY WATER DR, COLUMBIANA SHELBY COUNTY",Other,05/06/20. 12:25 AM.
al-shelby+county,"MISSIONARY RDG, BIRMINGHAM SHELBY COUNTY",Theft,05/06/20. 02:23 AM.
al-shelby+county,"SHADY ACRES LN, COUNTY SHELBY COUNTY",Burglary,05/06/20. 05:07 AM.
al-shelby+county,"FAWN MEADOWS LN, WILSONVILLE SHELBY COUNTY",Burglary,05/06/20. 05:29 AM.
al-shelby+county,"HWY 51, WILSONVILLE SHELBY COUNTY",Theft,05/07/20. 08:59 AM.
al-shelby+county,"WINDSTONE PKWY, COUNTY SHELBY COUNTY",Burglary,05/07/20. 10:33 AM.
al-shelby+county,"MCDOW RD, COLUMBIANA SHELBY COUNTY",Arrest,05/07/20. 12:01 PM.
al-shelby+county,"MCDOW RD, COLUMBIANA SHELBY COUNTY",Arrest,05/07/20. 12:06 PM.
al-shelby+county,"ALEXANDER RD, COUNTY SHELBY COUNTY",Other,05/07/20. 01:14 PM.
al-shelby+county,"HWY 280, COUNTY SHELBY COUNTY",Theft,05/07/20. 01:19 PM.
al-shelby+county,UNLISTED LOCATION SHELBY COUNTY,Theft,05/07/20. 01:34 PM.
al-shelby+county,"WOODFORD DR, BIRMINGHAM SHELBY COUNTY",Burglary,05/07/20. 01:49 PM.
al-shelby+county,"CHISM CIR, MONTEVALLO SHELBY COUNTY",Other,05/07/20. 02:06 PM.
al-shelby+county,"DUNSTAN DR, BIRMINGHAM SHELBY COUNTY",Burglary,05/07/20. 02:53 PM.
al-shelby+county,"MICKEYS CIR, HARPERSVILLE SHELBY COUNTY",Shooting,05/07/20. 03:29 PM.
al-shelby+county,"ALEXANDER RD, COUNTY SHELBY COUNTY",Other,05/07/20. 03:33 PM.
al-shelby+county,"HWY 471, COUNTY SHELBY COUNTY",Other,05/07/20. 04:40 PM.
al-shelby+county,"HIAWATHA RD, CALERA SHELBY COUNTY",Other,05/07/20. 04:50 PM.
al-shelby+county,"MEADOWLARK DR, BIRMINGHAM SHELBY COUNTY",Burglary,05/07/20. 04:52 PM.
al-shelby+county,"HWY 280, BIRMINGHAM SHELBY COUNTY",Burglary,05/07/20. 05:08 PM.
al-shelby+county,"ABBOTT SQ, BIRMINGHAM SHELBY COUNTY",Other,05/07/20. 05:14 PM.
al-shelby+county,"SELKIRK DR, BIRMINGHAM SHELBY COUNTY",Arrest,05/07/20. 05:41 PM.
al-shelby+county,"HUGHES RD, COLUMBIANA SHELBY COUNTY",Assault,05/07/20. 05:43 PM.
al-shelby+county,"MAPLEWOOD LN, COUNTY SHELBY COUNTY",Theft,05/08/20. 07:31 PM.
al-shelby+county,"HWY 280, BIRMINGHAM SHELBY COUNTY",Burglary,05/08/20. 08:55 PM.
al-shelby+county,"RIVER HILLS BUSINESS PARK, BIRMINGHAM SHELBY COUNTY",Other,05/08/20. 10:04 PM.
al-shelby+county,"MCDOW RD, COLUMBIANA SHELBY COUNTY",Arrest,05/08/20. 10:59 PM.
al-shelby+county,"HWY 56, WILSONVILLE SHELBY COUNTY",Other,05/08/20. 08:00 AM.
al-shelby+county,"LENNOX BLVD, COUNTY SHELBY COUNTY",Burglary,05/08/20. 08:28 AM.
al-shelby+county,UNLISTED LOCATION SHELBY COUNTY,Other,05/08/20. 09:06 AM.
al-shelby+county,"HWY 69, COUNTY SHELBY COUNTY",Burglary,05/08/20. 09:20 AM.
al-shelby+county,UNLISTED LOCATION SHELBY COUNTY,Theft,05/08/20. 11:14 AM.
al-shelby+county,UNLISTED LOCATION SHELBY COUNTY,Other,05/08/20. 11:47 AM.
al-shelby+county,"HWY 280, COUNTY SHELBY COUNTY",Other,05/08/20. 11:54 AM.
al-shelby+county,"HWY 303, COUNTY SHELBY COUNTY",Theft,05/08/20. 12:11 PM.
al-shelby+county,"HWY 55, COUNTY SHELBY COUNTY",Burglary,05/08/20. 01:12 PM.
al-shelby+county,"CHESSER PARK DR, COUNTY SHELBY COUNTY",Theft,05/08/20. 02:10 PM.
al-shelby+county,"HWY 119, MONTEVALLO SHELBY COUNTY",Vandalism,05/08/20. 02:47 PM.
al-shelby+county,"HICKORY RIDGE DR, BIRMINGHAM SHELBY COUNTY",Theft,05/08/20. 03:00 PM.
al-shelby+county,"GREENHILL PKWY, BIRMINGHAM SHELBY COUNTY",Theft,05/08/20. 03:03 PM.
al-shelby+county,"HWY 50, COUNTY SHELBY COUNTY",Other,05/08/20. 03:23 PM.
al-shelby+county,"CHELSEA RD, COLUMBIANA SHELBY COUNTY",Theft,05/08/20. 03:43 PM.
al-shelby+county,"HWY 48, WILSONVILLE SHELBY COUNTY",Burglary,05/08/20. 05:39 PM.
al-shelby+county,"HIGHLAND RIDGE DR, COUNTY SHELBY COUNTY",Assault,05/08/20. 05:47 PM.
al-shelby+county,"HWY 13, HELENA SHELBY COUNTY",Burglary,05/08/20. 06:04 PM.
al-shelby+county,"HWY 25, COLUMBIANA SHELBY COUNTY",Theft,05/08/20. 06:06 PM.
