Name,Address,Crime,Date
al-shelby+county,"OLD CALDWELL MILL RD, BIRMINGHAM SHELBY COUNTY",Burglary,02/05/20. 04:42 PM.
al-shelby+county,"MAIN ST, WILSONVILLE SHELBY COUNTY",Theft,02/05/20. 04:48 PM.
al-shelby+county,"RIVER HILLS BUSINESS PARK, BIRMINGHAM SHELBY COUNTY",Assault,02/05/20. 05:25 PM.
al-shelby+county,"MAIN ST, WILSONVILLE SHELBY COUNTY",Arrest,02/05/20. 05:26 PM.
al-shelby+county,"HUNT CLIFF RD, BIRMINGHAM SHELBY COUNTY",Burglary,02/05/20. 12:10 AM.
al-shelby+county,"MCDOW RD, COLUMBIANA SHELBY COUNTY",Arrest,02/05/20. 12:54 AM.
al-shelby+county,"HWY 280, BIRMINGHAM SHELBY COUNTY",Theft,02/05/20. 03:09 AM.
al-shelby+county,"DUNNAVANT VALLEY WAY, BIRMINGHAM SHELBY COUNTY",Burglary,02/05/20. 03:10 AM.
al-shelby+county,"HWY 280, BIRMINGHAM SHELBY COUNTY",Theft,02/05/20. 04:46 AM.
al-shelby+county,"CHELSEA STATION DR, COUNTY SHELBY COUNTY",Burglary,02/05/20. 05:07 AM.
al-shelby+county,"LYBRAND RD, COUNTY SHELBY COUNTY",Other,02/06/20. 06:11 PM.
al-shelby+county,UNLISTED LOCATION SHELBY COUNTY,Other,02/06/20. 08:16 PM.
al-shelby+county,"STONERIDGE LN, COUNTY SHELBY COUNTY",Other,02/06/20. 08:32 PM.
al-shelby+county,"HWY 17, MONTEVALLO SHELBY COUNTY",Other,02/06/20. 09:00 PM.
al-shelby+county,"GILMORE-NICK CIR, MONTEVALLO SHELBY COUNTY",Arrest,02/06/20. 09:14 PM.
al-shelby+county,"HWY 280, COUNTY SHELBY COUNTY",Burglary,02/06/20. 09:16 PM.
al-shelby+county,"KINNEBREW DR, COUNTY SHELBY COUNTY",Other,02/06/20. 09:41 PM.
al-shelby+county,"HWY 42, COUNTY SHELBY COUNTY",Arrest,02/06/20. 10:17 PM.
al-shelby+county,"DAVIS DR, COLUMBIANA SHELBY COUNTY",Other,02/06/20. 10:49 PM.
al-shelby+county,"MCDOW RD, COLUMBIANA SHELBY COUNTY",Robbery,02/06/20. 11:46 PM.
al-shelby+county,"HEARTHWOOD CIR, BIRMINGHAM SHELBY COUNTY",Burglary,02/06/20. 06:17 AM.
al-shelby+county,"HWY 10, MONTEVALLO SHELBY COUNTY",Theft,02/06/20. 09:52 AM.
al-shelby+county,"MCDOW RD, COLUMBIANA SHELBY COUNTY",Arrest,02/06/20. 10:16 AM.
al-shelby+county,"HWY 47, COUNTY SHELBY COUNTY",Arrest,02/06/20. 12:09 PM.
al-shelby+county,UNLISTED LOCATION SHELBY COUNTY,Theft,02/06/20. 12:45 PM.
al-shelby+county,"CAHABA OAKS TRL, COUNTY SHELBY COUNTY",Theft,02/06/20. 12:50 PM.
al-shelby+county,"HWY 17 ALMT MON, BIRMINGHAM SHELBY COUNTY",Arrest,02/06/20. 01:04 PM.
al-shelby+county,"HWY 280, BIRMINGHAM SHELBY COUNTY",Other,02/06/20. 01:36 PM.
al-shelby+county,"WILLOW BRANCH TRL, COUNTY SHELBY COUNTY",Theft,02/06/20. 01:47 PM.
al-shelby+county,"CALDWELL MILL RD NSHL BHM, COUNTY SHELBY COUNTY",Arrest,02/06/20. 02:42 PM.
al-shelby+county,"INDIAN SHOALS RD, WILSONVILLE SHELBY COUNTY",Theft,02/06/20. 02:49 PM.
al-shelby+county,"BARRISTERS CT, BIRMINGHAM SHELBY COUNTY",Other,02/06/20. 03:16 PM.
al-shelby+county,"CAHABA VALLEY RD, BIRMINGHAM SHELBY COUNTY",Assault,02/06/20. 03:22 PM.
al-shelby+county,"HWY 280, COUNTY SHELBY COUNTY",Other,02/06/20. 03:25 PM.
al-shelby+county,"SALSER LN, COLUMBIANA SHELBY COUNTY",Theft,02/06/20. 03:32 PM.
al-shelby+county,"SPRING CREEK WAY, COUNTY SHELBY COUNTY",Other,02/06/20. 03:48 PM.
al-shelby+county,UNLISTED LOCATION SHELBY COUNTY,Other,02/06/20. 04:40 PM.
al-shelby+county,"FARMINGDALE RD, HARPERSVILLE SHELBY COUNTY",Theft,02/06/20. 05:56 PM.
al-shelby+county,"HWY 47, COLUMBIANA SHELBY COUNTY",Theft,02/06/20. 06:02 PM.
al-shelby+county,"FOWLER LN, COUNTY SHELBY COUNTY",Other,02/06/20. 01:15 AM.
al-shelby+county,UNLISTED LOCATION SHELBY COUNTY,Arrest,02/06/20. 05:36 AM.
al-shelby+county,"HWY 55, COUNTY SHELBY COUNTY",Burglary,02/06/20. 06:00 AM.
al-shelby+county,"CHELSEA RIDGE DR, COLUMBIANA SHELBY COUNTY",Burglary,02/07/20. 06:24 AM.
al-shelby+county,"HWY 47, COLUMBIANA SHELBY COUNTY",Arrest,02/07/20. 07:50 AM.
al-shelby+county,"HWY 47, COLUMBIANA SHELBY COUNTY",Arrest,02/07/20. 08:03 AM.
al-shelby+county,"HWY 145, COLUMBIANA SHELBY COUNTY",Theft,02/07/20. 08:18 AM.
al-shelby+county,"NORMANDY LN PELH CHL, COUNTY SHELBY COUNTY",Arrest,02/07/20. 08:25 AM.
al-shelby+county,"GILMORE-NICK CIR ALMT MON, BIRMINGHAM SHELBY COUNTY",Arrest,02/07/20. 08:41 AM.
al-shelby+county,"HWY 11, COUNTY SHELBY COUNTY",Theft,02/07/20. 09:16 AM.
al-shelby+county,"HWY 280, BIRMINGHAM SHELBY COUNTY",Burglary,02/07/20. 10:00 AM.
al-shelby+county,"MASTERS LN, BIRMINGHAM SHELBY COUNTY",Theft,02/07/20. 10:34 AM.
al-shelby+county,"MCDOW RD, COLUMBIANA SHELBY COUNTY",Arrest,02/07/20. 11:01 AM.
al-shelby+county,"ELLIS DR, COLUMBIANA SHELBY COUNTY",Other,02/07/20. 11:48 AM.
al-shelby+county,"CARDWELL CIR ALMT MON, BIRMINGHAM SHELBY COUNTY",Arrest,02/07/20. 12:19 PM.
al-shelby+county,"CAHABA VALLEY RD, BIRMINGHAM SHELBY COUNTY",Vandalism,02/07/20. 12:24 PM.
al-shelby+county,"INVERNESS CLIFFS, BIRMINGHAM SHELBY COUNTY",Assault,02/07/20. 12:35 PM.
al-shelby+county,"HWY 280, COUNTY SHELBY COUNTY",Other,02/07/20. 12:56 PM.
al-shelby+county,"WOODBURY DR, COUNTY SHELBY COUNTY",Arrest,02/07/20. 12:56 PM.
al-shelby+county,"3RD ST NE ALAB, COLUMBIANA SHELBY COUNTY",Arrest,02/07/20. 01:01 PM.
al-shelby+county,"BUIE RD, COLUMBIANA SHELBY COUNTY",Arrest,02/07/20. 01:23 PM.
al-shelby+county,"HWY 119 ALAB, COUNTY SHELBY COUNTY",Arrest,02/07/20. 01:48 PM.
al-shelby+county,"HWY 280, COUNTY SHELBY COUNTY",Other,02/07/20. 02:39 PM.
al-shelby+county,"KNOLLWOOD DR, BIRMINGHAM SHELBY COUNTY",Theft,02/07/20. 03:01 PM.
al-shelby+county,"HWY 52, HELENA SHELBY COUNTY",Other,02/07/20. 04:22 PM.
al-shelby+county,"HWY 25, COUNTY SHELBY COUNTY",Burglary,02/07/20. 04:37 PM.
al-shelby+county,"HWY 280, BIRMINGHAM SHELBY COUNTY",Other,02/07/20. 05:32 PM.
al-shelby+county,"MCDOW RD, COLUMBIANA SHELBY COUNTY",Arrest,02/07/20. 05:56 PM.
al-shelby+county,"MONTE BELLO LN, MONTEVALLO SHELBY COUNTY",Theft,02/07/20. 01:27 AM.
al-shelby+county,"MONTE BELLO LN, MONTEVALLO SHELBY COUNTY",Other,02/07/20. 01:30 AM.
al-shelby+county,"MCDOW RD, COLUMBIANA SHELBY COUNTY",Arrest,02/07/20. 03:12 AM.
al-shelby+county,"SCARLET LN, COUNTY SHELBY COUNTY",Burglary,02/07/20. 04:11 AM.
al-shelby+county,"NARROWS PEAK CIR, BIRMINGHAM SHELBY COUNTY",Other,02/07/20. 04:31 AM.
al-shelby+county,"SPRING CREEK RD, MONTEVALLO SHELBY COUNTY",Burglary,02/07/20. 04:57 AM.
al-shelby+county,"SNOW DR, COUNTY SHELBY COUNTY",Other,02/07/20. 05:23 AM.
al-shelby+county,"KINGS HOME DR, COUNTY SHELBY COUNTY",Other,02/08/20. 06:16 PM.
al-shelby+county,"HWY 468, VINCENT SHELBY COUNTY",Vandalism,02/08/20. 06:31 PM.
al-shelby+county,"KENSINGTON CT CALE CAL, COUNTY SHELBY COUNTY",Arrest,02/08/20. 06:47 PM.
al-shelby+county,UNLISTED LOCATION SHELBY COUNTY,Other,02/08/20. 07:31 PM.
al-shelby+county,"HWY 39, COUNTY SHELBY COUNTY",Theft,02/08/20. 07:43 PM.
al-shelby+county,"22ND AVE CALE CAL, COLUMBIANA SHELBY COUNTY",Arrest,02/08/20. 07:52 PM.
al-shelby+county,"NEWSOME RD WILS WIL, COLUMBIANA SHELBY COUNTY",Arrest,02/08/20. 07:53 PM.
al-shelby+county,"HWY 145, COLUMBIANA SHELBY COUNTY",Burglary,02/08/20. 08:44 PM.
al-shelby+county,"SILVER LN, COUNTY SHELBY COUNTY",Other,02/08/20. 09:27 PM.
al-shelby+county,"MONTE VERDE LN, MONTEVALLO SHELBY COUNTY",Shooting,02/08/20. 10:01 PM.
al-shelby+county,"MANNING PL, BIRMINGHAM SHELBY COUNTY",Assault,02/08/20. 11:49 PM.
al-shelby+county,"HWY 145, COLUMBIANA SHELBY COUNTY",Burglary,02/08/20. 11:54 PM.
al-shelby+county,"SOUTHLAKE LN, BIRMINGHAM SHELBY COUNTY",Arrest,02/08/20. 07:13 AM.
al-shelby+county,"SHOAL RUN TRL NSHL BHM, COUNTY SHELBY COUNTY",Arrest,02/08/20. 07:33 AM.
al-shelby+county,"SHOAL RUN TRL NSHL BHM, MONTEVALLO SHELBY COUNTY",Arrest,02/08/20. 08:15 AM.
al-shelby+county,"HWY 54, MONTEVALLO SHELBY COUNTY",Arrest,02/08/20. 08:17 AM.
al-shelby+county,"HWY 25, MONTEVALLO SHELBY COUNTY",Theft,02/08/20. 09:11 AM.
al-shelby+county,"STONEGATE DR, BIRMINGHAM SHELBY COUNTY",Theft,02/08/20. 09:29 AM.
al-shelby+county,"GRIFFIN PARK TRCE, BIRMINGHAM SHELBY COUNTY",Burglary,02/08/20. 09:42 AM.
al-shelby+county,"HWY 25, MONTEVALLO SHELBY COUNTY",Other,02/08/20. 09:43 AM.
al-shelby+county,"CALDWELL MILL RD, BIRMINGHAM SHELBY COUNTY",Burglary,02/08/20. 10:19 AM.
al-shelby+county,"1ST AVE W ALAB MAY, COUNTY SHELBY COUNTY",Arrest,02/08/20. 12:46 PM.
al-shelby+county,"1ST AVE W HELN MAY, COUNTY SHELBY COUNTY",Arrest,02/08/20. 01:09 PM.
al-shelby+county,"HWY 443, WILSONVILLE SHELBY COUNTY",Burglary,02/08/20. 01:54 PM.
al-shelby+county,"HWY 280, COUNTY SHELBY COUNTY",Theft,02/08/20. 03:18 PM.
al-shelby+county,"HWY 41, COUNTY SHELBY COUNTY",Theft,02/08/20. 03:26 PM.
al-shelby+county,"MCDOW RD, COLUMBIANA SHELBY COUNTY",Theft,02/08/20. 04:30 PM.
al-shelby+county,"REACH WAY, BIRMINGHAM SHELBY COUNTY",Other,02/08/20. 05:56 PM.
al-shelby+county,"CHELSEA RD, COLUMBIANA SHELBY COUNTY",Burglary,02/08/20. 02:07 AM.
al-shelby+county,UNLISTED LOCATION SHELBY COUNTY,Theft,02/08/20. 03:11 AM.
al-shelby+county,"HWY 260, COUNTY SHELBY COUNTY",Other,02/08/20. 03:32 AM.
al-shelby+county,"MCDOW RD, COLUMBIANA SHELBY COUNTY",Arrest,02/08/20. 03:53 AM.
al-shelby+county,"HWY 51, COUNTY SHELBY COUNTY",Burglary,02/08/20. 04:02 AM.
al-shelby+county,"ADAMS MILL DR, COUNTY SHELBY COUNTY",Burglary,02/08/20. 04:08 AM.
al-shelby+county,"FOREST LAKES DR, COUNTY SHELBY COUNTY",Burglary,02/08/20. 04:24 AM.
al-shelby+county,UNLISTED LOCATION SHELBY COUNTY,Other,02/08/20. 04:45 AM.
al-shelby+county,UNLISTED LOCATION SHELBY COUNTY,Arrest,02/08/20. 05:36 AM.
al-shelby+county,"GRIFFIN PARK VIEW, BIRMINGHAM SHELBY COUNTY",Burglary,02/09/20. 06:45 AM.
al-shelby+county,"OLD CALDWELL MILL RD, BIRMINGHAM SHELBY COUNTY",Arrest,02/09/20. 07:19 AM.
al-shelby+county,"GOLDEN MEADOWS PL ALAB, COUNTY SHELBY COUNTY",Arrest,02/09/20. 08:44 AM.
al-shelby+county,"HWY 47, COUNTY SHELBY COUNTY",Theft,02/09/20. 09:07 AM.
al-shelby+county,"10TH AVE SW ALAB, WILSONVILLE SHELBY COUNTY",Arrest,02/09/20. 09:24 AM.
al-shelby+county,"BRELAND ST, WILSONVILLE SHELBY COUNTY",Burglary,02/09/20. 09:44 AM.
al-shelby+county,"TAHITI LN ALAB, COUNTY SHELBY COUNTY",Arrest,02/09/20. 10:12 AM.
al-shelby+county,"FOREST LAKES LN, COUNTY SHELBY COUNTY",Burglary,02/09/20. 10:47 AM.
al-shelby+county,"OLD CALDWELL MILL RD, BIRMINGHAM SHELBY COUNTY",Arrest,02/09/20. 12:25 PM.
al-shelby+county,"MCDOW RD, COLUMBIANA SHELBY COUNTY",Arrest,02/09/20. 12:26 PM.
al-shelby+county,"CHELSEA CORS, COUNTY SHELBY COUNTY",Burglary,02/09/20. 01:40 PM.
al-shelby+county,"HWY 39, COUNTY SHELBY COUNTY",Burglary,02/09/20. 01:59 PM.
al-shelby+county,"HWY 280, COUNTY SHELBY COUNTY",Burglary,02/09/20. 03:23 PM.
al-shelby+county,"KINGS HOME DR, COUNTY SHELBY COUNTY",Other,02/09/20. 03:48 PM.
al-shelby+county,"RIVER BIRCH WAY, BIRMINGHAM SHELBY COUNTY",Burglary,02/09/20. 04:46 PM.
al-shelby+county,"MAIN ST, WILSONVILLE SHELBY COUNTY",Other,02/09/20. 05:02 PM.
al-shelby+county,"MASSEY RD, COUNTY SHELBY COUNTY",Shooting,02/09/20. 05:43 PM.
al-shelby+county,"CHELSEA CORNERS WAY, COUNTY SHELBY COUNTY",Burglary,02/09/20. 12:20 AM.
al-shelby+county,"MCDOW RD, COLUMBIANA SHELBY COUNTY",Arrest,02/09/20. 01:56 AM.
al-shelby+county,"HWY 280, BIRMINGHAM SHELBY COUNTY",Arrest,02/09/20. 02:18 AM.
al-shelby+county,UNLISTED LOCATION SHELBY COUNTY,Theft,02/09/20. 03:08 AM.
al-shelby+county,UNLISTED LOCATION SHELBY COUNTY,Other,02/09/20. 03:24 AM.
al-shelby+county,"ADAMS MILL DR, COUNTY SHELBY COUNTY",Burglary,02/09/20. 03:27 AM.
al-shelby+county,"HWY 55, WILSONVILLE SHELBY COUNTY",Other,02/09/20. 04:11 AM.
al-shelby+county,"CHIPPENHAM DR, BIRMINGHAM SHELBY COUNTY",Burglary,02/10/20. 07:38 AM.
al-shelby+county,"CALDWELL MILL RD, BIRMINGHAM SHELBY COUNTY",Other,02/10/20. 08:49 AM.
al-shelby+county,"HWY 280, BIRMINGHAM SHELBY COUNTY",Theft,02/10/20. 10:33 AM.
al-shelby+county,"HILLSDALE DR SHEL COL, BIRMINGHAM SHELBY COUNTY",Arrest,02/10/20. 12:38 PM.
al-shelby+county,"HWY 43, COUNTY SHELBY COUNTY",Burglary,02/10/20. 01:11 PM.
al-shelby+county,"HWY 43, COUNTY SHELBY COUNTY",Burglary,02/10/20. 01:17 PM.
al-shelby+county,"PARADISE POINT DR, COLUMBIANA SHELBY COUNTY",Theft,02/10/20. 01:53 PM.
al-shelby+county,"HWY 221, MONTEVALLO SHELBY COUNTY",Burglary,02/10/20. 02:44 PM.
al-shelby+county,"MCDOW RD, COLUMBIANA SHELBY COUNTY",Arrest,02/10/20. 03:16 PM.
al-shelby+county,"PRESTON LN, COUNTY SHELBY COUNTY",Burglary,02/10/20. 03:23 PM.
al-shelby+county,UNLISTED LOCATION SHELBY COUNTY,Theft,02/10/20. 03:40 PM.
al-shelby+county,"CROSSBROOK TRL, COUNTY SHELBY COUNTY",Theft,02/10/20. 03:58 PM.
al-shelby+county,"KENLEY WAY, BIRMINGHAM SHELBY COUNTY",Burglary,02/10/20. 04:12 PM.
al-shelby+county,"HEATHERBROOKE PKWY, BIRMINGHAM SHELBY COUNTY",Theft,02/10/20. 04:20 PM.
al-shelby+county,"HWY 25, WILSONVILLE SHELBY COUNTY",Other,02/10/20. 04:40 PM.
al-shelby+county,"MCDOW RD, COLUMBIANA SHELBY COUNTY",Arrest,02/10/20. 05:27 PM.
al-shelby+county,"GRIFFIN PARK TRCE, BIRMINGHAM SHELBY COUNTY",Burglary,02/10/20. 12:06 AM.
al-shelby+county,"HWY 39, COUNTY SHELBY COUNTY",Theft,02/10/20. 01:08 AM.
al-shelby+county,"HWY 39 CHEL CHL, COUNTY SHELBY COUNTY",Theft,02/10/20. 01:15 AM.
al-shelby+county,"GRIFFIN CORPORATE DR, COUNTY SHELBY COUNTY",Burglary,02/10/20. 05:02 AM.
al-shelby+county,"GABLES DR, BIRMINGHAM SHELBY COUNTY",Arrest,02/11/20. 06:53 PM.
al-shelby+county,"ALTA VISTA DR, COUNTY SHELBY COUNTY",Arrest,02/11/20. 07:07 PM.
al-shelby+county,"HWY 333, COLUMBIANA SHELBY COUNTY",Arrest,02/11/20. 07:26 PM.
al-shelby+county,"STONECREST DR, BIRMINGHAM SHELBY COUNTY",Arrest,02/11/20. 07:38 PM.
al-shelby+county,"HWY 56, WILSONVILLE SHELBY COUNTY",Arrest,02/11/20. 09:18 PM.
al-shelby+county,UNLISTED LOCATION SHELBY COUNTY,Arrest,02/11/20. 09:46 PM.
al-shelby+county,"HWY 47 COLU COL, COUNTY SHELBY COUNTY",Arrest,02/11/20. 09:56 PM.
al-shelby+county,"RETREAT LN, BIRMINGHAM SHELBY COUNTY",Burglary,02/11/20. 10:54 PM.
al-shelby+county,UNLISTED LOCATION SHELBY COUNTY,Other,02/11/20. 06:11 AM.
al-shelby+county,"HWY 280, COUNTY SHELBY COUNTY",Burglary,02/11/20. 06:40 AM.
al-shelby+county,"HWY 145, COUNTY SHELBY COUNTY",Theft,02/11/20. 07:02 AM.
al-shelby+county,"EDENTON ST, BIRMINGHAM SHELBY COUNTY",Burglary,02/11/20. 07:19 AM.
al-shelby+county,"LIBERTY CV, COUNTY SHELBY COUNTY",Burglary,02/11/20. 08:32 AM.
al-shelby+county,"MEADOWLARK DR, BIRMINGHAM SHELBY COUNTY",Vandalism,02/11/20. 08:45 AM.
al-shelby+county,"HWY 77, COLUMBIANA SHELBY COUNTY",Theft,02/11/20. 09:29 AM.
al-shelby+county,"MCDOW RD, COLUMBIANA SHELBY COUNTY",Arrest,02/11/20. 10:21 AM.
al-shelby+county,"MCDOW RD, COLUMBIANA SHELBY COUNTY",Arrest,02/11/20. 10:42 AM.
al-shelby+county,"DUNNAVANT VALLEY RD, BIRMINGHAM SHELBY COUNTY",Assault,02/11/20. 12:18 PM.
al-shelby+county,"EAGLE LAKE CIR, BIRMINGHAM SHELBY COUNTY",Burglary,02/11/20. 12:30 PM.
al-shelby+county,"HWY 253, MONTEVALLO SHELBY COUNTY",Theft,02/11/20. 12:44 PM.
al-shelby+county,"HWY 280, BIRMINGHAM SHELBY COUNTY",Other,02/11/20. 03:20 PM.
al-shelby+county,"OLD HWY 280, BIRMINGHAM SHELBY COUNTY",Theft,02/11/20. 05:40 PM.
al-shelby+county,"OLD STONE DR, BIRMINGHAM SHELBY COUNTY",Burglary,02/11/20. 06:01 PM.
al-shelby+county,"TURTLE DOVE LN, COUNTY SHELBY COUNTY",Theft,02/11/20. 12:46 AM.
al-shelby+county,"HWY 280 CHEL STE, COLUMBIANA SHELBY COUNTY",Theft,02/11/20. 02:06 AM.
al-shelby+county,"HWY 35, COUNTY SHELBY COUNTY",Burglary,02/11/20. 03:44 AM.
al-shelby+county,"VALLEYDALE RD, BIRMINGHAM SHELBY COUNTY",Burglary,02/11/20. 03:54 AM.
al-shelby+county,"HWY 280, BIRMINGHAM SHELBY COUNTY",Burglary,02/12/20. 07:13 AM.
al-shelby+county,"NELSON CIR, MONTEVALLO SHELBY COUNTY",Other,02/12/20. 08:09 AM.
al-shelby+county,"DAVIS-HAWKINS ST ALMT MON, COUNTY SHELBY COUNTY",Arrest,02/12/20. 08:27 AM.
al-shelby+county,"JONESBORO CIR COLU COL, COUNTY SHELBY COUNTY",Arrest,02/12/20. 08:47 AM.
al-shelby+county,"TAHITI LN, COUNTY SHELBY COUNTY",Arrest,02/12/20. 09:25 AM.
al-shelby+county,"FALLISTON DR, HELENA SHELBY COUNTY",Arrest,02/12/20. 09:35 AM.
al-shelby+county,"MCDOW RD, COLUMBIANA SHELBY COUNTY",Arrest,02/12/20. 09:49 AM.
al-shelby+county,"STONECREST DR, BIRMINGHAM SHELBY COUNTY",Arrest,02/12/20. 10:17 AM.
al-shelby+county,"CARRIAGE DR, COUNTY SHELBY COUNTY",Arrest,02/12/20. 10:21 AM.
al-shelby+county,"SHOAL RUN TRL, BIRMINGHAM SHELBY COUNTY",Other,02/12/20. 10:28 AM.
al-shelby+county,"HWY 280, BIRMINGHAM SHELBY COUNTY",Arrest,02/12/20. 10:30 AM.
al-shelby+county,"GREYSTONE WAY, BIRMINGHAM SHELBY COUNTY",Arrest,02/12/20. 10:49 AM.
al-shelby+county,"MISSOURI RD, COUNTY SHELBY COUNTY",Arrest,02/12/20. 10:51 AM.
al-shelby+county,"HWY 280, COUNTY SHELBY COUNTY",Theft,02/12/20. 11:19 AM.
al-shelby+county,"GABLES DR, BIRMINGHAM SHELBY COUNTY",Arrest,02/12/20. 11:50 AM.
al-shelby+county,"GARDEN RIDGE CIR, BIRMINGHAM SHELBY COUNTY",Arrest,02/12/20. 12:08 PM.
al-shelby+county,"BRELAND ST, WILSONVILLE SHELBY COUNTY",Burglary,02/12/20. 12:25 PM.
al-shelby+county,"SHOAL RUN TRL, BIRMINGHAM SHELBY COUNTY",Burglary,02/12/20. 12:26 PM.
al-shelby+county,"POPLAR LOOP SHEL CAL, WILSONVILLE SHELBY COUNTY",Arrest,02/12/20. 12:57 PM.
al-shelby+county,"HWY 31 ROAD, WILSONVILLE SHELBY COUNTY",Arrest,02/12/20. 01:17 PM.
al-shelby+county,"BRELAND ST, WILSONVILLE SHELBY COUNTY",Burglary,02/12/20. 01:26 PM.
al-shelby+county,"10TH AVE, COUNTY SHELBY COUNTY",Arrest,02/12/20. 01:45 PM.
al-shelby+county,"MCDOW RD, COLUMBIANA SHELBY COUNTY",Arrest,02/12/20. 01:59 PM.
al-shelby+county,"HWY 18, MONTEVALLO SHELBY COUNTY",Arrest,02/12/20. 02:10 PM.
al-shelby+county,"SALSER LN, BIRMINGHAM SHELBY COUNTY",Arrest,02/12/20. 02:22 PM.
al-shelby+county,"MCDOW RD, COLUMBIANA SHELBY COUNTY",Arrest,02/12/20. 02:39 PM.
al-shelby+county,"HWY 71, COUNTY SHELBY COUNTY",Burglary,02/12/20. 03:14 PM.
al-shelby+county,"HWY 61, COLUMBIANA SHELBY COUNTY",Burglary,02/12/20. 03:51 PM.
al-shelby+county,"WEATHERLY WAY, COUNTY SHELBY COUNTY",Theft,02/12/20. 05:13 PM.
al-shelby+county,"HWY 280, BIRMINGHAM SHELBY COUNTY",Robbery,02/12/20. 05:45 PM.
al-shelby+county,"INVERNESS LN, BIRMINGHAM SHELBY COUNTY",Other,02/12/20. 12:20 AM.
al-shelby+county,"HWY 280, BIRMINGHAM SHELBY COUNTY",Other,02/12/20. 02:51 AM.
al-shelby+county,"SOUTH RIVER DR, COUNTY SHELBY COUNTY",Arrest,02/12/20. 05:24 AM.
al-shelby+county,"HIGHLAND PARK PL, BIRMINGHAM SHELBY COUNTY",Burglary,02/13/20. 07:51 PM.
al-shelby+county,"MOUNTAIN VISTA, COUNTY SHELBY COUNTY",Theft,02/13/20. 07:55 PM.
al-shelby+county,"MCDOW RD, COLUMBIANA SHELBY COUNTY",Arrest,02/13/20. 08:09 PM.
al-shelby+county,"EDGEWATER LN, COUNTY SHELBY COUNTY",Theft,02/13/20. 08:13 PM.
al-shelby+county,"HWY 54, MONTEVALLO SHELBY COUNTY",Arrest,02/13/20. 08:41 PM.
al-shelby+county,"SWEET APPLE CT, BIRMINGHAM SHELBY COUNTY",Other,02/13/20. 08:53 PM.
al-shelby+county,"FOREST LAKES PKWY, COUNTY SHELBY COUNTY",Theft,02/13/20. 09:06 PM.
al-shelby+county,"SPRINGFIELD LOOP, BIRMINGHAM SHELBY COUNTY",Theft,02/13/20. 09:13 PM.
al-shelby+county,"HWY 50, COUNTY SHELBY COUNTY",Theft,02/13/20. 09:20 PM.
al-shelby+county,UNLISTED LOCATION SHELBY COUNTY,Arrest,02/13/20. 09:31 PM.
al-shelby+county,"ST ANNES DR, BIRMINGHAM SHELBY COUNTY",Theft,02/13/20. 10:23 PM.
al-shelby+county,"HWY 280, COUNTY SHELBY COUNTY",Other,02/13/20. 10:46 PM.
al-shelby+county,"WILDWOOD CHAPEL RD, COLUMBIANA SHELBY COUNTY",Burglary,02/13/20. 10:47 PM.
al-shelby+county,UNLISTED LOCATION SHELBY COUNTY,Other,02/13/20. 11:09 PM.
al-shelby+county,"HEATHERBROOKE RD, BIRMINGHAM SHELBY COUNTY",Theft,02/13/20. 11:51 PM.
al-shelby+county,"WHISPER RD, VINCENT SHELBY COUNTY",Burglary,02/13/20. 06:14 AM.
al-shelby+county,"VALLEYDALE RD, BIRMINGHAM SHELBY COUNTY",Other,02/13/20. 06:25 AM.
al-shelby+county,"MOSS STONE LN, CALERA SHELBY COUNTY",Arrest,02/13/20. 07:34 AM.
al-shelby+county,"CARTER LN ALAB, COUNTY SHELBY COUNTY",Arrest,02/13/20. 08:28 AM.
al-shelby+county,"BRIDLEWOOD DR HELN HEL, WILSONVILLE SHELBY COUNTY",Arrest,02/13/20. 09:12 AM.
al-shelby+county,"RIVA RIDGE RD HELN HEL, WILSONVILLE SHELBY COUNTY",Arrest,02/13/20. 09:17 AM.
al-shelby+county,"GRAND RESERVE DR PELH PEH, WILSONVILLE SHELBY COUNTY",Arrest,02/13/20. 09:39 AM.
al-shelby+county,UNLISTED LOCATION SHELBY COUNTY,Theft,02/13/20. 09:45 AM.
al-shelby+county,"ASHTON WOODS DR, COUNTY SHELBY COUNTY",Burglary,02/13/20. 10:31 AM.
al-shelby+county,"HWY 51, COUNTY SHELBY COUNTY",Other,02/13/20. 10:45 AM.
al-shelby+county,"HWY 280, BIRMINGHAM SHELBY COUNTY",Arrest,02/13/20. 10:45 AM.
al-shelby+county,"VASSAR CIR, MONTEVALLO SHELBY COUNTY",Other,02/13/20. 10:45 AM.
al-shelby+county,"WILD IVY LN CO17 MAY, COLUMBIANA SHELBY COUNTY",Arrest,02/13/20. 11:32 AM.
al-shelby+county,"MCDOW RD, COLUMBIANA SHELBY COUNTY",Arrest,02/13/20. 11:49 AM.
al-shelby+county,"HWY 39, COUNTY SHELBY COUNTY",Assault,02/13/20. 12:32 PM.
al-shelby+county,"HWY 280, BIRMINGHAM SHELBY COUNTY",Other,02/13/20. 12:48 PM.
al-shelby+county,"ALTON DR ALAB, COUNTY SHELBY COUNTY",Arrest,02/13/20. 12:49 PM.
al-shelby+county,"COHILL DR ALAB, COUNTY SHELBY COUNTY",Arrest,02/13/20. 01:00 PM.
al-shelby+county,"HWY 47 COLU COL, COUNTY SHELBY COUNTY",Arrest,02/13/20. 01:04 PM.
al-shelby+county,"5TH AVE SE ALAB, COUNTY SHELBY COUNTY",Arrest,02/13/20. 01:10 PM.
al-shelby+county,"9TH AVE SE ALAB, COUNTY SHELBY COUNTY",Arrest,02/13/20. 01:16 PM.
al-shelby+county,"MT LAUREL AVE, BIRMINGHAM SHELBY COUNTY",Burglary,02/13/20. 01:27 PM.
al-shelby+county,"HWY 50, COUNTY SHELBY COUNTY",Theft,02/13/20. 01:47 PM.
al-shelby+county,"HWY 280, COUNTY SHELBY COUNTY",Theft,02/13/20. 02:35 PM.
al-shelby+county,"SOLOMON DR, WILSONVILLE SHELBY COUNTY",Other,02/13/20. 02:36 PM.
al-shelby+county,"HWY 54, MONTEVALLO SHELBY COUNTY",Other,02/13/20. 03:08 PM.
al-shelby+county,"MCDOW RD, COLUMBIANA SHELBY COUNTY",Arrest,02/13/20. 03:59 PM.
al-shelby+county,"HWY 155, MONTEVALLO SHELBY COUNTY",Theft,02/13/20. 04:03 PM.
al-shelby+county,UNLISTED LOCATION SHELBY COUNTY,Arrest,02/13/20. 04:05 PM.
al-shelby+county,"WILLOW WAY, BIRMINGHAM SHELBY COUNTY",Theft,02/13/20. 04:14 PM.
al-shelby+county,"INVERNESS CLIFFS, BIRMINGHAM SHELBY COUNTY",Other,02/13/20. 04:33 PM.
al-shelby+county,"GLENSTONE DR, COLUMBIANA SHELBY COUNTY",Burglary,02/13/20. 05:48 PM.
al-shelby+county,UNLISTED LOCATION SHELBY COUNTY,Theft,02/13/20. 05:55 PM.
al-shelby+county,"BROOK HIGHLAND CIR, BIRMINGHAM SHELBY COUNTY",Burglary,02/13/20. 01:15 AM.
al-shelby+county,"SPINNER DR, COUNTY SHELBY COUNTY",Burglary,02/13/20. 03:45 AM.
al-shelby+county,"HWY 22 CALJ CAL, COUNTY SHELBY COUNTY",Arrest,02/14/20. 07:20 AM.
al-shelby+county,"BROOK HIGHLAND LN, BIRMINGHAM SHELBY COUNTY",Theft,02/14/20. 07:30 AM.
al-shelby+county,"SALSER LN, BIRMINGHAM SHELBY COUNTY",Assault,02/14/20. 07:35 AM.
al-shelby+county,"HWY 39, COUNTY SHELBY COUNTY",Theft,02/14/20. 08:14 AM.
al-shelby+county,"VALLEYDALE RD, BIRMINGHAM SHELBY COUNTY",Theft,02/14/20. 08:43 AM.
al-shelby+county,"BRIDLEWOOD DR HELN HEL, COUNTY SHELBY COUNTY",Arrest,02/14/20. 09:09 AM.
al-shelby+county,"NARROWS POINT CIR, BIRMINGHAM SHELBY COUNTY",Burglary,02/14/20. 09:21 AM.
al-shelby+county,"HIDDEN TRACE CT MONT MON, COLUMBIANA SHELBY COUNTY",Arrest,02/14/20. 09:23 AM.
al-shelby+county,"HWY 47, COUNTY SHELBY COUNTY",Other,02/14/20. 10:12 AM.
al-shelby+county,"MCDOW RD, COLUMBIANA SHELBY COUNTY",Arrest,02/14/20. 10:47 AM.
al-shelby+county,"MCDOW RD, COLUMBIANA SHELBY COUNTY",Arrest,02/14/20. 11:00 AM.
al-shelby+county,"CHIPPENHAM DR, BIRMINGHAM SHELBY COUNTY",Burglary,02/14/20. 11:31 AM.
al-shelby+county,"WAXAHATCHEE LN, COUNTY SHELBY COUNTY",Other,02/14/20. 12:56 PM.
al-shelby+county,"DAVIS-HAWKINS ST ALMT MON, COUNTY SHELBY COUNTY",Arrest,02/14/20. 01:31 PM.
al-shelby+county,"WELDON DR, COUNTY SHELBY COUNTY",Theft,02/14/20. 01:38 PM.
al-shelby+county,"KENLEY WAY, BIRMINGHAM SHELBY COUNTY",Burglary,02/14/20. 02:01 PM.
al-shelby+county,"WILDWOOD CHAPEL RD, COLUMBIANA SHELBY COUNTY",Burglary,02/14/20. 02:06 PM.
al-shelby+county,"SKYLINE DR, COUNTY SHELBY COUNTY",Theft,02/14/20. 02:24 PM.
al-shelby+county,"HWY 280, BIRMINGHAM SHELBY COUNTY",Theft,02/14/20. 02:41 PM.
al-shelby+county,"HWY 280, BIRMINGHAM SHELBY COUNTY",Vandalism,02/14/20. 03:07 PM.
al-shelby+county,"CLUB PL, BIRMINGHAM SHELBY COUNTY",Burglary,02/14/20. 03:10 PM.
al-shelby+county,"CHESSER LOOP RD, COUNTY SHELBY COUNTY",Burglary,02/14/20. 03:46 PM.
al-shelby+county,"WOODBURY DR CHEL STE, COUNTY SHELBY COUNTY",Arrest,02/14/20. 04:49 PM.
al-shelby+county,"BRENT RD, COUNTY SHELBY COUNTY",Assault,02/14/20. 05:00 PM.
al-shelby+county,"HWY 280, BIRMINGHAM SHELBY COUNTY",Other,02/14/20. 05:02 PM.
al-shelby+county,"HEATHERBROOKE RD, BIRMINGHAM SHELBY COUNTY",Theft,02/14/20. 05:13 PM.
al-shelby+county,"PROVIDENCE PARK, BIRMINGHAM SHELBY COUNTY",Burglary,02/14/20. 05:29 PM.
al-shelby+county,"MCDOW RD, COLUMBIANA SHELBY COUNTY",Arrest,02/14/20. 05:44 PM.
al-shelby+county,UNLISTED LOCATION SHELBY COUNTY,Arrest,02/14/20. 06:07 PM.
al-shelby+county,"DUSTY WAY, HARPERSVILLE SHELBY COUNTY",Other,02/14/20. 01:18 AM.
al-shelby+county,"HWY 280, BIRMINGHAM SHELBY COUNTY",Burglary,02/14/20. 01:45 AM.
al-shelby+county,"CHIPPENHAM DR, BIRMINGHAM SHELBY COUNTY",Burglary,02/15/20. 06:35 AM.
al-shelby+county,"KINROSS CIR, BIRMINGHAM SHELBY COUNTY",Burglary,02/15/20. 07:45 AM.
al-shelby+county,"CAHABA VALLEY RD, BIRMINGHAM SHELBY COUNTY",Burglary,02/15/20. 08:17 AM.
al-shelby+county,"WILLOWBROOK CIR, BIRMINGHAM SHELBY COUNTY",Burglary,02/15/20. 08:31 AM.
al-shelby+county,"OLD STONE DR, BIRMINGHAM SHELBY COUNTY",Other,02/15/20. 08:49 AM.
al-shelby+county,"HWY 433, COUNTY SHELBY COUNTY",Other,02/15/20. 09:04 AM.
al-shelby+county,"HIGHLAND PARK DR, BIRMINGHAM SHELBY COUNTY",Arrest,02/15/20. 09:19 AM.
al-shelby+county,"WILMINGTON PL, BIRMINGHAM SHELBY COUNTY",Burglary,02/15/20. 09:59 AM.
al-shelby+county,"HWY 49, COLUMBIANA SHELBY COUNTY",Vandalism,02/15/20. 11:22 AM.
al-shelby+county,"COLE CIR, BIRMINGHAM SHELBY COUNTY",Burglary,02/15/20. 12:54 PM.
al-shelby+county,"MCGOWIN RD, WILSONVILLE SHELBY COUNTY",Theft,02/15/20. 01:12 PM.
al-shelby+county,"LILAC LN, WILSONVILLE SHELBY COUNTY",Theft,02/15/20. 01:24 PM.
al-shelby+county,"LODGE DR, MONTEVALLO SHELBY COUNTY",Other,02/15/20. 02:46 PM.
