Name,Address,Crime,Date
wa-yakima+county,WIDE HOLLOW RD YAKIMA COUNTY,Other,05/12/20. 08:47 PM.
wa-yakima+county,NOLA LOOP RD; 1 YAKIMA COUNTY,Assault,05/12/20. 05:53 PM.
wa-yakima+county,BUTTERFIELD RD YAKIMA COUNTY,Other,05/12/20. 06:06 PM.
wa-yakima+county,N WENAS RD YAKIMA COUNTY,Other,05/12/20. 05:24 PM.
wa-yakima+county,W HOME AVE YAKIMA COUNTY,Other,05/12/20. 05:19 PM.
wa-yakima+county,SPEYERS RD YAKIMA COUNTY,Other,05/12/20. 05:07 PM.
wa-yakima+county,N ZICKLER RD YAKIMA COUNTY,Assault,05/12/20. 04:18 PM.
wa-yakima+county,GURLEY RD YAKIMA COUNTY,Theft,05/12/20. 04:07 PM.
wa-yakima+county,DONALD RD YAKIMA COUNTY,Theft,05/12/20. 03:20 PM.
wa-yakima+county,SUNTIDES BLVD YAKIMA COUNTY,Other,05/12/20. 03:04 PM.
wa-yakima+county,N 1ST ST #55 YAKIMA COUNTY,Other,05/12/20. 01:45 PM.
wa-yakima+county,S CAMAS AVE; PARK YAKIMA COUNTY,Other,05/12/20. 12:46 PM.
wa-yakima+county,TEAR RD YAKIMA COUNTY,Vandalism,05/12/20. 11:48 AM.
wa-yakima+county,MAPLEWAY RD; NORTHWESTERN YAKIMA COUNTY,Theft,05/12/20. 11:27 AM.
wa-yakima+county,2ND AVE YAKIMA COUNTY,Other,05/12/20. 11:19 AM.
wa-yakima+county,S 96TH AVE YAKIMA COUNTY,Theft,05/12/20. 10:01 AM.
wa-yakima+county,KRINER RD YAKIMA COUNTY,Other,05/12/20. 09:50 AM.
wa-yakima+county,BLOSSOM WAY YAKIMA COUNTY,Theft,05/12/20. 09:46 AM.
wa-yakima+county,KEYS RD YAKIMA COUNTY,Other,05/12/20. 09:06 AM.
wa-yakima+county,HOUGHTON RD YAKIMA COUNTY,Vandalism,05/12/20. 08:39 AM.
wa-yakima+county,SUNTIDES BLVD YAKIMA COUNTY,Theft,05/12/20. 07:54 AM.
wa-yakima+county,POND RD YAKIMA COUNTY,Other,05/12/20. 07:33 AM.
wa-yakima+county,RAGAN RD YAKIMA COUNTY,Other,05/12/20. 07:21 AM.
wa-yakima+county,W 1ST ST; ROADRUNNER DELI YAKIMA COUNTY,Other,05/12/20. 04:37 AM.
wa-yakima+county,SCENIC DR; BLOCK YAKIMA COUNTY,Other,05/12/20. 03:16 AM.
wa-yakima+county,ELTON RD YAKIMA COUNTY,Other,05/12/20. 01:40 AM.
wa-yakima+county,BUTTERFIELD RD YAKIMA COUNTY,Other,05/12/20. 12:32 AM.
wa-yakima+county,ASHUE RD AND JONES RD YAKIMA COUNTY,Other,05/12/20. 12:29 AM.
wa-yakima+county,SCENIC DR YAKIMA COUNTY,Other,05/13/20. 09:53 PM.
wa-yakima+county,BLK FORDYCE RD YAKIMA COUNTY,Other,05/13/20. 09:43 PM.
wa-yakima+county,N WENAS RD AND RANCHETTE LN YAKIMA COUNTY,Arrest,05/13/20. 09:00 PM.
wa-yakima+county,LOST LAKE RD; CAMP GHORMLE YAKIMA COUNTY,Other,05/13/20. 09:14 PM.
wa-yakima+county,ELMWOOD RD YAKIMA COUNTY,Theft,05/13/20. 08:27 PM.
wa-yakima+county,ANNA LN YAKIMA COUNTY,Other,05/13/20. 08:14 PM.
wa-yakima+county,ALEXANDER RD YAKIMA COUNTY,Other,05/13/20. 04:53 PM.
wa-yakima+county,LUCY LN YAKIMA COUNTY,Theft,05/13/20. 05:24 PM.
wa-yakima+county,COTTONWOOD CANYON RD YAKIMA COUNTY,Other,05/13/20. 05:16 PM.
wa-yakima+county,N 33RD ST YAKIMA COUNTY,Assault,05/13/20. 03:59 PM.
wa-yakima+county,FORT RD YAKIMA COUNTY,Theft,05/13/20. 03:40 PM.
wa-yakima+county,N MCDONALD AVE YAKIMA COUNTY,Theft,05/13/20. 03:23 PM.
wa-yakima+county,LYONS LOOP YAKIMA COUNTY,Theft,05/13/20. 03:06 PM.
wa-yakima+county,PUMPHOUSE RD YAKIMA COUNTY,Other,05/13/20. 02:53 PM.
wa-yakima+county,N GRANGER RD YAKIMA COUNTY,Theft,05/13/20. 02:32 PM.
wa-yakima+county,S 1ST ST; YAKIMA COUNTY SH YAKIMA COUNTY,Other,05/13/20. 02:18 PM.
wa-yakima+county,ALBRO RD YAKIMA COUNTY,Theft,05/13/20. 02:10 PM.
wa-yakima+county,LYONS LOOP YAKIMA COUNTY,Theft,05/13/20. 01:52 PM.
wa-yakima+county,HOLLIS LN YAKIMA COUNTY,Theft,05/13/20. 01:44 PM.
wa-yakima+county,CLARK RD AND LOMBARD LOOP RD YAKIMA COUNTY,Other,05/13/20. 01:32 PM.
wa-yakima+county,THACKER RD YAKIMA COUNTY,Theft,05/13/20. 12:41 PM.
wa-yakima+county,STATE ROUTE 410 YAKIMA COUNTY,Theft,05/13/20. 11:31 AM.
wa-yakima+county,E LARUE RD AND N MEYERS RD YAKIMA COUNTY,Assault,05/13/20. 10:51 AM.
wa-yakima+county,SINCLAIR LN YAKIMA COUNTY,Theft,05/13/20. 10:50 AM.
wa-yakima+county,BLUE GOOSE RD YAKIMA COUNTY,Theft,05/13/20. 10:47 AM.
wa-yakima+county,STOVER RD AND PUTERBAUGH RD YAKIMA COUNTY,Other,05/13/20. 07:04 AM.
wa-yakima+county,BRANCH RD AND HINMAN RD YAKIMA COUNTY,Other,05/13/20. 06:15 AM.
wa-yakima+county,MIDVALE RD YAKIMA COUNTY,Other,05/13/20. 03:45 AM.
wa-yakima+county,THORP RD; CENTURY LANDING YAKIMA COUNTY,Other,05/13/20. 03:24 AM.
wa-yakima+county,OUTLOOK RD YAKIMA COUNTY,Other,05/13/20. 01:26 AM.
wa-yakima+county,W CHESTNUT AVE YAKIMA COUNTY,Other,05/14/20. 11:42 PM.
wa-yakima+county,HENNESSY RD YAKIMA COUNTY,Other,05/14/20. 11:12 PM.
wa-yakima+county,ARROWSMITH RD YAKIMA COUNTY,Assault,05/14/20. 10:56 PM.
wa-yakima+county,NASS RD YAKIMA COUNTY,Other,05/14/20. 09:48 PM.
wa-yakima+county,MAHRE RD YAKIMA COUNTY,Other,05/14/20. 09:30 PM.
wa-yakima+county,CHAPPEL LN YAKIMA COUNTY,Shooting,05/14/20. 07:06 PM.
wa-yakima+county,SUNTIDES BLVD YAKIMA COUNTY,Theft,05/14/20. 05:31 PM.
wa-yakima+county,MCKINLEY RD YAKIMA COUNTY,Other,05/14/20. 05:30 PM.
wa-yakima+county,W GOODLANDER RD YAKIMA COUNTY,Other,05/14/20. 05:17 PM.
wa-yakima+county,N 33RD ST YAKIMA COUNTY,Theft,05/14/20. 04:28 PM.
wa-yakima+county,S SIMCOE AVE YAKIMA COUNTY,Theft,05/14/20. 03:33 PM.
wa-yakima+county,STATE ROUTE 22 YAKIMA COUNTY,Theft,05/14/20. 03:24 PM.
wa-yakima+county,WELLNER RD YAKIMA COUNTY,Theft,05/14/20. 03:09 PM.
wa-yakima+county,NACHES HEIGHTS RD YAKIMA COUNTY,Theft,05/14/20. 02:33 PM.
wa-yakima+county,INDIAN CHURCH RD YAKIMA COUNTY,Other,05/14/20. 02:44 PM.
wa-yakima+county,S 42ND AVE YAKIMA COUNTY,Other,05/14/20. 01:05 PM.
wa-yakima+county,PUTERBAUGH RD YAKIMA COUNTY,Theft,05/14/20. 01:06 PM.
wa-yakima+county,W WOODIN RD YAKIMA COUNTY,Assault,05/14/20. 01:00 PM.
wa-yakima+county,HUDSON RD YAKIMA COUNTY,Theft,05/14/20. 12:06 PM.
wa-yakima+county,KINNE LN YAKIMA COUNTY,Other,05/14/20. 12:08 PM.
wa-yakima+county,S 90TH AVE YAKIMA COUNTY,Theft,05/14/20. 12:04 PM.
wa-yakima+county,ADAMSVIEW RD YAKIMA COUNTY,Theft,05/14/20. 11:15 AM.
wa-yakima+county,DOUGLAS RD YAKIMA COUNTY,Other,05/14/20. 10:53 AM.
wa-yakima+county,BITTNER RD YAKIMA COUNTY,Theft,05/14/20. 10:24 AM.
wa-yakima+county,DILLEY RD YAKIMA COUNTY,Theft,05/14/20. 10:15 AM.
wa-yakima+county,FORD LN YAKIMA COUNTY,Theft,05/14/20. 09:07 AM.
wa-yakima+county,WEBSTER RD YAKIMA COUNTY,Theft,05/14/20. 08:43 AM.
wa-yakima+county,S LESTER RD YAKIMA COUNTY,Theft,05/14/20. 08:11 AM.
wa-yakima+county,BONLOW DR AND ALLAN RD YAKIMA COUNTY,Assault,05/14/20. 07:12 AM.
wa-yakima+county,DRAPER RD AND AHTANUM RD YAKIMA COUNTY,Other,05/14/20. 06:35 AM.
wa-yakima+county,N 1ST ST; #111 YAKIMA VALL YAKIMA COUNTY,Other,05/14/20. 02:27 AM.
wa-yakima+county,SPRING VIEW DR YAKIMA COUNTY,Other,05/14/20. 02:28 AM.
wa-yakima+county,E ALEXANDER RD YAKIMA COUNTY,Other,05/15/20. 10:40 PM.
wa-yakima+county,ROBINSON RD YAKIMA COUNTY,Shooting,05/15/20. 10:31 PM.
wa-yakima+county,INTERSTATE 82 E; U:52 YAKIMA COUNTY,Shooting,05/15/20. 10:25 PM.
wa-yakima+county,N WENAS RD YAKIMA COUNTY,Other,05/15/20. 10:08 PM.
wa-yakima+county,AHTANUM RD #22; PARADISE M YAKIMA COUNTY,Assault,05/15/20. 09:24 PM.
wa-yakima+county,CEMETERY RD YAKIMA COUNTY,Other,05/15/20. 09:50 PM.
wa-yakima+county,COWICHE CITY RD; COWICHE P YAKIMA COUNTY,Other,05/15/20. 07:14 PM.
wa-yakima+county,INDIAN CREEK RD AND SR 12 YAKIMA COUNTY,Other,05/15/20. 07:05 PM.
wa-yakima+county,BEAUDRY RD; EAST VALLEY SC YAKIMA COUNTY,Theft,05/15/20. 07:13 PM.
wa-yakima+county,WANETA RD YAKIMA COUNTY,Theft,05/15/20. 03:42 PM.
wa-yakima+county,GRANDRIDGE RD #2 YAKIMA COUNTY,Theft,05/15/20. 06:05 PM.
wa-yakima+county,SR 24 AND BEAUDRY RD YAKIMA COUNTY,Other,05/15/20. 05:53 PM.
wa-yakima+county,N JOHNSON RD YAKIMA COUNTY,Theft,05/15/20. 05:38 PM.
wa-yakima+county,YAKIMA VALLEY HWY YAKIMA COUNTY,Theft,05/15/20. 05:19 PM.
wa-yakima+county,ROCK CREEK RD YAKIMA COUNTY,Theft,05/15/20. 05:17 PM.
wa-yakima+county,TERRACE HEIGHTS DR YAKIMA COUNTY,Other,05/15/20. 03:50 PM.
wa-yakima+county,GAME RIDGE RD YAKIMA COUNTY,Other,05/15/20. 04:37 PM.
wa-yakima+county,ZIER RD; U:8 YAKIMA COUNTY,Other,05/15/20. 04:30 PM.
wa-yakima+county,ORCHARD RITE RD YAKIMA COUNTY,Other,05/15/20. 04:15 PM.
wa-yakima+county,BEAUDRY RD YAKIMA COUNTY,Theft,05/15/20. 03:57 PM.
wa-yakima+county,S 99TH AVE YAKIMA COUNTY,Theft,05/15/20. 03:33 PM.
wa-yakima+county,BITTNER RD YAKIMA COUNTY,Theft,05/15/20. 03:13 PM.
wa-yakima+county,ADAMS VIEW DR YAKIMA COUNTY,Other,05/15/20. 02:40 PM.
wa-yakima+county,BIRCHFIELD RD YAKIMA COUNTY,Theft,05/15/20. 03:03 PM.
wa-yakima+county,N SKY VISTA AVE YAKIMA COUNTY,Theft,05/15/20. 02:42 PM.
wa-yakima+county,BEAM RD YAKIMA COUNTY,Theft,05/15/20. 02:17 PM.
wa-yakima+county,LUCY LN YAKIMA COUNTY,Theft,05/15/20. 02:13 PM.
wa-yakima+county,RANKIN RD YAKIMA COUNTY,Theft,05/15/20. 01:59 PM.
wa-yakima+county,CAMPBELL RD YAKIMA COUNTY,Theft,05/15/20. 01:56 PM.
wa-yakima+county,MIDVALE RD YAKIMA COUNTY,Other,05/15/20. 01:10 PM.
wa-yakima+county,NAGLER RD; LEES DRYWELL YAKIMA COUNTY,Theft,05/15/20. 12:51 PM.
wa-yakima+county,COTTONWOOD CANYON RD; U:19 YAKIMA COUNTY,Other,05/15/20. 12:36 PM.
wa-yakima+county,BIRCHFIELD RD YAKIMA COUNTY,Theft,05/15/20. 12:25 PM.
wa-yakima+county,BIRCHFIELD RD YAKIMA COUNTY,Theft,05/15/20. 12:14 PM.
wa-yakima+county,WIDE HOLLOW RD YAKIMA COUNTY,Other,05/15/20. 11:58 AM.
wa-yakima+county,COWICHE CANYON RD YAKIMA COUNTY,Other,05/15/20. 11:11 AM.
wa-yakima+county,NELSON RD YAKIMA COUNTY,Theft,05/15/20. 10:58 AM.
wa-yakima+county,TIETON DR YAKIMA COUNTY,Theft,05/15/20. 10:55 AM.
wa-yakima+county,SARA LOOP YAKIMA COUNTY,Theft,05/15/20. 10:50 AM.
wa-yakima+county,STATE ROUTE 410 YAKIMA COUNTY,Theft,05/15/20. 10:19 AM.
wa-yakima+county,OLD COWICHE RD YAKIMA COUNTY,Vandalism,05/15/20. 09:51 AM.
wa-yakima+county,SKY VISTA PL YAKIMA COUNTY,Theft,05/15/20. 09:16 AM.
wa-yakima+county,LATERAL 1 RD YAKIMA COUNTY,Other,05/15/20. 08:38 AM.
wa-yakima+county,APPLE WAY RD YAKIMA COUNTY,Vandalism,05/15/20. 07:28 AM.
wa-yakima+county,S 96TH AVE YAKIMA COUNTY,Other,05/15/20. 06:10 AM.
wa-yakima+county,N 40TH AVE; BANK OF AMERIC YAKIMA COUNTY,Other,05/15/20. 03:52 AM.
wa-yakima+county,E ALEXANDER RD YAKIMA COUNTY,Other,05/16/20. 10:53 PM.
wa-yakima+county,DAYTON RD AND PLEASANT AVE YAKIMA COUNTY,Shooting,05/16/20. 10:52 PM.
wa-yakima+county,SR 22 AND SATUS LONGHOUSE RD YAKIMA COUNTY,Other,05/16/20. 10:40 PM.
wa-yakima+county,HILLSIDE DR YAKIMA COUNTY,Other,05/16/20. 10:15 PM.
wa-yakima+county,BUTTERFIELD RD; #267 YAKIMA COUNTY,Other,05/16/20. 09:47 PM.
wa-yakima+county,SNIPES CANAL RD YAKIMA COUNTY,Other,05/16/20. 09:57 PM.
wa-yakima+county,ELMORE RD YAKIMA COUNTY,Other,05/16/20. 07:46 PM.
wa-yakima+county,S FORK RD YAKIMA COUNTY,Assault,05/16/20. 07:40 PM.
wa-yakima+county,N KERSHAW DR AND OLD NACHES YAKIMA COUNTY,Shooting,05/16/20. 06:11 PM.
wa-yakima+county,E GLEED RD YAKIMA COUNTY,Other,05/16/20. 06:59 PM.
wa-yakima+county,S JUNIPER ST; #30 YAKIMA COUNTY,Assault,05/16/20. 06:23 PM.
wa-yakima+county,STATE ROUTE 410 YAKIMA COUNTY,Other,05/16/20. 06:42 PM.
wa-yakima+county,E GLEED RD YAKIMA COUNTY,Other,05/16/20. 06:47 PM.
wa-yakima+county,N BONAIR RD AND HIGHLAND DR YAKIMA COUNTY,Other,05/16/20. 06:45 PM.
wa-yakima+county,WIERMAN RD; U:72 YAKIMA COUNTY,Other,05/16/20. 06:00 PM.
wa-yakima+county,BUTTERFIELD RD; TRLR 267 YAKIMA COUNTY,Assault,05/16/20. 06:15 PM.
wa-yakima+county,ASPEN SPRINGS LN YAKIMA COUNTY,Shooting,05/16/20. 05:48 PM.
wa-yakima+county,UPPERBANK LN AND S CAMAS AVE YAKIMA COUNTY,Other,05/16/20. 04:19 PM.
wa-yakima+county,LARUE RD; U:8 YAKIMA COUNTY,Theft,05/16/20. 03:36 PM.
wa-yakima+county,E EDISON RD YAKIMA COUNTY,Other,05/16/20. 03:33 PM.
wa-yakima+county,BRIGIT RD YAKIMA COUNTY,Shooting,05/16/20. 03:15 PM.
wa-yakima+county,ALEXANDER RD YAKIMA COUNTY,Other,05/16/20. 02:55 PM.
wa-yakima+county,HILLCREST DR YAKIMA COUNTY,Other,05/16/20. 02:45 PM.
wa-yakima+county,ALEXANDER RD YAKIMA COUNTY,Other,05/16/20. 02:40 PM.
wa-yakima+county,S WAPATO RD; ALLENS MARKET YAKIMA COUNTY,Other,05/16/20. 02:04 PM.
wa-yakima+county,LATERAL 1 RD AND COE RD YAKIMA COUNTY,Other,05/16/20. 02:05 PM.
wa-yakima+county,N HARDING AVE YAKIMA COUNTY,Theft,05/16/20. 11:39 AM.
wa-yakima+county,S NACHES RD YAKIMA COUNTY,Assault,05/16/20. 01:37 PM.
wa-yakima+county,FS1202 RD; U:32 YAKIMA COUNTY,Vandalism,05/16/20. 12:21 PM.
wa-yakima+county,N 33RD ST YAKIMA COUNTY,Other,05/16/20. 11:59 AM.
wa-yakima+county,FORSELL RD AND HORNBY RD YAKIMA COUNTY,Other,05/16/20. 11:20 AM.
wa-yakima+county,N WASCO AVE AND W 1ST ST YAKIMA COUNTY,Other,05/16/20. 11:08 AM.
wa-yakima+county,FORT RD YAKIMA COUNTY,Theft,05/16/20. 09:26 AM.
wa-yakima+county,W WAPATO RD YAKIMA COUNTY,Theft,05/16/20. 09:08 AM.
wa-yakima+county,LAVA WAY YAKIMA COUNTY,Theft,05/16/20. 09:06 AM.
wa-yakima+county,NORTH ST YAKIMA COUNTY,Other,05/16/20. 03:03 AM.
wa-yakima+county,FS1500315 RD YAKIMA COUNTY,Assault,05/16/20. 12:38 AM.
wa-yakima+county,N WENAS RD; WENAS LAKE BOA YAKIMA COUNTY,Theft,05/17/20. 11:31 PM.
wa-yakima+county,N 57TH ST; AREA OF YAKIMA COUNTY,Shooting,05/17/20. 10:13 PM.
wa-yakima+county,GOLDENDALE AVE YAKIMA COUNTY,Other,05/17/20. 09:53 PM.
wa-yakima+county,E RAILROAD AVE YAKIMA COUNTY,Other,05/17/20. 09:02 PM.
wa-yakima+county,ARROYO LN YAKIMA COUNTY,Other,05/17/20. 05:46 PM.
wa-yakima+county,REST HAVEN RD YAKIMA COUNTY,Other,05/17/20. 05:34 PM.
wa-yakima+county,COTTONWOOD CANYON RD YAKIMA COUNTY,Other,05/17/20. 05:04 PM.
wa-yakima+county,SAND HILL RD YAKIMA COUNTY,Other,05/17/20. 04:53 PM.
wa-yakima+county,RIGGS RD YAKIMA COUNTY,Other,05/17/20. 03:51 PM.
wa-yakima+county,GURLEY RD YAKIMA COUNTY,Other,05/17/20. 03:09 PM.
wa-yakima+county,PLEASANTVIEW DR YAKIMA COUNTY,Theft,05/17/20. 02:50 PM.
wa-yakima+county,GOLDING ST YAKIMA COUNTY,Other,05/17/20. 01:49 PM.
wa-yakima+county,COTTONWOOD CANYON RD YAKIMA COUNTY,Other,05/17/20. 01:58 PM.
wa-yakima+county,SCENIC CREST RD; U:14 YAKIMA COUNTY,Arrest,05/17/20. 01:44 PM.
wa-yakima+county,SCHUT RD; #104 YAKIMA COUNTY,Theft,05/17/20. 01:40 PM.
wa-yakima+county,GAP RD YAKIMA COUNTY,Other,05/17/20. 12:04 PM.
wa-yakima+county,W BIRCHFIELD RD YAKIMA COUNTY,Arrest,05/17/20. 11:29 AM.
wa-yakima+county,W WAPATO RD YAKIMA COUNTY,Other,05/17/20. 11:19 AM.
wa-yakima+county,TERRACE HGTS AND BUTTERFIELD YAKIMA COUNTY,Other,05/17/20. 11:10 AM.
wa-yakima+county,GAMACHE RD AND BIRCHFIELD RD YAKIMA COUNTY,Other,05/17/20. 09:04 AM.
wa-yakima+county,E NORMAN RD YAKIMA COUNTY,Other,05/17/20. 08:51 AM.
wa-yakima+county,S L I RD YAKIMA COUNTY,Assault,05/17/20. 06:50 AM.
wa-yakima+county,ST HILAIRE RD YAKIMA COUNTY,Other,05/17/20. 03:14 AM.
wa-yakima+county,OLMSTEAD RD YAKIMA COUNTY,Shooting,05/17/20. 01:59 AM.
wa-yakima+county,GAP RD YAKIMA COUNTY,Other,05/17/20. 01:03 AM.
wa-yakima+county,HARRAH RD YAKIMA COUNTY,Other,05/18/20. 11:44 PM.
wa-yakima+county,COTTONWOOD CANYON RD YAKIMA COUNTY,Other,05/18/20. 10:34 PM.
wa-yakima+county,PILOT LN YAKIMA COUNTY,Other,05/18/20. 09:48 PM.
wa-yakima+county,HARRAH RD YAKIMA COUNTY,Shooting,05/18/20. 09:27 PM.
wa-yakima+county,CHARVET RD YAKIMA COUNTY,Other,05/18/20. 09:05 PM.
wa-yakima+county,STATE ROUTE 821; SUNDOWN M YAKIMA COUNTY,Other,05/18/20. 07:55 PM.
wa-yakima+county,CAMPBELL RD YAKIMA COUNTY,Shooting,05/18/20. 07:35 PM.
wa-yakima+county,OLD STAGE WAY YAKIMA COUNTY,Other,05/18/20. 07:06 PM.
wa-yakima+county,SPEYERS RD; YAKIMA VALLEY YAKIMA COUNTY,Other,05/18/20. 06:01 PM.
wa-yakima+county,WILSON HWY YAKIMA COUNTY,Other,05/18/20. 05:34 PM.
wa-yakima+county,SCOON RD; VANDERSTOEL PLAC YAKIMA COUNTY,Theft,05/18/20. 05:13 PM.
wa-yakima+county,NELSON RD YAKIMA COUNTY,Theft,05/18/20. 04:59 PM.
wa-yakima+county,TIETON DR YAKIMA COUNTY,Theft,05/18/20. 04:53 PM.
wa-yakima+county,SUMMITVIEW RD YAKIMA COUNTY,Theft,05/18/20. 04:44 PM.
wa-yakima+county,S KERSHAW DR YAKIMA COUNTY,Theft,05/18/20. 04:41 PM.
wa-yakima+county,PHEASANT CREST DR YAKIMA COUNTY,Theft,05/18/20. 04:35 PM.
wa-yakima+county,ASHUE RD AND MCDONALD RD YAKIMA COUNTY,Theft,05/18/20. 04:30 PM.
wa-yakima+county,BROWN LANE YAKIMA COUNTY,Theft,05/18/20. 04:27 PM.
wa-yakima+county,W WASHINGTON AVE YAKIMA COUNTY,Other,05/18/20. 04:14 PM.
wa-yakima+county,PEAR BUTTE DR YAKIMA COUNTY,Theft,05/18/20. 04:13 PM.
wa-yakima+county,NELSON RD YAKIMA COUNTY,Theft,05/18/20. 03:35 PM.
wa-yakima+county,ANN DR YAKIMA COUNTY,Theft,05/18/20. 03:31 PM.
wa-yakima+county,RICHARTZ RD YAKIMA COUNTY,Theft,05/18/20. 03:10 PM.
wa-yakima+county,HOFFMAN RD YAKIMA COUNTY,Theft,05/18/20. 03:04 PM.
wa-yakima+county,HILLCREST DR YAKIMA COUNTY,Theft,05/18/20. 02:43 PM.
wa-yakima+county,MCKEE RD YAKIMA COUNTY,Theft,05/18/20. 02:38 PM.
wa-yakima+county,N KERSHAW DR YAKIMA COUNTY,Theft,05/18/20. 02:35 PM.
wa-yakima+county,FRALEY CUT OFF RD YAKIMA COUNTY,Other,05/18/20. 02:17 PM.
wa-yakima+county,SPEYERS RD YAKIMA COUNTY,Other,05/18/20. 02:10 PM.
wa-yakima+county,KAMIAKIN AVE YAKIMA COUNTY,Theft,05/18/20. 02:10 PM.
wa-yakima+county,TIETON DR YAKIMA COUNTY,Theft,05/18/20. 01:59 PM.
wa-yakima+county,ALLAN RD; ALLAN BROS FRUIT YAKIMA COUNTY,Other,05/18/20. 01:16 PM.
wa-yakima+county,PLEASANT HILL RD YAKIMA COUNTY,Theft,05/18/20. 01:41 PM.
wa-yakima+county,CRON LN YAKIMA COUNTY,Other,05/18/20. 01:27 PM.
wa-yakima+county,BREAUM RD; PRICE COLD STOR YAKIMA COUNTY,Assault,05/18/20. 01:18 PM.
wa-yakima+county,LAMPE RD YAKIMA COUNTY,Theft,05/18/20. 01:23 PM.
wa-yakima+county,CARLSON RD YAKIMA COUNTY,Theft,05/18/20. 01:18 PM.
wa-yakima+county,CARLSON RD YAKIMA COUNTY,Theft,05/18/20. 01:14 PM.
wa-yakima+county,S HOLLY DR; #B YAKIMA COUNTY,Shooting,05/18/20. 12:57 PM.
wa-yakima+county,E GLEED RD YAKIMA COUNTY,Other,05/18/20. 12:48 PM.
wa-yakima+county,PLEASANT HILLS DR YAKIMA COUNTY,Theft,05/18/20. 12:40 PM.
wa-yakima+county,BLAINE RD YAKIMA COUNTY,Theft,05/18/20. 12:37 PM.
wa-yakima+county,N BONAIR RD YAKIMA COUNTY,Theft,05/18/20. 12:32 PM.
wa-yakima+county,WHITE RD YAKIMA COUNTY,Theft,05/18/20. 12:03 PM.
wa-yakima+county,STATE ROUTE 410 YAKIMA COUNTY,Theft,05/18/20. 11:59 AM.
wa-yakima+county,MAPLEWAY RD YAKIMA COUNTY,Theft,05/18/20. 11:59 AM.
wa-yakima+county,S 44TH AVE YAKIMA COUNTY,Theft,05/18/20. 11:59 AM.
wa-yakima+county,BEAM RD YAKIMA COUNTY,Theft,05/18/20. 11:54 AM.
wa-yakima+county,S 44TH AVE YAKIMA COUNTY,Theft,05/18/20. 11:55 AM.
wa-yakima+county,N BONAIR RD YAKIMA COUNTY,Theft,05/18/20. 11:37 AM.
wa-yakima+county,SUMMITVIEW RD; SPENCER ROO YAKIMA COUNTY,Theft,05/18/20. 11:32 AM.
wa-yakima+county,BUCHANAN RD YAKIMA COUNTY,Theft,05/18/20. 11:34 AM.
wa-yakima+county,GANGL RD AND THORP RD YAKIMA COUNTY,Other,05/18/20. 11:17 AM.
wa-yakima+county,ESTES RD YAKIMA COUNTY,Theft,05/18/20. 11:02 AM.
wa-yakima+county,WINDY RIDGE LN YAKIMA COUNTY,Theft,05/18/20. 10:58 AM.
wa-yakima+county,COLLINS RD YAKIMA COUNTY,Theft,05/18/20. 10:27 AM.
wa-yakima+county,E 2ND ST YAKIMA COUNTY,Other,05/18/20. 10:30 AM.
wa-yakima+county,ANDERSON RD YAKIMA COUNTY,Theft,05/18/20. 10:20 AM.
wa-yakima+county,MARKS RD YAKIMA COUNTY,Theft,05/18/20. 10:20 AM.
wa-yakima+county,SPARROW LN YAKIMA COUNTY,Theft,05/18/20. 10:16 AM.
wa-yakima+county,LAMB RD YAKIMA COUNTY,Theft,05/18/20. 10:09 AM.
wa-yakima+county,CHEYNE RD YAKIMA COUNTY,Theft,05/18/20. 10:09 AM.
wa-yakima+county,MIERAS RD YAKIMA COUNTY,Theft,05/18/20. 10:01 AM.
wa-yakima+county,TURNER RD YAKIMA COUNTY,Theft,05/18/20. 09:52 AM.
wa-yakima+county,INDEPENDENCE RD YAKIMA COUNTY,Theft,05/18/20. 09:07 AM.
wa-yakima+county,SKYVIEW CT YAKIMA COUNTY,Theft,05/18/20. 08:56 AM.
wa-yakima+county,EILER LN YAKIMA COUNTY,Other,05/18/20. 08:52 AM.
wa-yakima+county,BETHANY RD YAKIMA COUNTY,Vandalism,05/18/20. 08:47 AM.
wa-yakima+county,FREIMUTH RD YAKIMA COUNTY,Theft,05/18/20. 08:42 AM.
wa-yakima+county,ROZA HILL DR YAKIMA COUNTY,Theft,05/18/20. 08:32 AM.
wa-yakima+county,SCOON RD YAKIMA COUNTY,Theft,05/18/20. 08:21 AM.
wa-yakima+county,INDEPENDENCE RD YAKIMA COUNTY,Theft,05/18/20. 06:17 AM.
wa-yakima+county,LATERAL A RD YAKIMA COUNTY,Other,05/18/20. 02:55 AM.
wa-yakima+county,BUTTERFIELD RD; YAKIMA FEN YAKIMA COUNTY,Other,05/18/20. 01:27 AM.
wa-yakima+county,MIDVALE RD YAKIMA COUNTY,Other,05/18/20. 12:33 AM.
wa-yakima+county,HARDROCK RD YAKIMA COUNTY,Other,05/19/20. 11:59 PM.
wa-yakima+county,STATE ROUTE 24 YAKIMA COUNTY,Other,05/19/20. 09:05 PM.
wa-yakima+county,COYOTE CREEK RD YAKIMA COUNTY,Theft,05/19/20. 07:39 PM.
wa-yakima+county,S ROZALEE WAY YAKIMA COUNTY,Other,05/19/20. 07:28 PM.
wa-yakima+county,DONALD WAPATO RD YAKIMA COUNTY,Other,05/19/20. 07:19 PM.
wa-yakima+county,CANYON GATE LN YAKIMA COUNTY,Assault,05/19/20. 05:05 PM.
wa-yakima+county,MIDVALE RD AND MCGEE RD YAKIMA COUNTY,Other,05/19/20. 05:31 PM.
wa-yakima+county,SAND HILL RD YAKIMA COUNTY,Theft,05/19/20. 04:36 PM.
wa-yakima+county,FRALEY CUT OFF RD YAKIMA COUNTY,Shooting,05/19/20. 04:27 PM.
wa-yakima+county,N TRACK RD AND WINAWAY RD YAKIMA COUNTY,Shooting,05/19/20. 03:32 PM.
wa-yakima+county,ALLAN RD; ALLAN BROS FRUIT YAKIMA COUNTY,Other,05/19/20. 03:06 PM.
wa-yakima+county,OLIVER DR YAKIMA COUNTY,Theft,05/19/20. 02:45 PM.
wa-yakima+county,BUENA LOOP RD; U:14 YAKIMA COUNTY,Other,05/19/20. 02:40 PM.
wa-yakima+county,STATE ROUTE 410 YAKIMA COUNTY,Theft,05/19/20. 02:09 PM.
wa-yakima+county,ZICKLER RD YAKIMA COUNTY,Theft,05/19/20. 02:00 PM.
wa-yakima+county,GOODMAN RD YAKIMA COUNTY,Theft,05/19/20. 01:52 PM.
wa-yakima+county,MCCULLOUGH RD YAKIMA COUNTY,Theft,05/19/20. 01:35 PM.
wa-yakima+county,LORRY LN YAKIMA COUNTY,Theft,05/19/20. 01:31 PM.
wa-yakima+county,WILLOWCREST DR YAKIMA COUNTY,Theft,05/19/20. 01:18 PM.
wa-yakima+county,POINT DR YAKIMA COUNTY,Theft,05/19/20. 01:17 PM.
wa-yakima+county,BRIDLE LN YAKIMA COUNTY,Theft,05/19/20. 12:49 PM.
wa-yakima+county,CEMETERY RD YAKIMA COUNTY,Theft,05/19/20. 12:45 PM.
wa-yakima+county,REST HAVEN RD YAKIMA COUNTY,Other,05/19/20. 12:32 PM.
wa-yakima+county,HENNESSY RD YAKIMA COUNTY,Theft,05/19/20. 12:36 PM.
wa-yakima+county,BRINTON RD YAKIMA COUNTY,Theft,05/19/20. 12:20 PM.
wa-yakima+county,STATE ROUTE 410 YAKIMA COUNTY,Other,05/19/20. 11:52 AM.
wa-yakima+county,MARKS RD YAKIMA COUNTY,Theft,05/19/20. 12:00 PM.
wa-yakima+county,TIETON AVE; ASSEMBLY OF GO YAKIMA COUNTY,Theft,05/19/20. 11:59 AM.
wa-yakima+county,4TH AVE YAKIMA COUNTY,Other,05/19/20. 11:48 AM.
wa-yakima+county,S 79TH AVE YAKIMA COUNTY,Theft,05/19/20. 11:46 AM.
wa-yakima+county,LATERAL B RD YAKIMA COUNTY,Other,05/19/20. 11:41 AM.
wa-yakima+county,JUSTICE DR YAKIMA COUNTY,Theft,05/19/20. 11:31 AM.
wa-yakima+county,SCENIC DR YAKIMA COUNTY,Theft,05/19/20. 11:17 AM.
wa-yakima+county,GHORMLEY RD YAKIMA COUNTY,Burglary,05/19/20. 10:39 AM.
wa-yakima+county,BEAUCHENE RD YAKIMA COUNTY,Theft,05/19/20. 11:07 AM.
wa-yakima+county,BARNHILL RD YAKIMA COUNTY,Theft,05/19/20. 10:58 AM.
wa-yakima+county,PRICE RD YAKIMA COUNTY,Theft,05/19/20. 10:57 AM.
wa-yakima+county,PRICE RD YAKIMA COUNTY,Theft,05/19/20. 10:54 AM.
wa-yakima+county,STANTON RD YAKIMA COUNTY,Theft,05/19/20. 10:50 AM.
wa-yakima+county,E HUNTZINGER RD YAKIMA COUNTY,Theft,05/19/20. 10:43 AM.
wa-yakima+county,WINCHESTER RD YAKIMA COUNTY,Theft,05/19/20. 10:34 AM.
wa-yakima+county,CRAWFORD LN YAKIMA COUNTY,Theft,05/19/20. 10:29 AM.
wa-yakima+county,HI VALLEY VIEW ST YAKIMA COUNTY,Theft,05/19/20. 10:25 AM.
wa-yakima+county,SLAVIN RD YAKIMA COUNTY,Theft,05/19/20. 10:12 AM.
wa-yakima+county,TROUT LAKE CT YAKIMA COUNTY,Theft,05/19/20. 10:18 AM.
wa-yakima+county,ROSENKRANZ RD YAKIMA COUNTY,Other,05/19/20. 09:49 AM.
wa-yakima+county,ASHUE RD YAKIMA COUNTY,Other,05/19/20. 09:19 AM.
wa-yakima+county,SPEYERS RD YAKIMA COUNTY,Theft,05/19/20. 09:14 AM.
wa-yakima+county,TAYLOR LOOP RD YAKIMA COUNTY,Other,05/19/20. 08:49 AM.
wa-yakima+county,CHARVET RD YAKIMA COUNTY,Theft,05/19/20. 08:51 AM.
wa-yakima+county,QUICK LN YAKIMA COUNTY,Other,05/19/20. 07:21 AM.
wa-yakima+county,W WAPATO RD AND STEPHENSON R YAKIMA COUNTY,Other,05/19/20. 07:18 AM.
wa-yakima+county,LARUE RD #12 YAKIMA COUNTY,Other,05/19/20. 04:15 AM.
wa-yakima+county,E BRANCH RD AND SR 97 YAKIMA COUNTY,Arrest,05/19/20. 01:42 AM.
wa-yakima+county,COWICHE CANYON RD YAKIMA COUNTY,Other,05/19/20. 01:38 AM.
wa-yakima+county,MIERAS RD YAKIMA COUNTY,Other,05/20/20. 11:37 PM.
wa-yakima+county,UNITED STATES HIGHWAY 12 YAKIMA COUNTY,Other,05/20/20. 10:24 PM.
wa-yakima+county,HARTFORD RD YAKIMA COUNTY,Other,05/20/20. 08:43 PM.
wa-yakima+county,N TRACK RD YAKIMA COUNTY,Other,05/20/20. 06:37 PM.
wa-yakima+county,UNITED STATES HIGHWAY 97 YAKIMA COUNTY,Theft,05/20/20. 04:47 PM.
wa-yakima+county,COVEY RUN YAKIMA COUNTY,Theft,05/20/20. 04:50 PM.
wa-yakima+county,PLATH RD YAKIMA COUNTY,Other,05/20/20. 04:45 PM.
wa-yakima+county,SUMMITVIEW EXT YAKIMA COUNTY,Theft,05/20/20. 04:48 PM.
wa-yakima+county,URBAN AVE YAKIMA COUNTY,Theft,05/20/20. 04:30 PM.
wa-yakima+county,KLENDON DR YAKIMA COUNTY,Theft,05/20/20. 04:27 PM.
wa-yakima+county,LIMESTONE LN YAKIMA COUNTY,Other,05/20/20. 04:17 PM.
wa-yakima+county,THORP RD YAKIMA COUNTY,Theft,05/20/20. 04:16 PM.
wa-yakima+county,GAP RD YAKIMA COUNTY,Other,05/20/20. 04:11 PM.
wa-yakima+county,VISTA VERDE DR YAKIMA COUNTY,Theft,05/20/20. 04:09 PM.
wa-yakima+county,STETTNER RD YAKIMA COUNTY,Theft,05/20/20. 09:00 AM.
wa-yakima+county,OLD NACHES HWY YAKIMA COUNTY,Theft,05/20/20. 03:23 PM.
wa-yakima+county,MOODY RD YAKIMA COUNTY,Theft,05/20/20. 03:13 PM.
wa-yakima+county,OAK BARREL LN YAKIMA COUNTY,Theft,05/20/20. 03:09 PM.
wa-yakima+county,LAMPE LN YAKIMA COUNTY,Theft,05/20/20. 03:00 PM.
wa-yakima+county,YAKIMA VALLEY HWY YAKIMA COUNTY,Theft,05/20/20. 02:31 PM.
wa-yakima+county,BIRCHFIELD RD YAKIMA COUNTY,Theft,05/20/20. 02:29 PM.
wa-yakima+county,NAGLER RD YAKIMA COUNTY,Theft,05/20/20. 02:24 PM.
wa-yakima+county,SUNNYSIDE MABTON RD YAKIMA COUNTY,Other,05/20/20. 02:04 PM.
wa-yakima+county,SCHLAGEL RD YAKIMA COUNTY,Theft,05/20/20. 01:51 PM.
wa-yakima+county,BOULDER WAY YAKIMA COUNTY,Theft,05/20/20. 01:40 PM.
wa-yakima+county,MEADOWBROOK RD YAKIMA COUNTY,Theft,05/20/20. 01:31 PM.
wa-yakima+county,I 82 AND DONALD WAPATO RD YAKIMA COUNTY,Vandalism,05/20/20. 12:36 PM.
wa-yakima+county,S 1ST ST; YAKIMA COUNTY SH YAKIMA COUNTY,Arrest,05/20/20. 12:34 PM.
