Name,Address,Crime,Date
wa-yakima+county,HARRAH RD YAKIMA COUNTY,Other,02/15/20. 12:44 PM.
wa-yakima+county,CHAMBERS RD AND SLAYTON RD YAKIMA COUNTY,Shooting,02/15/20. 12:28 PM.
wa-yakima+county,HARRAH RD YAKIMA COUNTY,Assault,02/15/20. 11:45 AM.
wa-yakima+county,SCENIC DR; BALLADURO ASSOC YAKIMA COUNTY,Vandalism,02/15/20. 10:14 AM.
wa-yakima+county,S 47TH AVE YAKIMA COUNTY,Other,02/15/20. 10:41 AM.
wa-yakima+county,MAPLE GROVE RD YAKIMA COUNTY,Other,02/15/20. 09:50 AM.
wa-yakima+county,SUMMITVIEW RD YAKIMA COUNTY,Vandalism,02/15/20. 08:49 AM.
wa-yakima+county,KONNOWAC PASS RD YAKIMA COUNTY,Vandalism,02/15/20. 07:29 AM.
wa-yakima+county,BLOSSOM WAY YAKIMA COUNTY,Assault,02/15/20. 07:28 AM.
wa-yakima+county,UNITED STATES HIGHWAY 97 YAKIMA COUNTY,Theft,02/15/20. 06:44 AM.
wa-yakima+county,AERIAL DR YAKIMA COUNTY,Other,02/15/20. 03:41 AM.
wa-yakima+county,S ELM ST AND SR 22 YAKIMA COUNTY,Arrest,02/15/20. 03:54 AM.
wa-yakima+county,MOUNTAINVIEW AVE YAKIMA COUNTY,Theft,02/15/20. 03:05 AM.
wa-yakima+county,PENCE RD YAKIMA COUNTY,Shooting,02/15/20. 02:27 AM.
wa-yakima+county,ANGUS LN YAKIMA COUNTY,Other,02/15/20. 01:12 AM.
wa-yakima+county,E NACHES AVE YAKIMA COUNTY,Other,02/15/20. 12:41 AM.
wa-yakima+county,TERRACE HEIGHTS DR; 7-11 YAKIMA COUNTY,Robbery,02/15/20. 12:29 AM.
wa-yakima+county,E I 82; MP40 E YAKIMA COUNTY,Other,02/15/20. 12:23 AM.
wa-yakima+county,FORT RD YAKIMA COUNTY,Other,02/16/20. 11:10 PM.
wa-yakima+county,PROGRESSIVE RD AND SR 97 YAKIMA COUNTY,Arrest,02/16/20. 11:05 PM.
wa-yakima+county,FORT RD AND CAMPBELL RD YAKIMA COUNTY,Arrest,02/16/20. 10:04 PM.
wa-yakima+county,EGAN RD YAKIMA COUNTY,Other,02/16/20. 10:02 PM.
wa-yakima+county,MCGONAGLE RD YAKIMA COUNTY,Other,02/16/20. 09:54 PM.
wa-yakima+county,DEKKER RD YAKIMA COUNTY,Shooting,02/16/20. 09:53 PM.
wa-yakima+county,MCCULLOUGH RD YAKIMA COUNTY,Other,02/16/20. 08:54 PM.
wa-yakima+county,THORP HEIGHTS DR YAKIMA COUNTY,Shooting,02/16/20. 08:51 PM.
wa-yakima+county,WILLOW TREE LN; #27 YAKIMA COUNTY,Theft,02/16/20. 08:12 PM.
wa-yakima+county,HORIZON VIEW LN YAKIMA COUNTY,Burglary,02/16/20. 08:13 PM.
wa-yakima+county,S WAPATO RD; ALLENS MARKET YAKIMA COUNTY,Robbery,02/16/20. 07:19 PM.
wa-yakima+county,YOST RD AND ROBBINS RD YAKIMA COUNTY,Other,02/16/20. 07:10 PM.
wa-yakima+county,LATERAL A RD AND MCDONALD RD YAKIMA COUNTY,Other,02/16/20. 06:54 PM.
wa-yakima+county,ORCHARDVALE RD YAKIMA COUNTY,Other,02/16/20. 06:29 PM.
wa-yakima+county,MCDONALD RD YAKIMA COUNTY,Other,02/16/20. 06:16 PM.
wa-yakima+county,CANAL ST YAKIMA COUNTY,Theft,02/16/20. 04:30 PM.
wa-yakima+county,STATE ROUTE 24 YAKIMA COUNTY,Burglary,02/16/20. 01:46 PM.
wa-yakima+county,VAN BELLE RD YAKIMA COUNTY,Other,02/16/20. 02:16 PM.
wa-yakima+county,MARKS RD YAKIMA COUNTY,Other,02/16/20. 02:02 PM.
wa-yakima+county,FIRING CENTER RD YAKIMA COUNTY,Other,02/16/20. 09:47 AM.
wa-yakima+county,WINDY RIDGE LN YAKIMA COUNTY,Other,02/16/20. 08:33 AM.
wa-yakima+county,FORT RD; YAKAMA INDIAN NAT YAKIMA COUNTY,Theft,02/16/20. 06:31 AM.
wa-yakima+county,W CHERRY AVE YAKIMA COUNTY,Other,02/16/20. 04:12 AM.
wa-yakima+county,S EUCLID RD AND W 5TH ST YAKIMA COUNTY,Arrest,02/16/20. 03:26 AM.
wa-yakima+county,N SKY VISTA AVE YAKIMA COUNTY,Other,02/16/20. 01:55 AM.
wa-yakima+county,GREEN VALLEY RD YAKIMA COUNTY,Other,02/16/20. 01:25 AM.
wa-yakima+county,N WENAS RD YAKIMA COUNTY,Arrest,02/16/20. 01:22 AM.
wa-yakima+county,TAYLOR LOOP RD YAKIMA COUNTY,Other,02/16/20. 01:06 AM.
wa-yakima+county,E EDISON RD YAKIMA COUNTY,Other,02/16/20. 12:47 AM.
wa-yakima+county,MAIN ST YAKIMA COUNTY,Other,02/17/20. 11:17 PM.
wa-yakima+county,RUTHERFORD RD YAKIMA COUNTY,Other,02/17/20. 09:02 PM.
wa-yakima+county,BARRETT RD YAKIMA COUNTY,Other,02/17/20. 08:47 PM.
wa-yakima+county,FORREST RD YAKIMA COUNTY,Other,02/17/20. 08:04 PM.
wa-yakima+county,LARENA LN; A YAKIMA COUNTY,Other,02/17/20. 08:01 PM.
wa-yakima+county,POM POM RD YAKIMA COUNTY,Other,02/17/20. 07:57 PM.
wa-yakima+county,STATE ROUTE 22 YAKIMA COUNTY,Assault,02/17/20. 07:41 PM.
wa-yakima+county,VIEW RIDGE RD YAKIMA COUNTY,Other,02/17/20. 07:41 PM.
wa-yakima+county,MAPLEWAY RD YAKIMA COUNTY,Theft,02/17/20. 06:40 PM.
wa-yakima+county,SHAKER CHURCH RD AND FORT RD YAKIMA COUNTY,Other,02/17/20. 05:32 PM.
wa-yakima+county,W HUDSON RD YAKIMA COUNTY,Theft,02/17/20. 05:21 PM.
wa-yakima+county,S 52ND AVE YAKIMA COUNTY,Other,02/17/20. 05:29 PM.
wa-yakima+county,TERRACE HEIGHTS DR YAKIMA COUNTY,Other,02/17/20. 05:29 PM.
wa-yakima+county,EMMA LN YAKIMA COUNTY,Vandalism,02/17/20. 03:23 PM.
wa-yakima+county,ERICKSON RD/WASHOUT RD YAKIMA COUNTY,Other,02/17/20. 02:15 PM.
wa-yakima+county,COLUMBIA ST YAKIMA COUNTY,Other,02/17/20. 09:13 AM.
wa-yakima+county,EMERALD RD YAKIMA COUNTY,Burglary,02/17/20. 07:05 AM.
wa-yakima+county,CAMPBELL RD YAKIMA COUNTY,Other,02/17/20. 06:44 AM.
wa-yakima+county,W WAPATO RD; WOLF DEN REST YAKIMA COUNTY,Other,02/17/20. 04:26 AM.
wa-yakima+county,E LINCOLN AVE; PARK N PAK YAKIMA COUNTY,Burglary,02/17/20. 03:11 AM.
wa-yakima+county,PRAIRIE RD YAKIMA COUNTY,Other,02/17/20. 01:16 AM.
wa-yakima+county,SAINT HELENS AVE YAKIMA COUNTY,Other,02/17/20. 12:12 AM.
wa-yakima+county,E 1ST ST YAKIMA COUNTY,Other,02/18/20. 11:47 PM.
wa-yakima+county,STOVER RD YAKIMA COUNTY,Other,02/18/20. 10:38 PM.
wa-yakima+county,FORT RD; YAKAMA INDIAN NAT YAKIMA COUNTY,Theft,02/18/20. 08:29 PM.
wa-yakima+county,MARSH RD YAKIMA COUNTY,Shooting,02/18/20. 07:59 PM.
wa-yakima+county,CRICKET LN YAKIMA COUNTY,Other,02/18/20. 07:10 PM.
wa-yakima+county,HOME ACRES RD YAKIMA COUNTY,Assault,02/18/20. 05:52 PM.
wa-yakima+county,CHERRY LN YAKIMA COUNTY,Other,02/18/20. 12:35 PM.
wa-yakima+county,E POMONA RD YAKIMA COUNTY,Other,02/18/20. 04:48 PM.
wa-yakima+county,E 2ND ST; NOAHS ARK YAKIMA COUNTY,Assault,02/18/20. 05:10 PM.
wa-yakima+county,HARRAH RD YAKIMA COUNTY,Other,02/18/20. 03:52 PM.
wa-yakima+county,WINAWAY RD AND N TRACK RD YAKIMA COUNTY,Other,02/18/20. 03:43 PM.
wa-yakima+county,RAY RD YAKIMA COUNTY,Theft,02/18/20. 12:46 PM.
wa-yakima+county,BEAUDRY RD; EAST VALLEY HI YAKIMA COUNTY,Assault,02/18/20. 01:21 PM.
wa-yakima+county,AHTANUM RD AND SAGEBRUSH HEI YAKIMA COUNTY,Other,02/18/20. 12:02 PM.
wa-yakima+county,MARTIN RD YAKIMA COUNTY,Theft,02/18/20. 12:09 PM.
wa-yakima+county,HULL RD YAKIMA COUNTY,Other,02/18/20. 12:20 PM.
wa-yakima+county,YOUNGSTOWN RD YAKIMA COUNTY,Other,02/18/20. 12:03 PM.
wa-yakima+county,DONALD WAPATO RD YAKIMA COUNTY,Theft,02/18/20. 12:02 PM.
wa-yakima+county,FORT RD; LEGENDS CASINO YAKIMA COUNTY,Theft,02/18/20. 10:22 AM.
wa-yakima+county,DURHAM RD YAKIMA COUNTY,Assault,02/18/20. 10:23 AM.
wa-yakima+county,S 18TH AVE YAKIMA COUNTY,Assault,02/18/20. 08:41 AM.
wa-yakima+county,1ST ST YAKIMA COUNTY,Other,02/18/20. 09:42 AM.
wa-yakima+county,MAPLE CT; TERRACE HEIGHTS YAKIMA COUNTY,Assault,02/18/20. 08:00 AM.
wa-yakima+county,HIGHLAND RD YAKIMA COUNTY,Other,02/18/20. 07:24 AM.
wa-yakima+county,BRANCH RD YAKIMA COUNTY,Other,02/18/20. 06:52 AM.
wa-yakima+county,POND RD YAKIMA COUNTY,Other,02/18/20. 03:15 AM.
wa-yakima+county,BRIDGE VISTA LN YAKIMA COUNTY,Other,02/18/20. 02:30 AM.
wa-yakima+county,MEADOWBROOK RD YAKIMA COUNTY,Theft,02/18/20. 01:19 AM.
wa-yakima+county,E ALEXANDER RD YAKIMA COUNTY,Other,02/19/20. 11:28 PM.
wa-yakima+county,MARTY SOUTH DR YAKIMA COUNTY,Theft,02/19/20. 10:27 PM.
wa-yakima+county,STATE ROUTE 410 YAKIMA COUNTY,Theft,02/19/20. 08:53 PM.
wa-yakima+county,UNITED STATES HIGHWAY 12 YAKIMA COUNTY,Other,02/19/20. 07:49 PM.
wa-yakima+county,GURLEY RD YAKIMA COUNTY,Burglary,02/19/20. 07:23 PM.
wa-yakima+county,DIVISION RD YAKIMA COUNTY,Other,02/19/20. 05:51 PM.
wa-yakima+county,CASEY RD AND LARUE RD YAKIMA COUNTY,Other,02/19/20. 05:51 PM.
wa-yakima+county,N WENAS RD YAKIMA COUNTY,Other,02/19/20. 04:40 PM.
wa-yakima+county,W 1ST ST; U:16 YAKIMA COUNTY,Assault,02/19/20. 06:05 PM.
wa-yakima+county,SHOTGUN LN YAKIMA COUNTY,Other,02/19/20. 05:39 PM.
wa-yakima+county,MILLENIUM AVE YAKIMA COUNTY,Other,02/19/20. 04:08 PM.
wa-yakima+county,N WENAS RD YAKIMA COUNTY,Other,02/19/20. 04:57 PM.
wa-yakima+county,SANDY LN YAKIMA COUNTY,Vandalism,02/19/20. 04:24 PM.
wa-yakima+county,MT AIX WAY YAKIMA COUNTY,Theft,02/19/20. 04:14 PM.
wa-yakima+county,STATE ROUTE 821 #23 YAKIMA COUNTY,Burglary,02/19/20. 03:40 PM.
wa-yakima+county,ORCHARD WAY YAKIMA COUNTY,Theft,02/19/20. 03:47 PM.
wa-yakima+county,S 74TH AVE YAKIMA COUNTY,Theft,02/19/20. 03:39 PM.
wa-yakima+county,S 18TH AVE #A YAKIMA COUNTY,Other,02/19/20. 03:14 PM.
wa-yakima+county,LATERAL A RD YAKIMA COUNTY,Other,02/19/20. 02:09 PM.
wa-yakima+county,BIRCHFIELD RD YAKIMA COUNTY,Theft,02/19/20. 01:38 PM.
wa-yakima+county,YAKIMA VALLEY HWY YAKIMA COUNTY,Other,02/19/20. 01:14 PM.
wa-yakima+county,ZIER RD; WEST VALLEY HIGH YAKIMA COUNTY,Assault,02/19/20. 12:55 PM.
wa-yakima+county,N 2ND ST; YAKIMA COUNTY CO YAKIMA COUNTY,Arrest,02/19/20. 08:30 AM.
wa-yakima+county,GARRETSON LN; THE RANGE YAKIMA COUNTY,Vandalism,02/19/20. 10:14 AM.
wa-yakima+county,THORP RD; #11 YAKIMA COUNTY,Other,02/19/20. 08:50 AM.
wa-yakima+county,BUTTERFIELD RD AND TERRACE H YAKIMA COUNTY,Other,02/19/20. 07:26 AM.
wa-yakima+county,VAN BELLE RD; U:19 YAKIMA COUNTY,Other,02/19/20. 02:20 AM.
wa-yakima+county,W WAPATO RD; WOLF DEN REST YAKIMA COUNTY,Arrest,02/20/20. 10:48 PM.
wa-yakima+county,OLD NACHES HWY YAKIMA COUNTY,Other,02/20/20. 10:40 PM.
wa-yakima+county,FORT RD; YAKAMA INDIAN NAT YAKIMA COUNTY,Arrest,02/20/20. 09:52 PM.
wa-yakima+county,MARTY SOUTH DR YAKIMA COUNTY,Other,02/20/20. 09:03 PM.
wa-yakima+county,ROCKSTROM RD YAKIMA COUNTY,Other,02/20/20. 07:30 PM.
wa-yakima+county,2ND AVE YAKIMA COUNTY,Other,02/20/20. 08:36 PM.
wa-yakima+county,ALMO RD YAKIMA COUNTY,Other,02/20/20. 08:23 PM.
wa-yakima+county,E BARTLETT AVE YAKIMA COUNTY,Other,02/20/20. 07:58 PM.
wa-yakima+county,KRINER RD YAKIMA COUNTY,Other,02/20/20. 06:48 PM.
wa-yakima+county,S 47TH AVE YAKIMA COUNTY,Other,02/20/20. 04:42 PM.
wa-yakima+county,LUCY LN YAKIMA COUNTY,Other,02/20/20. 05:18 PM.
wa-yakima+county,BUENA LOOP RD YAKIMA COUNTY,Other,02/20/20. 04:54 PM.
wa-yakima+county,DONALD WAPATO RD; HOPTOWN YAKIMA COUNTY,Other,02/20/20. 04:28 PM.
wa-yakima+county,W PIONEER ST YAKIMA COUNTY,Burglary,02/20/20. 03:47 PM.
wa-yakima+county,CAMPBELL RD YAKIMA COUNTY,Theft,02/20/20. 03:14 PM.
wa-yakima+county,ASHUE RD YAKIMA COUNTY,Other,02/20/20. 03:02 PM.
wa-yakima+county,N 2ND ST; YAKIMA COUNTY YAKIMA COUNTY,Other,02/20/20. 02:30 PM.
wa-yakima+county,MARSH RD AND N 15TH ST YAKIMA COUNTY,Other,02/20/20. 02:50 PM.
wa-yakima+county,DEKKER RD YAKIMA COUNTY,Other,02/20/20. 02:28 PM.
wa-yakima+county,N 2ND ST; YAKIMA COUNTY CO YAKIMA COUNTY,Other,02/20/20. 02:20 PM.
wa-yakima+county,VAN BELLE RD YAKIMA COUNTY,Theft,02/20/20. 01:14 PM.
wa-yakima+county,E 2ND ST; NOAHS ARK YAKIMA COUNTY,Other,02/20/20. 01:10 PM.
wa-yakima+county,E BRANCH RD YAKIMA COUNTY,Burglary,02/20/20. 12:08 PM.
wa-yakima+county,ZIER RD; WEST VALLEY FRESH YAKIMA COUNTY,Other,02/20/20. 12:13 PM.
wa-yakima+county,WHITE RD YAKIMA COUNTY,Theft,02/20/20. 12:00 PM.
wa-yakima+county,ZIMMERMAN RD YAKIMA COUNTY,Other,02/20/20. 11:37 AM.
wa-yakima+county,W CENTENNIAL DR; FAITH COM YAKIMA COUNTY,Other,02/20/20. 11:24 AM.
wa-yakima+county,N 2ND ST; YAKIMA COUNTY CO YAKIMA COUNTY,Other,02/20/20. 10:20 AM.
wa-yakima+county,N 2ND ST; YAKIMA COUNTY CO YAKIMA COUNTY,Other,02/20/20. 09:44 AM.
wa-yakima+county,WIDE HOLLOW RD YAKIMA COUNTY,Theft,02/20/20. 05:40 AM.
wa-yakima+county,DOUGLAS RD YAKIMA COUNTY,Theft,02/20/20. 05:33 AM.
wa-yakima+county,FORT RD; YAKAMA INDIAN NAT YAKIMA COUNTY,Vandalism,02/20/20. 04:43 AM.
wa-yakima+county,ROUSE RD YAKIMA COUNTY,Other,02/20/20. 02:41 AM.
wa-yakima+county,N WENAS RD YAKIMA COUNTY,Other,02/20/20. 01:16 AM.
wa-yakima+county,WEIKEL RD AND NACHES HGTS YAKIMA COUNTY,Other,02/20/20. 12:55 AM.
wa-yakima+county,GURLEY RD YAKIMA COUNTY,Other,02/20/20. 12:50 AM.
wa-yakima+county,KNOWLES RD YAKIMA COUNTY,Other,02/21/20. 09:40 PM.
wa-yakima+county,SAGE TRAIL RD; BLOCK YAKIMA COUNTY,Shooting,02/21/20. 11:08 PM.
wa-yakima+county,WIDE HOLLOW RD YAKIMA COUNTY,Other,02/21/20. 11:01 PM.
wa-yakima+county,OLD NACHES HWY AND SHADBOLT YAKIMA COUNTY,Shooting,02/21/20. 10:34 PM.
wa-yakima+county,HORNBY RD AND TEAR RD YAKIMA COUNTY,Other,02/21/20. 09:52 PM.
wa-yakima+county,MAPLEWAY RD YAKIMA COUNTY,Other,02/21/20. 07:30 PM.
wa-yakima+county,CAMPBELL RD YAKIMA COUNTY,Other,02/21/20. 07:50 PM.
wa-yakima+county,AHTANUM RD YAKIMA COUNTY,Theft,02/21/20. 07:33 PM.
wa-yakima+county,DONALD WAPATO RD; DONALD S YAKIMA COUNTY,Theft,02/21/20. 04:32 PM.
wa-yakima+county,NOLA LOOP RD YAKIMA COUNTY,Other,02/21/20. 05:18 PM.
wa-yakima+county,YAKIMA VALLEY HWY YAKIMA COUNTY,Theft,02/21/20. 04:08 PM.
wa-yakima+county,PIONEER WAY YAKIMA COUNTY,Burglary,02/21/20. 04:01 PM.
wa-yakima+county,CANYON RD YAKIMA COUNTY,Other,02/21/20. 03:37 PM.
wa-yakima+county,N CAMAS AVE YAKIMA COUNTY,Other,02/21/20. 03:24 PM.
wa-yakima+county,W 1ST ST YAKIMA COUNTY,Assault,02/21/20. 03:12 PM.
wa-yakima+county,UNITED STATES HIGHWAY 12 YAKIMA COUNTY,Other,02/21/20. 02:49 PM.
wa-yakima+county,W WAPATO RD; WOLF DEN REST YAKIMA COUNTY,Other,02/21/20. 02:45 PM.
wa-yakima+county,2ND AVE YAKIMA COUNTY,Assault,02/21/20. 01:31 PM.
wa-yakima+county,E MCDONALD RD YAKIMA COUNTY,Assault,02/21/20. 11:52 AM.
wa-yakima+county,N WENAS RD; BLACK FOREST T YAKIMA COUNTY,Other,02/21/20. 11:18 AM.
wa-yakima+county,S 96TH AVE YAKIMA COUNTY,Theft,02/21/20. 11:19 AM.
wa-yakima+county,SR 97 AND LATERAL 1 RD YAKIMA COUNTY,Other,02/21/20. 10:04 AM.
wa-yakima+county,LATERAL 1 RD YAKIMA COUNTY,Theft,02/21/20. 10:44 AM.
wa-yakima+county,SHAFER AVE; NACHES VALLEY YAKIMA COUNTY,Assault,02/21/20. 09:42 AM.
wa-yakima+county,S 1ST ST; YAKIMA COUNTY SH YAKIMA COUNTY,Other,02/21/20. 09:30 AM.
wa-yakima+county,KAYS RD YAKIMA COUNTY,Burglary,02/21/20. 08:10 AM.
wa-yakima+county,STARK RD; 14 YAKIMA COUNTY,Other,02/21/20. 08:51 AM.
wa-yakima+county,N TRACK RD YAKIMA COUNTY,Other,02/21/20. 07:10 AM.
wa-yakima+county,BIRCHFIELD RD YAKIMA COUNTY,Other,02/21/20. 04:48 AM.
wa-yakima+county,E PARKER HEIGHTS RD; U:25 YAKIMA COUNTY,Other,02/21/20. 03:50 AM.
wa-yakima+county,VICTORY LN YAKIMA COUNTY,Other,02/21/20. 03:35 AM.
wa-yakima+county,SUNNYSIDE MABTON RD YAKIMA COUNTY,Assault,02/21/20. 01:28 AM.
wa-yakima+county,DEERING RD YAKIMA COUNTY,Other,02/21/20. 01:41 AM.
wa-yakima+county,GAMACHE RD YAKIMA COUNTY,Other,02/22/20. 11:25 PM.
wa-yakima+county,FISK RD YAKIMA COUNTY,Other,02/22/20. 10:41 PM.
wa-yakima+county,S 58TH ST YAKIMA COUNTY,Other,02/22/20. 09:07 PM.
wa-yakima+county,RESERVATION ST YAKIMA COUNTY,Other,02/22/20. 09:54 PM.
wa-yakima+county,ST HILAIRE RD YAKIMA COUNTY,Other,02/22/20. 07:21 PM.
wa-yakima+county,1ST ST YAKIMA COUNTY,Other,02/22/20. 08:48 PM.
wa-yakima+county,SOUTH ST AND E 5TH ST YAKIMA COUNTY,Other,02/22/20. 08:18 PM.
wa-yakima+county,DONALD RD YAKIMA COUNTY,Other,02/22/20. 08:15 PM.
wa-yakima+county,W CENTENNIAL DR YAKIMA COUNTY,Other,02/22/20. 07:30 PM.
wa-yakima+county,HULL RD YAKIMA COUNTY,Other,02/22/20. 07:01 PM.
wa-yakima+county,UNITED STATES HIGHWAY 12 YAKIMA COUNTY,Theft,02/22/20. 06:36 PM.
wa-yakima+county,MEADOW CT YAKIMA COUNTY,Other,02/22/20. 05:13 PM.
wa-yakima+county,WIERMAN RD YAKIMA COUNTY,Shooting,02/22/20. 04:40 PM.
wa-yakima+county,COWICHE MILL RD; U:14 YAKIMA COUNTY,Other,02/22/20. 04:09 PM.
wa-yakima+county,MEADOWBROOK RD YAKIMA COUNTY,Theft,02/22/20. 03:52 PM.
wa-yakima+county,RIDGEWAY DR YAKIMA COUNTY,Other,02/22/20. 02:45 PM.
wa-yakima+county,N ZICKLER RD YAKIMA COUNTY,Theft,02/22/20. 02:28 PM.
wa-yakima+county,BUTTERFIELD RD YAKIMA COUNTY,Other,02/22/20. 11:43 AM.
wa-yakima+county,N BONAIR RD YAKIMA COUNTY,Burglary,02/22/20. 11:50 AM.
wa-yakima+county,CAYUSE LN YAKIMA COUNTY,Other,02/22/20. 11:34 AM.
wa-yakima+county,GURLEY RD YAKIMA COUNTY,Theft,02/22/20. 11:35 AM.
wa-yakima+county,UNITED STATES HIGHWAY 12 YAKIMA COUNTY,Theft,02/22/20. 09:48 AM.
wa-yakima+county,E ZILLAH DR YAKIMA COUNTY,Theft,02/22/20. 09:13 AM.
wa-yakima+county,FOUNTAIN BLVD #25; YSO YAKIMA COUNTY,Arrest,02/22/20. 08:55 AM.
wa-yakima+county,AHTANUM RD YAKIMA COUNTY,Other,02/22/20. 03:56 AM.
wa-yakima+county,E 2ND ST; NOAHS ARK YAKIMA COUNTY,Other,02/22/20. 02:23 AM.
wa-yakima+county,FORT RD; YAKAMA INDIAN NAT YAKIMA COUNTY,Theft,02/22/20. 02:05 AM.
wa-yakima+county,CHERRY LN AND HICKORY RD YAKIMA COUNTY,Other,02/22/20. 01:02 AM.
wa-yakima+county,SHADOW LN YAKIMA COUNTY,Other,02/23/20. 11:32 PM.
wa-yakima+county,SYCAMORE DR YAKIMA COUNTY,Shooting,02/23/20. 09:20 PM.
wa-yakima+county,E A ST YAKIMA COUNTY,Other,02/23/20. 07:56 PM.
wa-yakima+county,MCCULLOUGH RD YAKIMA COUNTY,Other,02/23/20. 05:14 PM.
wa-yakima+county,ALBRO RD YAKIMA COUNTY,Assault,02/23/20. 04:03 PM.
wa-yakima+county,N OLDENWAY RD YAKIMA COUNTY,Other,02/23/20. 04:40 PM.
wa-yakima+county,FISK RD YAKIMA COUNTY,Other,02/23/20. 04:24 PM.
wa-yakima+county,UNITED STATES HIGHWAY 12; YAKIMA COUNTY,Theft,02/23/20. 03:20 PM.
wa-yakima+county,MAPLE AVE #6 YAKIMA COUNTY,Other,02/23/20. 03:09 PM.
wa-yakima+county,CREST ACRES PLACE YAKIMA COUNTY,Theft,02/23/20. 02:44 PM.
wa-yakima+county,NEWQUIST RD YAKIMA COUNTY,Burglary,02/23/20. 02:50 PM.
wa-yakima+county,SHEEP COMPANY RD; LT MURRA YAKIMA COUNTY,Other,02/23/20. 03:01 PM.
wa-yakima+county,WESLEY RD YAKIMA COUNTY,Burglary,02/23/20. 01:51 PM.
wa-yakima+county,S 74TH AVE YAKIMA COUNTY,Other,02/23/20. 02:23 PM.
wa-yakima+county,YAKIMA ST YAKIMA COUNTY,Burglary,02/23/20. 01:00 PM.
wa-yakima+county,YAKIMA ST YAKIMA COUNTY,Burglary,02/23/20. 12:07 PM.
wa-yakima+county,N TRACK RD YAKIMA COUNTY,Assault,02/23/20. 11:54 AM.
wa-yakima+county,S OLDENWAY RD YAKIMA COUNTY,Theft,02/23/20. 10:52 AM.
wa-yakima+county,N PARK CENTRE; SOLARITY CR YAKIMA COUNTY,Other,02/23/20. 11:24 AM.
wa-yakima+county,PROGRESSIVE RD YAKIMA COUNTY,Other,02/23/20. 10:23 AM.
wa-yakima+county,CLARK RD YAKIMA COUNTY,Burglary,02/23/20. 09:25 AM.
wa-yakima+county,NOLA LOOP RD; 104A YAKIMA COUNTY,Other,02/23/20. 06:43 AM.
wa-yakima+county,AHTANUM RD YAKIMA COUNTY,Other,02/23/20. 06:16 AM.
wa-yakima+county,DONALD WAPATO RD; DONALD S YAKIMA COUNTY,Other,02/23/20. 05:05 AM.
wa-yakima+county,EAGLE WAY YAKIMA COUNTY,Other,02/23/20. 04:04 AM.
wa-yakima+county,SAGE TRAIL RD YAKIMA COUNTY,Other,02/23/20. 03:45 AM.
wa-yakima+county,FORT RD; YAKAMA INDIAN NAT YAKIMA COUNTY,Other,02/23/20. 02:21 AM.
wa-yakima+county,BARNES RD YAKIMA COUNTY,Other,02/23/20. 01:43 AM.
wa-yakima+county,ELTON RD YAKIMA COUNTY,Other,02/23/20. 02:11 AM.
wa-yakima+county,HILLCREST DR YAKIMA COUNTY,Other,02/23/20. 12:11 AM.
wa-yakima+county,MEADOWBROOK RD YAKIMA COUNTY,Other,02/24/20. 09:44 PM.
wa-yakima+county,BARKES RD YAKIMA COUNTY,Other,02/24/20. 09:13 PM.
wa-yakima+county,W WAPATO RD; WOLF DEN REST YAKIMA COUNTY,Other,02/24/20. 08:48 PM.
wa-yakima+county,SHIELDS RD YAKIMA COUNTY,Other,02/24/20. 08:21 PM.
wa-yakima+county,DONALD RD YAKIMA COUNTY,Other,02/24/20. 07:52 PM.
wa-yakima+county,AHTANUM RD; PARADISE MOBIL YAKIMA COUNTY,Other,02/24/20. 07:12 PM.
wa-yakima+county,MARSH RD; U:110 YAKIMA COUNTY,Shooting,02/24/20. 06:08 PM.
wa-yakima+county,VAN BELLE RD YAKIMA COUNTY,Other,02/24/20. 05:51 PM.
wa-yakima+county,W 1ST ST ;LAVA MAX YAKIMA COUNTY,Other,02/24/20. 06:26 PM.
wa-yakima+county,S FISHER RD YAKIMA COUNTY,Theft,02/24/20. 05:33 PM.
wa-yakima+county,WESLEY RD YAKIMA COUNTY,Other,02/24/20. 04:29 PM.
wa-yakima+county,N 2ND ST; YAKIMA COUNTY CO YAKIMA COUNTY,Arrest,02/24/20. 01:40 PM.
wa-yakima+county,STATE ROUTE 410 YAKIMA COUNTY,Theft,02/24/20. 12:46 PM.
wa-yakima+county,E 2ND ST; NOAHS ARK YAKIMA COUNTY,Arrest,02/24/20. 10:43 AM.
wa-yakima+county,MAIN ST YAKIMA COUNTY,Other,02/24/20. 10:40 AM.
wa-yakima+county,LOMBARD LOOP RD YAKIMA COUNTY,Burglary,02/24/20. 07:54 AM.
wa-yakima+county,POM POM RD YAKIMA COUNTY,Other,02/24/20. 07:59 AM.
wa-yakima+county,KNIGHT HILL RD YAKIMA COUNTY,Other,02/24/20. 01:41 AM.
wa-yakima+county,RADER RD YAKIMA COUNTY,Other,02/24/20. 01:35 AM.
wa-yakima+county,ROUSE RD YAKIMA COUNTY,Other,02/24/20. 01:19 AM.
wa-yakima+county,G ST YAKIMA COUNTY,Other,02/25/20. 08:48 PM.
wa-yakima+county,S NACHES RD; ESCHBACH PARK YAKIMA COUNTY,Other,02/25/20. 10:28 PM.
wa-yakima+county,SUNNYSIDE MABTON RD YAKIMA COUNTY,Other,02/25/20. 10:02 PM.
wa-yakima+county,NASS RD YAKIMA COUNTY,Shooting,02/25/20. 08:59 PM.
wa-yakima+county,ROZA HILL DR AND TERRACE HGT YAKIMA COUNTY,Arrest,02/25/20. 08:58 PM.
wa-yakima+county,VAN BELLE RD; #1 YAKIMA COUNTY,Assault,02/25/20. 08:07 PM.
wa-yakima+county,ELMWOOD RD; WASHINGTON BEE YAKIMA COUNTY,Other,02/25/20. 07:58 PM.
wa-yakima+county,BRANCH RD YAKIMA COUNTY,Other,02/25/20. 07:51 PM.
wa-yakima+county,SLADE RD YAKIMA COUNTY,Assault,02/25/20. 06:12 PM.
wa-yakima+county,HARLAN LANDING YAKIMA COUNTY,Other,02/25/20. 07:15 PM.
wa-yakima+county,SELAH LOOP RD #99 YAKIMA COUNTY,Other,02/25/20. 06:37 PM.
wa-yakima+county,E CENTENNIAL DR YAKIMA COUNTY,Other,02/25/20. 05:13 PM.
wa-yakima+county,E ALEXANDER RD YAKIMA COUNTY,Other,02/25/20. 05:19 PM.
wa-yakima+county,S 18TH ST AND CENTRAL AVE YAKIMA COUNTY,Other,02/25/20. 05:44 PM.
wa-yakima+county,BRANCH RD YAKIMA COUNTY,Arrest,02/25/20. 05:29 PM.
wa-yakima+county,S MARTIN RD YAKIMA COUNTY,Burglary,02/25/20. 03:54 PM.
wa-yakima+county,BEAUDRY RD; 37 YAKIMA COUNTY,Other,02/25/20. 04:50 PM.
wa-yakima+county,SUNNYSIDE MABTON RD #1/2 YAKIMA COUNTY,Theft,02/25/20. 03:18 PM.
wa-yakima+county,N 2ND ST; YAKIMA COUNTY CO YAKIMA COUNTY,Other,02/25/20. 01:41 PM.
wa-yakima+county,S 1ST ST; YSO YAKIMA COUNTY,Other,02/25/20. 01:35 PM.
wa-yakima+county,MAPLE WAY YAKIMA COUNTY,Assault,02/25/20. 12:42 PM.
wa-yakima+county,ZIER RD; WEST VALLEY HIGH YAKIMA COUNTY,Other,02/25/20. 11:08 AM.
wa-yakima+county,SUMMITVIEW RD YAKIMA COUNTY,Theft,02/25/20. 12:25 PM.
wa-yakima+county,CAMPBELL RD; U:28 YAKIMA COUNTY,Burglary,02/25/20. 10:02 AM.
wa-yakima+county,BEAUDRY RD; EAST VALLEY HI YAKIMA COUNTY,Other,02/25/20. 09:47 AM.
wa-yakima+county,N 2ND ST; YAKIMA COUNTY CO YAKIMA COUNTY,Other,02/25/20. 09:24 AM.
wa-yakima+county,ST HILAIRE RD YAKIMA COUNTY,Other,02/25/20. 09:25 AM.
wa-yakima+county,EMERALD RD YAKIMA COUNTY,Theft,02/25/20. 08:31 AM.
wa-yakima+county,BEAUDRY RD; EAST VALLEY HI YAKIMA COUNTY,Other,02/25/20. 08:32 AM.
wa-yakima+county,ROCKY TOP RD; ANDERSON ROC YAKIMA COUNTY,Vandalism,02/25/20. 07:57 AM.
wa-yakima+county,BEAUDRY RD; EAST VALLEY MI YAKIMA COUNTY,Arrest,02/25/20. 07:46 AM.
wa-yakima+county,COTTONWOOD CANYON RD YAKIMA COUNTY,Theft,02/25/20. 06:33 AM.
wa-yakima+county,W CHESTNUT AVE; BORTON FRU YAKIMA COUNTY,Assault,02/25/20. 06:15 AM.
wa-yakima+county,YAKIMA VALLEY HWY YAKIMA COUNTY,Other,02/25/20. 04:44 AM.
wa-yakima+county,HARRAH DRAIN RD AND FORT RD YAKIMA COUNTY,Other,02/25/20. 03:00 AM.
wa-yakima+county,ADAMS VIEW DR YAKIMA COUNTY,Burglary,02/25/20. 01:27 AM.
wa-yakima+county,W WAPATO RD; WOLF DEN REST YAKIMA COUNTY,Other,02/26/20. 11:30 PM.
wa-yakima+county,VICTORY LN YAKIMA COUNTY,Vandalism,02/26/20. 11:19 PM.
wa-yakima+county,NACHES HEIGHTS RD YAKIMA COUNTY,Other,02/26/20. 10:06 PM.
wa-yakima+county,WICKERSHAM RD AND SUMMITVIEW YAKIMA COUNTY,Shooting,02/26/20. 09:45 PM.
wa-yakima+county,W PARKER HEIGHTS RD YAKIMA COUNTY,Other,02/26/20. 09:29 PM.
wa-yakima+county,W PARKER HEIGHTS RD YAKIMA COUNTY,Other,02/26/20. 09:16 PM.
wa-yakima+county,GAP RD YAKIMA COUNTY,Shooting,02/26/20. 07:27 PM.
wa-yakima+county,SPIKE RD YAKIMA COUNTY,Other,02/26/20. 07:59 PM.
wa-yakima+county,KEYS RD YAKIMA COUNTY,Other,02/26/20. 07:46 PM.
wa-yakima+county,CAMPBELL RD AND JONES RD YAKIMA COUNTY,Other,02/26/20. 07:27 PM.
wa-yakima+county,N FORK RD YAKIMA COUNTY,Other,02/26/20. 04:31 PM.
wa-yakima+county,BURR ST YAKIMA COUNTY,Arrest,02/26/20. 03:02 PM.
wa-yakima+county,WILLOW TREE LN #12 YAKIMA COUNTY,Other,02/26/20. 02:49 PM.
wa-yakima+county,WIDE HOLLOW RD YAKIMA COUNTY,Other,02/26/20. 02:25 PM.
wa-yakima+county,SAGE TRAIL RD; #25 YAKIMA COUNTY,Other,02/26/20. 02:09 PM.
wa-yakima+county,HALES DR YAKIMA COUNTY,Theft,02/26/20. 01:57 PM.
wa-yakima+county,SELAH LOOP RD* YAKIMA COUNTY,Vandalism,02/26/20. 01:16 PM.
wa-yakima+county,CHANNEL DR; NEW HOPE CHURC YAKIMA COUNTY,Theft,02/26/20. 12:46 PM.
wa-yakima+county,AHTANUM RD YAKIMA COUNTY,Other,02/26/20. 12:22 PM.
wa-yakima+county,W WINE COUNTRY RD; GRANDVI YAKIMA COUNTY,Other,02/26/20. 11:19 AM.
wa-yakima+county,UNITED STATES HIGHWAY 97 YAKIMA COUNTY,Burglary,02/26/20. 10:56 AM.
wa-yakima+county,N 2ND ST; YAKIMA COUNTY CO YAKIMA COUNTY,Arrest,02/26/20. 10:12 AM.
wa-yakima+county,N BONAIR RD YAKIMA COUNTY,Burglary,02/26/20. 10:06 AM.
wa-yakima+county,GILBERT RD YAKIMA COUNTY,Robbery,02/26/20. 10:27 AM.
wa-yakima+county,TEMPLE LN AND SHOTGUN LN YAKIMA COUNTY,Other,02/26/20. 08:57 AM.
wa-yakima+county,FORT RD; YAKAMA INDIAN NAT YAKIMA COUNTY,Other,02/26/20. 10:05 AM.
wa-yakima+county,FORDYCE RD AND INDEPENDENCE YAKIMA COUNTY,Theft,02/26/20. 09:47 AM.
wa-yakima+county,S 4TH ST;B YAKIMA COUNTY,Other,02/26/20. 09:39 AM.
wa-yakima+county,COYOTE CREEK RD YAKIMA COUNTY,Arrest,02/26/20. 09:27 AM.
wa-yakima+county,AHTANUM RD AND S 52ND AVE YAKIMA COUNTY,Other,02/26/20. 08:13 AM.
wa-yakima+county,BEAUDRY RD; EAST VALLEY HI YAKIMA COUNTY,Other,02/26/20. 08:04 AM.
wa-yakima+county,YAKIMA ST YAKIMA COUNTY,Vandalism,02/26/20. 06:15 AM.
wa-yakima+county,STATE ROUTE 22 YAKIMA COUNTY,Other,02/26/20. 05:07 AM.
wa-yakima+county,S 41ST ST AND E HENNING ST YAKIMA COUNTY,Other,02/26/20. 01:28 AM.
wa-yakima+county,E HILLCREST DR YAKIMA COUNTY,Other,02/26/20. 12:50 AM.
wa-yakima+county,OCCIDENTAL RD AND STEIN RD YAKIMA COUNTY,Shooting,02/27/20. 10:25 PM.
wa-yakima+county,S 90TH AVE YAKIMA COUNTY,Other,02/27/20. 09:04 PM.
wa-yakima+county,FORT RD; YAKAMA INDIAN NAT YAKIMA COUNTY,Theft,02/27/20. 09:18 PM.
wa-yakima+county,S 66TH AVE YAKIMA COUNTY,Other,02/27/20. 08:24 PM.
