Name,Address,Crime,Date
wa-yakima+county,ROSENKRANZ RD AND NOYE RD YAKIMA COUNTY,Other,03/27/20. 07:49 PM.
wa-yakima+county,N WENAS RD;1B STAGE COACH YAKIMA COUNTY,Other,03/27/20. 06:44 PM.
wa-yakima+county,ROBISON RD YAKIMA COUNTY,Other,03/27/20. 05:15 PM.
wa-yakima+county,UNITED STATES HIGHWAY 97 YAKIMA COUNTY,Other,03/27/20. 04:48 PM.
wa-yakima+county,SAINSBURY LN YAKIMA COUNTY,Other,03/27/20. 03:41 PM.
wa-yakima+county,CAMPBELL RD YAKIMA COUNTY,Other,03/27/20. 02:36 PM.
wa-yakima+county,GALLOWAY DR YAKIMA COUNTY,Other,03/27/20. 11:10 AM.
wa-yakima+county,S WAPATO RD YAKIMA COUNTY,Other,03/27/20. 11:26 AM.
wa-yakima+county,W WAPATO RD YAKIMA COUNTY,Other,03/27/20. 10:52 AM.
wa-yakima+county,NOLA LOOP RD; 103A YAKIMA COUNTY,Theft,03/27/20. 10:35 AM.
wa-yakima+county,APRICOT RD YAKIMA COUNTY,Theft,03/27/20. 09:39 AM.
wa-yakima+county,S PEAR AVE YAKIMA COUNTY,Other,03/27/20. 09:24 AM.
wa-yakima+county,FRALEY RD YAKIMA COUNTY,Other,03/27/20. 09:17 AM.
wa-yakima+county,BISHOP RD YAKIMA COUNTY,Other,03/27/20. 08:56 AM.
wa-yakima+county,ASHUE RD YAKIMA COUNTY,Theft,03/27/20. 08:09 AM.
wa-yakima+county,MAIN ST YAKIMA COUNTY,Other,03/27/20. 07:03 AM.
wa-yakima+county,SINCLAIR AVE YAKIMA COUNTY,Other,03/27/20. 04:37 AM.
wa-yakima+county,N WENAS RD; STAGE COACH RV YAKIMA COUNTY,Other,03/27/20. 01:07 AM.
wa-yakima+county,YAKIMA VALLEY HWY YAKIMA COUNTY,Other,03/27/20. 01:06 AM.
wa-yakima+county,1ST ST YAKIMA COUNTY,Other,03/28/20. 11:29 PM.
wa-yakima+county,KRINER RD YAKIMA COUNTY,Other,03/28/20. 10:47 PM.
wa-yakima+county,MORROW LN YAKIMA COUNTY,Other,03/28/20. 08:39 PM.
wa-yakima+county,CAMPBELL RD YAKIMA COUNTY,Other,03/28/20. 06:57 PM.
wa-yakima+county,SANDY LN YAKIMA COUNTY,Other,03/28/20. 06:42 PM.
wa-yakima+county,YAKIMA VALLEY HWY YAKIMA COUNTY,Other,03/28/20. 06:24 PM.
wa-yakima+county,MURRAY RD YAKIMA COUNTY,Vandalism,03/28/20. 04:02 PM.
wa-yakima+county,LEONARD LN YAKIMA COUNTY,Other,03/28/20. 02:24 PM.
wa-yakima+county,N TRACK RD YAKIMA COUNTY,Other,03/28/20. 01:34 PM.
wa-yakima+county,HOFFER RD YAKIMA COUNTY,Assault,03/28/20. 12:35 PM.
wa-yakima+county,VAN BELLE RD YAKIMA COUNTY,Theft,03/28/20. 11:44 AM.
wa-yakima+county,VAN BELLE RD YAKIMA COUNTY,Theft,03/28/20. 11:49 AM.
wa-yakima+county,N WHITE SWAN RD; U:32 YAKIMA COUNTY,Other,03/28/20. 11:36 AM.
wa-yakima+county,E MCDONALD RD YAKIMA COUNTY,Theft,03/28/20. 11:15 AM.
wa-yakima+county,N 1ST ST; YAKIMEX YAKIMA COUNTY,Robbery,03/28/20. 08:29 AM.
wa-yakima+county,AHTANUM RD YAKIMA COUNTY,Theft,03/28/20. 03:10 AM.
wa-yakima+county,LATERAL A RD AND LATERAL 1 R YAKIMA COUNTY,Other,03/28/20. 03:01 AM.
wa-yakima+county,N PUTERBAUGH RD YAKIMA COUNTY,Shooting,03/29/20. 11:34 PM.
wa-yakima+county,RODMAN RD YAKIMA COUNTY,Other,03/29/20. 10:13 PM.
wa-yakima+county,S 84TH AVE YAKIMA COUNTY,Other,03/29/20. 08:53 PM.
wa-yakima+county,PEAR BUTTE DR YAKIMA COUNTY,Assault,03/29/20. 06:54 PM.
wa-yakima+county,OLD NACHES HWY YAKIMA COUNTY,Other,03/29/20. 06:50 PM.
wa-yakima+county,MAIN ST; BJS GET N GO YAKIMA COUNTY,Other,03/29/20. 04:50 PM.
wa-yakima+county,COOK RD YAKIMA COUNTY,Other,03/29/20. 05:25 PM.
wa-yakima+county,S ROZALEE WAY YAKIMA COUNTY,Other,03/29/20. 05:03 PM.
wa-yakima+county,KLICKITAT ST; U:272 YAKIMA COUNTY,Other,03/29/20. 03:08 PM.
wa-yakima+county,S 92ND AV YAKIMA COUNTY,Vandalism,03/29/20. 03:07 PM.
wa-yakima+county,HULI CIR YAKIMA COUNTY,Theft,03/29/20. 01:47 PM.
wa-yakima+county,EAKER RD YAKIMA COUNTY,Other,03/29/20. 12:52 PM.
wa-yakima+county,HARTFORD RD YAKIMA COUNTY,Other,03/29/20. 12:28 PM.
wa-yakima+county,HARTFORD RD AND N 15TH ST YAKIMA COUNTY,Arrest,03/29/20. 11:55 AM.
wa-yakima+county,HARTFORD RD YAKIMA COUNTY,Arrest,03/29/20. 11:50 AM.
wa-yakima+county,BURR ST #6 YAKIMA COUNTY,Theft,03/29/20. 01:44 AM.
wa-yakima+county,NACHES HEIGHTS RD YAKIMA COUNTY,Other,03/30/20. 10:53 PM.
wa-yakima+county,STATE ROUTE 223 YAKIMA COUNTY,Other,03/30/20. 10:53 PM.
wa-yakima+county,N WENAS RD YAKIMA COUNTY,Other,03/30/20. 09:10 PM.
wa-yakima+county,SELAH LOOP RD #78 YAKIMA COUNTY,Other,03/30/20. 08:56 PM.
wa-yakima+county,MOORE RD AND STUMP RD YAKIMA COUNTY,Other,03/30/20. 07:19 PM.
wa-yakima+county,S JUNIPER ST; 15 YAKIMA COUNTY,Other,03/30/20. 05:21 PM.
wa-yakima+county,KNIGHT HILL RD YAKIMA COUNTY,Theft,03/30/20. 05:05 PM.
wa-yakima+county,GREEN VALLEY RD; U:52 PH YAKIMA COUNTY,Other,03/30/20. 03:50 PM.
wa-yakima+county,N MEYERS RD/ I82 ; OLD ROC YAKIMA COUNTY,Other,03/30/20. 02:11 PM.
wa-yakima+county,W WAPATO RD YAKIMA COUNTY,Other,03/30/20. 01:09 PM.
wa-yakima+county,DURHAM RD YAKIMA COUNTY,Other,03/30/20. 12:50 PM.
wa-yakima+county,FERSON RD YAKIMA COUNTY,Theft,03/30/20. 12:19 PM.
wa-yakima+county,TERRETT WAY YAKIMA COUNTY,Other,03/30/20. 12:07 PM.
wa-yakima+county,WIDE HOLLOW RD; TOWN PUMP YAKIMA COUNTY,Vandalism,03/30/20. 11:20 AM.
wa-yakima+county,UNITED STATES HIGHWAY 12 YAKIMA COUNTY,Vandalism,03/30/20. 11:08 AM.
wa-yakima+county,STATE ROUTE 410 YAKIMA COUNTY,Theft,03/30/20. 10:57 AM.
wa-yakima+county,MOXEE AVE #2; SP 2 YAKIMA COUNTY,Theft,03/30/20. 10:40 AM.
wa-yakima+county,S WAPATO AVE; COMPADRES SP YAKIMA COUNTY,Other,03/30/20. 09:44 AM.
wa-yakima+county,KAYS RD YAKIMA COUNTY,Theft,03/30/20. 08:23 AM.
wa-yakima+county,WASHINGTON ST #B2 YAKIMA COUNTY,Theft,03/30/20. 07:15 AM.
wa-yakima+county,YAKIMA VALLEY HWY YAKIMA COUNTY,Burglary,03/30/20. 06:46 AM.
wa-yakima+county,S CAMAS AVE; WAPATO HIGH S YAKIMA COUNTY,Burglary,03/30/20. 03:47 AM.
wa-yakima+county,B ST YAKIMA COUNTY,Theft,03/30/20. 01:02 AM.
wa-yakima+county,HARLAN LANDING YAKIMA COUNTY,Other,03/30/20. 12:25 AM.
wa-yakima+county,SCOON RD YAKIMA COUNTY,Other,03/30/20. 12:23 AM.
wa-yakima+county,YAKIMA VALLEY HWY YAKIMA COUNTY,Other,03/31/20. 10:34 PM.
wa-yakima+county,N WENAS RD YAKIMA COUNTY,Other,03/31/20. 11:05 PM.
wa-yakima+county,N BARKES RD YAKIMA COUNTY,Burglary,03/31/20. 09:51 PM.
wa-yakima+county,HIDEAWAY RD YAKIMA COUNTY,Other,03/31/20. 09:01 PM.
wa-yakima+county,N WENAS RD YAKIMA COUNTY,Other,03/31/20. 08:57 PM.
wa-yakima+county,COUCH LN YAKIMA COUNTY,Other,03/31/20. 08:07 PM.
wa-yakima+county,S NACHES RD YAKIMA COUNTY,Other,03/31/20. 07:24 PM.
wa-yakima+county,SELAH NACHES RD YAKIMA COUNTY,Other,03/31/20. 06:30 PM.
wa-yakima+county,POMONA RD YAKIMA COUNTY,Theft,03/31/20. 05:01 PM.
wa-yakima+county,LOOKOUT POINT RD YAKIMA COUNTY,Other,03/31/20. 02:34 PM.
wa-yakima+county,MORSE RD YAKIMA COUNTY,Other,03/31/20. 01:52 PM.
wa-yakima+county,SR 12 AND CLOVER LN YAKIMA COUNTY,Other,03/31/20. 01:35 PM.
wa-yakima+county,AHTANUM RD YAKIMA COUNTY,Other,03/31/20. 01:46 PM.
wa-yakima+county,WIDE HOLLOW RD YAKIMA COUNTY,Other,03/31/20. 12:44 PM.
wa-yakima+county,BURR ST YAKIMA COUNTY,Theft,03/31/20. 12:39 PM.
wa-yakima+county,N TRACK RD; RENEGADE RACEW YAKIMA COUNTY,Vandalism,03/31/20. 12:24 PM.
wa-yakima+county,S 90TH AVE AND AHTANUM RD YAKIMA COUNTY,Other,03/31/20. 12:09 PM.
wa-yakima+county,UNIVERSITY PKWY; BLK YAKIMA COUNTY,Theft,03/31/20. 08:00 AM.
wa-yakima+county,RAGAN RD YAKIMA COUNTY,Burglary,03/31/20. 07:32 AM.
wa-yakima+county,GURLEY RD YAKIMA COUNTY,Other,03/31/20. 05:02 AM.
wa-yakima+county,WANETA RD YAKIMA COUNTY,Other,03/31/20. 02:40 AM.
wa-yakima+county,PINE ST YAKIMA COUNTY,Other,03/31/20. 02:07 AM.
wa-yakima+county,I 82 AND E VALLEY MALL BLVD YAKIMA COUNTY,Arrest,04/01/20. 09:18 PM.
wa-yakima+county,FORT RD; U:72 YAKIMA COUNTY,Other,04/01/20. 06:25 PM.
wa-yakima+county,E CENTENNIAL DR YAKIMA COUNTY,Other,04/01/20. 07:19 PM.
wa-yakima+county,MURRAY RD YAKIMA COUNTY,Other,04/01/20. 04:54 PM.
wa-yakima+county,E CENTENNIAL DR YAKIMA COUNTY,Other,04/01/20. 06:58 PM.
wa-yakima+county,MAPLE AVE YAKIMA COUNTY,Other,04/01/20. 05:44 PM.
wa-yakima+county,ASHUE RD YAKIMA COUNTY,Theft,04/01/20. 01:20 PM.
wa-yakima+county,CEMETERY RD YAKIMA COUNTY,Other,04/01/20. 01:55 PM.
wa-yakima+county,BLK W WAPATO RD YAKIMA COUNTY,Arrest,04/01/20. 10:28 AM.
wa-yakima+county,ELTON RD YAKIMA COUNTY,Other,04/01/20. 10:18 AM.
wa-yakima+county,S WAPATO RD AND BRANCH RD YAKIMA COUNTY,Theft,04/01/20. 09:56 AM.
wa-yakima+county,GEPHART RD YAKIMA COUNTY,Other,04/01/20. 08:58 AM.
wa-yakima+county,FERN ST YAKIMA COUNTY,Theft,04/01/20. 06:27 AM.
wa-yakima+county,HARRAH RD YAKIMA COUNTY,Other,04/01/20. 01:15 AM.
wa-yakima+county,S 6TH ST; C YAKIMA COUNTY,Other,04/01/20. 12:18 AM.
wa-yakima+county,NASS RD YAKIMA COUNTY,Other,04/02/20. 10:41 PM.
wa-yakima+county,N 40TH AVE; FRED MEYER YAKIMA COUNTY,Other,04/02/20. 09:16 PM.
wa-yakima+county,N 1ST ST; YAKIMA VALLEY IN YAKIMA COUNTY,Other,04/02/20. 08:58 PM.
wa-yakima+county,AHTANUM RD YAKIMA COUNTY,Other,04/02/20. 07:59 PM.
wa-yakima+county,BUENA RD YAKIMA COUNTY,Other,04/02/20. 06:14 PM.
wa-yakima+county,STONE RD YAKIMA COUNTY,Theft,04/02/20. 04:09 PM.
wa-yakima+county,OUTLOOK RD YAKIMA COUNTY,Burglary,04/02/20. 04:01 PM.
wa-yakima+county,E TOPPENISH AVE YAKIMA COUNTY,Arrest,04/02/20. 02:21 PM.
wa-yakima+county,MEADOW LN YAKIMA COUNTY,Shooting,04/02/20. 01:58 PM.
wa-yakima+county,N GRANGER RD YAKIMA COUNTY,Other,04/02/20. 01:25 PM.
wa-yakima+county,LARENA LN; A YAKIMA COUNTY,Other,04/02/20. 12:51 PM.
wa-yakima+county,LA PIERRE RD; PHEASANTHILL YAKIMA COUNTY,Other,04/02/20. 12:43 PM.
wa-yakima+county,CREWPORT RD YAKIMA COUNTY,Other,04/02/20. 10:18 AM.
wa-yakima+county,S NACHES RD YAKIMA COUNTY,Burglary,04/02/20. 10:28 AM.
wa-yakima+county,ROCKY FORD RD; MT ADAMS CO YAKIMA COUNTY,Burglary,04/02/20. 10:17 AM.
wa-yakima+county,E NORMAN RD YAKIMA COUNTY,Other,04/02/20. 10:21 AM.
wa-yakima+county,BALSAM LN YAKIMA COUNTY,Theft,04/02/20. 10:05 AM.
wa-yakima+county,SUMMITVIEW EXT YAKIMA COUNTY,Other,04/02/20. 09:13 AM.
wa-yakima+county,GURLEY RD YAKIMA COUNTY,Other,04/02/20. 07:41 AM.
wa-yakima+county,4TH AVE YAKIMA COUNTY,Theft,04/02/20. 06:29 AM.
wa-yakima+county,MEADOWBROOK RD; U:25 YAKIMA COUNTY,Other,04/02/20. 05:22 AM.
wa-yakima+county,5TH ST; 2A YAKIMA COUNTY,Other,04/02/20. 04:16 AM.
wa-yakima+county,S 58TH ST YAKIMA COUNTY,Other,04/02/20. 01:31 AM.
wa-yakima+county,WIDE HOLLOW RD YAKIMA COUNTY,Other,04/02/20. 12:20 AM.
wa-yakima+county,WAMPLER RD YAKIMA COUNTY,Other,04/03/20. 11:44 PM.
wa-yakima+county,BARBER RD YAKIMA COUNTY,Other,04/03/20. 10:31 PM.
wa-yakima+county,RAY RD YAKIMA COUNTY,Shooting,04/03/20. 10:11 PM.
wa-yakima+county,YAKIMA VALLEY HWY YAKIMA COUNTY,Other,04/03/20. 09:11 PM.
wa-yakima+county,MAPLEWAY RD YAKIMA COUNTY,Other,04/03/20. 09:02 PM.
wa-yakima+county,FORT RD YAKIMA COUNTY,Other,04/03/20. 08:20 PM.
wa-yakima+county,E I 82; MP32 E YAKIMA COUNTY,Vandalism,04/03/20. 07:44 PM.
wa-yakima+county,BARKES RD YAKIMA COUNTY,Other,04/03/20. 05:59 PM.
wa-yakima+county,E POMONA RD YAKIMA COUNTY,Other,04/03/20. 05:10 PM.
wa-yakima+county,ZIER RD; WEST VALLEY HIGH YAKIMA COUNTY,Other,04/03/20. 04:09 PM.
wa-yakima+county,N COTTONWOOD RD YAKIMA COUNTY,Theft,04/03/20. 04:35 PM.
wa-yakima+county,W WOODIN RD YAKIMA COUNTY,Theft,04/03/20. 03:39 PM.
wa-yakima+county,N 37TH ST YAKIMA COUNTY,Other,04/03/20. 03:09 PM.
wa-yakima+county,E WAPATO RD AND N TRAK YAKIMA COUNTY,Other,04/03/20. 12:54 PM.
wa-yakima+county,STATE ROUTE 410 YAKIMA COUNTY,Burglary,04/03/20. 01:08 PM.
wa-yakima+county,S 1ST ST; YAKIMA COUNTY SH YAKIMA COUNTY,Arrest,04/03/20. 12:40 PM.
wa-yakima+county,KENWARD WAY YAKIMA COUNTY,Other,04/03/20. 12:30 PM.
wa-yakima+county,CHEYNE RD YAKIMA COUNTY,Other,04/03/20. 12:26 PM.
wa-yakima+county,COLUMBIA ST YAKIMA COUNTY,Theft,04/03/20. 12:11 PM.
wa-yakima+county,WIDE HOLLOW RD YAKIMA COUNTY,Assault,04/03/20. 10:06 AM.
wa-yakima+county,BUTTERFIELD RD #52 YAKIMA COUNTY,Other,04/03/20. 09:29 AM.
wa-yakima+county,E ZILLAH DR YAKIMA COUNTY,Theft,04/03/20. 04:47 AM.
wa-yakima+county,LATERAL 1 RD YAKIMA COUNTY,Other,04/03/20. 01:50 AM.
wa-yakima+county,W WAPATO RD YAKIMA COUNTY,Other,04/04/20. 11:34 PM.
wa-yakima+county,SAGE TRAIL RD #47 YAKIMA COUNTY,Other,04/04/20. 11:18 PM.
wa-yakima+county,SAGE TRAIL RD #21 YAKIMA COUNTY,Other,04/04/20. 10:48 PM.
wa-yakima+county,RANGER RD YAKIMA COUNTY,Other,04/04/20. 10:29 PM.
wa-yakima+county,W PROSPECT PL; ORGROW YAKIMA COUNTY,Other,04/04/20. 09:24 PM.
wa-yakima+county,N TRACK RD AND E BRANCH RD YAKIMA COUNTY,Other,04/04/20. 08:22 PM.
wa-yakima+county,KONNOWAC PASS RD YAKIMA COUNTY,Other,04/04/20. 09:03 PM.
wa-yakima+county,WILLOW TREE LN YAKIMA COUNTY,Other,04/04/20. 09:01 PM.
wa-yakima+county,FINLEY RD AND N WHITE SWAN R YAKIMA COUNTY,Other,04/04/20. 06:45 PM.
wa-yakima+county,E GLEED RD YAKIMA COUNTY,Other,04/04/20. 07:43 PM.
wa-yakima+county,EGAN RD YAKIMA COUNTY,Other,04/04/20. 07:19 PM.
wa-yakima+county,S 7TH ST AND E EDISON AVE YAKIMA COUNTY,Vandalism,04/04/20. 06:42 PM.
wa-yakima+county,RIDGEWAY DR YAKIMA COUNTY,Other,04/04/20. 05:19 PM.
wa-yakima+county,HOLY ROSARY RD; HOLY ROSAR YAKIMA COUNTY,Other,04/04/20. 03:04 PM.
wa-yakima+county,YAKIMA RANCHES ; END OF BU YAKIMA COUNTY,Other,04/04/20. 02:37 PM.
wa-yakima+county,COTTONWOOD CANYON RD YAKIMA COUNTY,Other,04/04/20. 02:36 PM.
wa-yakima+county,FORT RD YAKIMA COUNTY,Other,04/04/20. 02:19 PM.
wa-yakima+county,MEYERS RD YAKIMA COUNTY,Theft,04/04/20. 12:05 PM.
wa-yakima+county,INGHAM RD YAKIMA COUNTY,Burglary,04/04/20. 11:30 AM.
wa-yakima+county,BUTTERFIELD RD YAKIMA COUNTY,Other,04/04/20. 11:11 AM.
wa-yakima+county,HOFFER RD YAKIMA COUNTY,Other,04/04/20. 09:58 AM.
wa-yakima+county,S 72ND AVE YAKIMA COUNTY,Burglary,04/04/20. 05:39 AM.
wa-yakima+county,LARKIN LN AND MAPLEWAY RD YAKIMA COUNTY,Other,04/04/20. 03:13 AM.
wa-yakima+county,TERRACE HEIGHTS DR YAKIMA COUNTY,Other,04/04/20. 01:22 AM.
wa-yakima+county,SHELLER RD YAKIMA COUNTY,Other,04/04/20. 12:01 AM.
wa-yakima+county,STATE ROUTE 241 YAKIMA COUNTY,Other,04/05/20. 09:16 PM.
wa-yakima+county,GARRETSON LN; THE RANGE YAKIMA COUNTY,Shooting,04/05/20. 08:42 PM.
wa-yakima+county,NACHES HEIGHTS RD YAKIMA COUNTY,Other,04/05/20. 08:35 PM.
wa-yakima+county,BUENA RD YAKIMA COUNTY,Other,04/05/20. 08:04 PM.
wa-yakima+county,EMERALD RD YAKIMA COUNTY,Other,04/05/20. 07:38 PM.
wa-yakima+county,E WAPATO RD YAKIMA COUNTY,Other,04/05/20. 06:40 PM.
wa-yakima+county,DEAD END/N OF INDIAN CHURC YAKIMA COUNTY,Other,04/05/20. 06:46 PM.
wa-yakima+county,INDEPENDENCE RD YAKIMA COUNTY,Other,04/05/20. 06:01 PM.
wa-yakima+county,MARION DRAIN RD YAKIMA COUNTY,Theft,04/05/20. 05:19 PM.
wa-yakima+county,HIDEAWAY RD YAKIMA COUNTY,Other,04/05/20. 05:11 PM.
wa-yakima+county,REST HAVEN RD AND RIVERVIEW YAKIMA COUNTY,Other,04/05/20. 04:29 PM.
wa-yakima+county,BUENA LOOP RD YAKIMA COUNTY,Other,04/05/20. 02:16 PM.
wa-yakima+county,YAKIMA VALLEY HWY; EDGEWAT YAKIMA COUNTY,Other,04/05/20. 01:29 PM.
wa-yakima+county,RIVERSIDE RD YAKIMA COUNTY,Burglary,04/05/20. 09:06 AM.
wa-yakima+county,N BARKES RD YAKIMA COUNTY,Other,04/05/20. 07:56 AM.
wa-yakima+county,LATERAL 1 RD YAKIMA COUNTY,Theft,04/05/20. 07:31 AM.
wa-yakima+county,N BARKES RD YAKIMA COUNTY,Other,04/05/20. 05:34 AM.
wa-yakima+county,2ND AVE YAKIMA COUNTY,Other,04/05/20. 01:28 AM.
wa-yakima+county,KRINER RD YAKIMA COUNTY,Other,04/06/20. 09:37 PM.
wa-yakima+county,S 18TH ST AND E NOB HILL BLV YAKIMA COUNTY,Other,04/06/20. 09:40 PM.
wa-yakima+county,S SATUS RD YAKIMA COUNTY,Other,04/06/20. 08:49 PM.
wa-yakima+county,W CRESCENT AVE YAKIMA COUNTY,Other,04/06/20. 07:10 PM.
wa-yakima+county,N WENAS RD YAKIMA COUNTY,Theft,04/06/20. 06:59 PM.
wa-yakima+county,MILLENIUM AVE YAKIMA COUNTY,Other,04/06/20. 04:29 PM.
wa-yakima+county,EGAN RD YAKIMA COUNTY,Other,04/06/20. 04:01 PM.
wa-yakima+county,S 40TH ST YAKIMA COUNTY,Other,04/06/20. 04:28 PM.
wa-yakima+county,N FRONT ST; YAKIMA COUNTY YAKIMA COUNTY,Other,04/06/20. 12:15 PM.
wa-yakima+county,AHTANUM RD; WILD FIRE PIZZ YAKIMA COUNTY,Other,04/06/20. 02:38 PM.
wa-yakima+county,LANCASTER RD YAKIMA COUNTY,Other,04/06/20. 12:48 PM.
wa-yakima+county,MAIN ST YAKIMA COUNTY,Other,04/06/20. 12:47 PM.
wa-yakima+county,W WAPATO RD YAKIMA COUNTY,Theft,04/06/20. 11:36 AM.
wa-yakima+county,LOMBARD LOOP RD YAKIMA COUNTY,Other,04/06/20. 10:18 AM.
wa-yakima+county,LOOKOUT POINT RD YAKIMA COUNTY,Vandalism,04/06/20. 09:14 AM.
wa-yakima+county,ELLIOTT RD AND LIVENGOOD RD YAKIMA COUNTY,Other,04/06/20. 05:00 AM.
wa-yakima+county,TIETON DR YAKIMA COUNTY,Other,04/06/20. 02:11 AM.
wa-yakima+county,CAMPBELL RD YAKIMA COUNTY,Assault,04/06/20. 12:57 AM.
wa-yakima+county,FORT RD YAKIMA COUNTY,Other,04/07/20. 10:59 PM.
wa-yakima+county,MCCULLOUGH RD YAKIMA COUNTY,Assault,04/07/20. 07:58 PM.
wa-yakima+county,LANCASTER RD YAKIMA COUNTY,Other,04/07/20. 08:09 PM.
wa-yakima+county,CHARVET RD YAKIMA COUNTY,Other,04/07/20. 07:06 PM.
wa-yakima+county,ROBINSON RD YAKIMA COUNTY,Shooting,04/07/20. 06:53 PM.
wa-yakima+county,FRALEY CUT OFF RD YAKIMA COUNTY,Other,04/07/20. 07:07 PM.
wa-yakima+county,LATERAL B RD YAKIMA COUNTY,Other,04/07/20. 05:41 PM.
wa-yakima+county,NILE RD YAKIMA COUNTY,Assault,04/07/20. 04:06 PM.
wa-yakima+county,N GRANGER RD YAKIMA COUNTY,Shooting,04/07/20. 03:53 PM.
wa-yakima+county,OCCIDENTAL RD YAKIMA COUNTY,Other,04/07/20. 03:35 PM.
wa-yakima+county,S 1ST ST; YAKIMA COUNTY SH YAKIMA COUNTY,Arrest,04/07/20. 11:26 AM.
wa-yakima+county,S FORK RD YAKIMA COUNTY,Theft,04/07/20. 11:01 AM.
wa-yakima+county,WANETA RD YAKIMA COUNTY,Other,04/07/20. 10:43 AM.
wa-yakima+county,ORCHARDVALE RD YAKIMA COUNTY,Other,04/07/20. 10:30 AM.
wa-yakima+county,SCENIC DR YAKIMA COUNTY,Vandalism,04/07/20. 10:11 AM.
wa-yakima+county,SCOON RD YAKIMA COUNTY,Burglary,04/07/20. 09:58 AM.
wa-yakima+county,THORP RD; #14 YAKIMA COUNTY,Theft,04/07/20. 05:45 AM.
wa-yakima+county,S 41ST ST YAKIMA COUNTY,Other,04/07/20. 05:11 AM.
wa-yakima+county,RIVERSIDE RD; R AND S ORCHAR YAKIMA COUNTY,Other,04/07/20. 03:24 AM.
wa-yakima+county,G ST YAKIMA COUNTY,Other,04/07/20. 02:11 AM.
wa-yakima+county,ADAMSVIEW RD YAKIMA COUNTY,Other,04/07/20. 01:59 AM.
wa-yakima+county,TERRACE HGTS DR; PAPA BAIR YAKIMA COUNTY,Other,04/08/20. 11:35 PM.
wa-yakima+county,SR 410; WHISTLIN JACK LODG YAKIMA COUNTY,Other,04/08/20. 10:59 PM.
wa-yakima+county,BRIDGEMAN RD YAKIMA COUNTY,Shooting,04/08/20. 10:42 PM.
wa-yakima+county,NILE RD YAKIMA COUNTY,Other,04/08/20. 09:37 PM.
wa-yakima+county,SR 410; WHISTLIN JACK LODG YAKIMA COUNTY,Other,04/08/20. 09:19 PM.
wa-yakima+county,COTTONWOOD CANYON RD YAKIMA COUNTY,Shooting,04/08/20. 07:38 PM.
wa-yakima+county,ROBBINS RD YAKIMA COUNTY,Shooting,04/08/20. 06:13 PM.
wa-yakima+county,HIDEAWAY RD YAKIMA COUNTY,Other,04/08/20. 04:50 PM.
wa-yakima+county,EMERALD RD; U:41 YAKIMA COUNTY,Other,04/08/20. 03:47 PM.
wa-yakima+county,WELLS GAP RD YAKIMA COUNTY,Vandalism,04/08/20. 03:25 PM.
wa-yakima+county,ROZA HILL DR; TERRACE HEIG YAKIMA COUNTY,Other,04/08/20. 02:37 PM.
wa-yakima+county,UNITED STATES HIGHWAY 12 YAKIMA COUNTY,Other,04/08/20. 02:22 PM.
wa-yakima+county,STANTON RD YAKIMA COUNTY,Other,04/08/20. 10:42 AM.
wa-yakima+county,W 3RD ST YAKIMA COUNTY,Arrest,04/08/20. 12:00 PM.
wa-yakima+county,JONES RD YAKIMA COUNTY,Burglary,04/08/20. 11:54 AM.
wa-yakima+county,BOHOSKEY DR YAKIMA COUNTY,Other,04/08/20. 09:41 AM.
wa-yakima+county,N TRACK RD YAKIMA COUNTY,Assault,04/08/20. 09:45 AM.
wa-yakima+county,E GLEED RD; LOWER NACHES C YAKIMA COUNTY,Other,04/08/20. 08:22 AM.
wa-yakima+county,SCENIC DR YAKIMA COUNTY,Theft,04/08/20. 12:43 AM.
wa-yakima+county,FRALEY RD YAKIMA COUNTY,Other,04/09/20. 11:01 PM.
wa-yakima+county,KNIGHT HILL RD YAKIMA COUNTY,Vandalism,04/09/20. 10:55 PM.
wa-yakima+county,N 34TH ST YAKIMA COUNTY,Other,04/09/20. 09:37 PM.
wa-yakima+county,BUENA RD; GOLD NUGGET MARK YAKIMA COUNTY,Other,04/09/20. 09:39 PM.
wa-yakima+county,COREY LN YAKIMA COUNTY,Other,04/09/20. 07:44 PM.
wa-yakima+county,HORNBY RD YAKIMA COUNTY,Other,04/09/20. 06:26 PM.
wa-yakima+county,WILLOW LAWN RD YAKIMA COUNTY,Other,04/09/20. 05:39 PM.
wa-yakima+county,UNITED STATES HIGHWAY 12 YAKIMA COUNTY,Other,04/09/20. 05:56 PM.
wa-yakima+county,BRANCH RD YAKIMA COUNTY,Assault,04/09/20. 03:51 PM.
wa-yakima+county,S MARTIN RD YAKIMA COUNTY,Other,04/09/20. 03:41 PM.
wa-yakima+county,S 13TH ST AND E NOB HILL BLV YAKIMA COUNTY,Arrest,04/09/20. 03:28 PM.
wa-yakima+county,MORSE RD YAKIMA COUNTY,Theft,04/09/20. 02:53 PM.
wa-yakima+county,N WENAS RD YAKIMA COUNTY,Other,04/09/20. 12:56 PM.
wa-yakima+county,MEYERS RD YAKIMA COUNTY,Other,04/09/20. 12:43 PM.
wa-yakima+county,VAN BELLE RD YAKIMA COUNTY,Assault,04/09/20. 12:27 PM.
wa-yakima+county,QUICK LN YAKIMA COUNTY,Theft,04/09/20. 12:18 PM.
wa-yakima+county,RIVERSIDE RD YAKIMA COUNTY,Other,04/09/20. 11:28 AM.
wa-yakima+county,LATERAL A RD YAKIMA COUNTY,Theft,04/09/20. 10:51 AM.
wa-yakima+county,UNITED STATES HIGHWAY 12; YAKIMA COUNTY,Other,04/09/20. 10:10 AM.
wa-yakima+county,FISK RD YAKIMA COUNTY,Other,04/09/20. 08:51 AM.
wa-yakima+county,SAINT MARY RD YAKIMA COUNTY,Theft,04/09/20. 08:58 AM.
wa-yakima+county,WILLOW LAWN RD YAKIMA COUNTY,Other,04/09/20. 08:49 AM.
wa-yakima+county,N 57TH ST YAKIMA COUNTY,Assault,04/09/20. 07:57 AM.
wa-yakima+county,W PARKER HEIGHTS RD YAKIMA COUNTY,Theft,04/09/20. 08:00 AM.
wa-yakima+county,N TRACK RD YAKIMA COUNTY,Other,04/09/20. 04:16 AM.
wa-yakima+county,N TRACK RD YAKIMA COUNTY,Robbery,04/09/20. 03:21 AM.
wa-yakima+county,CAMPINA LN YAKIMA COUNTY,Robbery,04/09/20. 03:21 AM.
wa-yakima+county,HIGH SCHOOL RD; #304 YAKIMA COUNTY,Theft,04/09/20. 03:19 AM.
wa-yakima+county,G ST YAKIMA COUNTY,Other,04/09/20. 01:14 AM.
wa-yakima+county,BLK ALEXANDER RD YAKIMA COUNTY,Shooting,04/10/20. 11:03 PM.
wa-yakima+county,STATE ROUTE 821; 123 YAKIMA COUNTY,Other,04/10/20. 10:51 PM.
wa-yakima+county,S NACHES RD; U:7 YAKIMA COUNTY,Other,04/10/20. 10:11 PM.
wa-yakima+county,ALEXANDER RD YAKIMA COUNTY,Other,04/10/20. 08:34 PM.
wa-yakima+county,OLD RIVER RD YAKIMA COUNTY,Burglary,04/10/20. 07:06 PM.
wa-yakima+county,SMITH RD YAKIMA COUNTY,Burglary,04/10/20. 07:26 PM.
wa-yakima+county,PUTERBAUGH RD YAKIMA COUNTY,Other,04/10/20. 07:02 PM.
wa-yakima+county,REST HAVEN RD YAKIMA COUNTY,Other,04/10/20. 06:42 PM.
wa-yakima+county,WICKSTROM LN YAKIMA COUNTY,Theft,04/10/20. 06:02 PM.
wa-yakima+county,COLWASH RD AND WINNIER RD YAKIMA COUNTY,Other,04/10/20. 05:44 PM.
wa-yakima+county,BARKER RD YAKIMA COUNTY,Other,04/10/20. 03:31 PM.
wa-yakima+county,HIGHWAY 97 AND E 2ND AVE YAKIMA COUNTY,Other,04/10/20. 03:40 PM.
wa-yakima+county,KADER LN YAKIMA COUNTY,Assault,04/10/20. 01:15 PM.
wa-yakima+county,LINK RD; GLEED ORCHARD MAN YAKIMA COUNTY,Assault,04/10/20. 11:52 AM.
wa-yakima+county,APPLE VALLEY HWY; U:52 YAKIMA COUNTY,Other,04/10/20. 11:23 AM.
wa-yakima+county,N FRONT ST; COUNTY JAIL; Y YAKIMA COUNTY,Assault,04/10/20. 10:10 AM.
wa-yakima+county,FLORENCE RD YAKIMA COUNTY,Theft,04/10/20. 10:23 AM.
wa-yakima+county,WILLOW LAWN RD YAKIMA COUNTY,Other,04/10/20. 09:56 AM.
wa-yakima+county,N E ST YAKIMA COUNTY,Assault,04/10/20. 09:08 AM.
wa-yakima+county,INTERSTATE 82 RAMP E; U:65 YAKIMA COUNTY,Other,04/10/20. 08:57 AM.
wa-yakima+county,UPLAND WAY YAKIMA COUNTY,Theft,04/10/20. 04:24 AM.
wa-yakima+county,STATE ROUTE 410; SP 4 YAKIMA COUNTY,Other,04/10/20. 04:00 AM.
wa-yakima+county,3RD AVE YAKIMA COUNTY,Other,04/10/20. 03:13 AM.
wa-yakima+county,FORT RD; U:52 YAKIMA COUNTY,Other,04/10/20. 02:48 AM.
wa-yakima+county,UNITED STATES HIGHWAY 97 YAKIMA COUNTY,Other,04/10/20. 12:22 AM.
wa-yakima+county,STONE RD YAKIMA COUNTY,Other,04/10/20. 02:34 AM.
wa-yakima+county,ALEXANDER RD YAKIMA COUNTY,Other,04/10/20. 12:46 AM.
wa-yakima+county,CRAIG RD YAKIMA COUNTY,Assault,04/11/20. 11:28 PM.
wa-yakima+county,HULL RD YAKIMA COUNTY,Other,04/11/20. 10:58 PM.
wa-yakima+county,E GOODLANDER RD YAKIMA COUNTY,Other,04/11/20. 10:00 PM.
wa-yakima+county,CEMETERY RD AND VAN BELLE RD YAKIMA COUNTY,Other,04/11/20. 09:56 PM.
wa-yakima+county,N 96TH AVE YAKIMA COUNTY,Other,04/11/20. 08:18 PM.
wa-yakima+county,S KERSHAW DR YAKIMA COUNTY,Other,04/11/20. 08:16 PM.
wa-yakima+county,SCHULLER GRADE RD YAKIMA COUNTY,Other,04/11/20. 06:26 PM.
wa-yakima+county,STEPHENSON RD YAKIMA COUNTY,Other,04/11/20. 05:59 PM.
wa-yakima+county,BEAUDRY RD #56B YAKIMA COUNTY,Other,04/11/20. 05:07 PM.
wa-yakima+county,FORT RD YAKIMA COUNTY,Other,04/11/20. 04:44 PM.
wa-yakima+county,N TRACK RD; CROSSROAD MARK YAKIMA COUNTY,Other,04/11/20. 04:12 PM.
wa-yakima+county,W HUNTZINGER RD YAKIMA COUNTY,Other,04/11/20. 04:11 PM.
wa-yakima+county,BRANCH RD YAKIMA COUNTY,Other,04/11/20. 03:55 PM.
wa-yakima+county,CHEYNE RD YAKIMA COUNTY,Other,04/11/20. 11:01 AM.
wa-yakima+county,WILLOW LAWN RD YAKIMA COUNTY,Burglary,04/11/20. 08:30 AM.
wa-yakima+county,N CAMAS AVE YAKIMA COUNTY,Other,04/11/20. 08:36 AM.
wa-yakima+county,WILLOW LAWN RD YAKIMA COUNTY,Other,04/11/20. 07:56 AM.
wa-yakima+county,ORCHARD WAY YAKIMA COUNTY,Other,04/11/20. 07:38 AM.
wa-yakima+county,HARRISON RD; ZIRKLE FRUIT YAKIMA COUNTY,Other,04/11/20. 07:23 AM.
wa-yakima+county,DOUGLAS LN; U:19 YAKIMA COUNTY,Theft,04/11/20. 07:22 AM.
wa-yakima+county,ESTES RD YAKIMA COUNTY,Other,04/11/20. 02:14 AM.
wa-yakima+county,BRANCH RD YAKIMA COUNTY,Burglary,04/12/20. 11:15 PM.
wa-yakima+county,FRANKLIN RD YAKIMA COUNTY,Other,04/12/20. 10:59 PM.
wa-yakima+county,OLD MCCOY RD YAKIMA COUNTY,Other,04/12/20. 10:31 PM.
wa-yakima+county,N OUTLOOK RD; BLK YAKIMA COUNTY,Shooting,04/12/20. 09:18 PM.
wa-yakima+county,S OLDENWAY RD YAKIMA COUNTY,Other,04/12/20. 07:49 PM.
wa-yakima+county,SUMMITVIEW RD YAKIMA COUNTY,Shooting,04/12/20. 07:22 PM.
wa-yakima+county,HOFFER RD YAKIMA COUNTY,Other,04/12/20. 06:59 PM.
wa-yakima+county,HARRAH RD YAKIMA COUNTY,Other,04/12/20. 05:53 PM.
wa-yakima+county,FRENCH'S CANYON YAKIMA COUNTY,Other,04/12/20. 04:52 PM.
wa-yakima+county,SOUTHERN AVE YAKIMA COUNTY,Other,04/12/20. 05:18 PM.
wa-yakima+county,NUKSHAY DR; U:65 YAKIMA COUNTY,Assault,04/12/20. 04:31 PM.
wa-yakima+county,S FORK RD YAKIMA COUNTY,Other,04/12/20. 02:30 PM.
wa-yakima+county,ALEXANDER RD YAKIMA COUNTY,Theft,04/12/20. 11:35 AM.
wa-yakima+county,VAN BELLE RD YAKIMA COUNTY,Vandalism,04/12/20. 09:31 AM.
wa-yakima+county,S WASCO AVE YAKIMA COUNTY,Other,04/12/20. 05:07 AM.
