Collier County,Source,Location,Number of People,Injured/Dead,Notes
June 1st,https://www.naplesnews.com/story/news/local/2020/06/01/george-floyd-peaceful-protests-rally-honor-george-floyd-collier-county-more-planned/5311531002/,"Naples City Hall, Naples, Collier County, Florida",300,,
June 3rd,https://www.naplesnews.com/story/news/crime/2020/06/04/george-floyd-man-arrested-carrying-ar-15-style-rifle-marco-island-while-protesters-marched/3146270001/,"Collier Boulevard, Marco Island, Collier County, Florida",50,,Pro-Police; anti-blm
June 6th,https://www.naplesnews.com/story/news/local/2020/06/06/more-than-100-protest-racial-justice-north-naples/3154684001/,"Collier Boulevard and Immokalee Road, North Naples, Collier County, Florida",100,,
June 10th,https://www.winknews.com/2020/06/10/organizers-say-protests-are-a-wake-up-call-gather-in-east-naples/,"Collier County Courthouse, Naples, Collier County, Florida","1,000",,
June 13th,https://www.nbc-2.com/story/42244088/protestors-gather-outside-oakes-farms-market-in-naples-after-owner-makes-controversial-posts-on-social-media,"Immokalee Road and Livingston Road, Naples, Collier County, Florida",hundreds,,
July 14th,https://www.fox4now.com/news/local-news/collier-county-protest-calls-for-defunding-sheriffs-office,"Collier County Commission, Collier County, Florida",dozens,,
July 25th,https://www.winknews.com/2020/07/25/protest-in-collier-county-over-racial-injustice/,"Naples, Collier County, Florida",dozens,,