Name,Address,Crime,Date
wv-harrison+county,EMILY DR CLARKSBURG HARRISON COUNTY,Theft,02/01/19. 05:59 PM.
wv-harrison+county,HIGHLAND AVE SUMMIT PARK HARRISON COUNTY,Other,02/01/19. 06:02 PM.
wv-harrison+county,SHINNSTON PKE GORE HARRISON COUNTY,Other,02/01/19. 07:41 PM.
wv-harrison+county,WOODLAND AVE STONEWOOD HARRISON COUNTY,Other,02/01/19. 08:33 PM.
wv-harrison+county,FARNUM RD HEPZIBAH HARRISON COUNTY,Other,02/01/19. 08:54 PM.
wv-harrison+county,HIGHLAND BRIDGE RD WEST MILFORD HARRISON COUNTY,Other,02/01/19. 09:55 PM.
wv-harrison+county,FIELDCREST DR GREEN VALLEY HARRISON COUNTY,Other,02/01/19. 10:21 PM.
wv-harrison+county,GOULD AVE CLARKSBURG HARRISON COUNTY,Other,02/01/19. 11:10 PM.
wv-harrison+county,MEADOWBROOK MALL RD BRIDGEPORT HARRISON COUNTY,Other,02/01/19. 11:13 PM.
wv-harrison+county,S BYPASS RD NUTTER FORT HARRISON COUNTY,Other,02/01/19. 11:25 PM.
wv-harrison+county,S 3RD ST CLARKSBURG HARRISON COUNTY,Other,02/01/19. 12:03 AM.
wv-harrison+county,HOGAN LANE CLARKSBURG HARRISON COUNTY,Other,02/01/19. 12:33 AM.
wv-harrison+county,RT 50 CLARKSBURG HARRISON COUNTY,Other,02/01/19. 12:57 AM.
wv-harrison+county,MAPLE ST LAUREL VALLEY HARRISON COUNTY,Other,02/01/19. 01:52 AM.
wv-harrison+county,PARK BLVD CLARKSBURG HARRISON COUNTY,Other,02/01/19. 02:37 AM.
wv-harrison+county,W MAIN ST BRIDGEPORT HARRISON COUNTY,Other,02/01/19. 02:45 AM.
wv-harrison+county,MILFORD ST CLARKSBURG HARRISON COUNTY,Other,02/01/19. 04:43 AM.
wv-harrison+county,MAPLE ST SHINNSTON HARRISON COUNTY,Other,02/02/19. 05:14 AM.
wv-harrison+county,VALLEY FALLS RD PRUNTYTOWN HARRISON COUNTY,Other,02/02/19. 05:17 AM.
wv-harrison+county,OAKMOUND DR CLARKSBURG HARRISON COUNTY,Other,02/02/19. 07:09 AM.
wv-harrison+county,MARION COUNTY COMMUNITIES MARION COUNTY HARRISON COUNTY,Other,02/02/19. 09:13 AM.
wv-harrison+county,EMILY DR CLARKSBURG HARRISON COUNTY,Theft,02/02/19. 09:14 AM.
wv-harrison+county,COURT ST CLARKSBURG HARRISON COUNTY,Vandalism,02/02/19. 09:31 AM.
wv-harrison+county,MAIN ST GYPSY HARRISON COUNTY,Other,02/02/19. 09:40 AM.
wv-harrison+county,WHITE OAK LN HACKER CREEK HARRISON COUNTY,Other,02/02/19. 10:29 AM.
wv-harrison+county,HOFFMAN AVE CLARKSBURG HARRISON COUNTY,Theft,02/02/19. 11:30 AM.
wv-harrison+county,S 7TH ST CLARKSBURG HARRISON COUNTY,Other,02/02/19. 11:30 AM.
wv-harrison+county,WORLEY AVE CLARKSBURG HARRISON COUNTY,Burglary,02/02/19. 11:50 AM.
wv-harrison+county,WALMART LN GRAFTON HARRISON COUNTY,Assault,02/02/19. 12:21 PM.
wv-harrison+county,MAPLE ST SHINNSTON HARRISON COUNTY,Other,02/02/19. 12:41 PM.
wv-harrison+county,W MAIN ST CLARKSBURG HARRISON COUNTY,Other,02/02/19. 01:21 PM.
wv-harrison+county,ADAMS AVE CLARKSBURG HARRISON COUNTY,Other,02/02/19. 01:35 PM.
wv-harrison+county,ISAAC CREEK RD GREGORYS RUN HARRISON COUNTY,Assault,02/02/19. 01:45 PM.
wv-harrison+county,N 20TH ST CLARKSBURG HARRISON COUNTY,Other,02/02/19. 01:49 PM.
wv-harrison+county,OAKMOUND DR CLARKSBURG HARRISON COUNTY,Other,02/02/19. 01:52 PM.
wv-harrison+county,BUMBLEBEE LN LUMBERPORT HARRISON COUNTY,Burglary,02/02/19. 01:59 PM.
wv-harrison+county,OAKMOUND DR CLARKSBURG HARRISON COUNTY,Other,02/02/19. 03:03 PM.
wv-harrison+county,COLUMBIA BLVD CLARKSBURG HARRISON COUNTY,Other,02/02/19. 03:25 PM.
wv-harrison+county,S CHESTNUT ST CLARKSBURG HARRISON COUNTY,Other,02/02/19. 03:50 PM.
wv-harrison+county,E MAIN ST SALEM HARRISON COUNTY,Theft,02/02/19. 03:49 PM.
wv-harrison+county,HARMANS CTR GRAFTON HARRISON COUNTY,Other,02/02/19. 03:50 PM.
wv-harrison+county,GEORGE WASHINGTON HWY GRAFTON HARRISON COUNTY,Assault,02/02/19. 04:07 PM.
wv-harrison+county,N 20TH ST CLARKSBURG HARRISON COUNTY,Other,02/02/19. 05:40 PM.
wv-harrison+county,HOOD AVE ENTERPRISE HARRISON COUNTY,Assault,02/02/19. 05:48 PM.
wv-harrison+county,BIRCH ST BRIDGEPORT HARRISON COUNTY,Assault,02/02/19. 05:49 PM.
wv-harrison+county,GAIN ST SALEM HARRISON COUNTY,Other,02/02/19. 05:58 PM.
wv-harrison+county,MARTYS PARK DR MEADOWBROOK HARRISON COUNTY,Other,02/02/19. 06:31 PM.
wv-harrison+county,GEORGE WASHINGTON HWY PRUNTYTOWN HARRISON COUNTY,Other,02/02/19. 06:35 PM.
wv-harrison+county,MEADOWBROOK RD MEADOWBROOK HARRISON COUNTY,Burglary,02/02/19. 06:39 PM.
wv-harrison+county,S VIRGINIA AVE BRIDGEPORT HARRISON COUNTY,Theft,02/02/19. 06:44 PM.
wv-harrison+county,N PIKE ST GRAFTON HARRISON COUNTY,Other,02/02/19. 07:17 PM.
wv-harrison+county,N 18TH ST CLARKSBURG HARRISON COUNTY,Burglary,02/02/19. 07:31 PM.
wv-harrison+county,EMILY DR CLARKSBURG HARRISON COUNTY,Theft,02/02/19. 07:36 PM.
wv-harrison+county,BRIGHTON CIRCLE RD COUNTRY CLUB HARRISON COUNTY,Other,02/02/19. 07:55 PM.
wv-harrison+county,TRAP SPRINGS RD GRAFTON HARRISON COUNTY,Other,02/02/19. 08:15 PM.
wv-harrison+county,RT 119 (T1) S 250 BARBOUR WEBSTER HARRISON COUNTY,Other,02/02/19. 08:51 PM.
wv-harrison+county,MURPHY RUN SUMMIT PARK HARRISON COUNTY,Other,02/02/19. 08:57 PM.
wv-harrison+county,WEBSTER PKE WEBSTER HARRISON COUNTY,Other,02/02/19. 10:09 PM.
wv-harrison+county,EMILY DR CLARKSBURG HARRISON COUNTY,Theft,02/02/19. 10:14 PM.
wv-harrison+county,ROOSEVELT ST SHINNSTON HARRISON COUNTY,Other,02/02/19. 10:19 PM.
wv-harrison+county,N OHIO AVE CLARKSBURG HARRISON COUNTY,Other,02/02/19. 10:21 PM.
wv-harrison+county,WALNUT ST LAUREL VALLEY HARRISON COUNTY,Other,02/02/19. 10:30 PM.
wv-harrison+county,CALDWELL RD ERIE HARRISON COUNTY,Burglary,02/02/19. 10:43 PM.
wv-harrison+county,EMILY DR CLARKSBURG HARRISON COUNTY,Other,02/02/19. 10:51 PM.
wv-harrison+county,EMILY DR CLARKSBURG HARRISON COUNTY,Theft,02/02/19. 11:01 PM.
wv-harrison+county,SHUTTLESWORTH ST CLARKSBURG HARRISON COUNTY,Other,02/02/19. 11:12 PM.
wv-harrison+county,BURTON AVE NUTTER FORT HARRISON COUNTY,Other,02/02/19. 12:36 AM.
wv-harrison+county,LOCUST AVE CLARKSBURG HARRISON COUNTY,Other,02/02/19. 01:05 AM.
wv-harrison+county,MAPLE ST SHINNSTON HARRISON COUNTY,Burglary,02/02/19. 01:39 AM.
wv-harrison+county,RAILROAD ST BRIDGEPORT HARRISON COUNTY,Assault,02/02/19. 01:40 AM.
wv-harrison+county,GOULD AVE CLARKSBURG HARRISON COUNTY,Other,02/02/19. 02:54 AM.
wv-harrison+county,HARVEY ST SHINNSTON HARRISON COUNTY,Other,02/02/19. 03:55 AM.
wv-harrison+county,GOULD AVE CLARKSBURG HARRISON COUNTY,Other,02/02/19. 04:12 AM.
wv-harrison+county,N 20TH ST AND AND WILLIAMS AVE CLARKSBURG HARRISON COUNTY,Other,02/02/19. 04:28 AM.
wv-harrison+county,KENDALL DR GRAFTON HARRISON COUNTY,Other,02/03/19. 07:44 AM.
wv-harrison+county,WOODLAND LN QUIET DELL HARRISON COUNTY,Other,02/03/19. 07:52 AM.
wv-harrison+county,ROGERS ST LUMBERPORT HARRISON COUNTY,Other,02/03/19. 09:24 AM.
wv-harrison+county,EMILY DR CLARKSBURG HARRISON COUNTY,Other,02/03/19. 09:50 AM.
wv-harrison+county,N 20TH ST CLARKSBURG HARRISON COUNTY,Other,02/03/19. 09:56 AM.
wv-harrison+county,HOOD AVE ENTERPRISE HARRISON COUNTY,Other,02/03/19. 10:31 AM.
wv-harrison+county,S CHESTNUT ST CLARKSBURG HARRISON COUNTY,Other,02/03/19. 11:17 AM.
wv-harrison+county,HAMILL AVE CLARKSBURG HARRISON COUNTY,Other,02/03/19. 11:33 AM.
wv-harrison+county,BICES RUN RD PINE BLUFF HARRISON COUNTY,Other,02/03/19. 12:08 PM.
wv-harrison+county,HOFFMAN AVE CLARKSBURG HARRISON COUNTY,Other,02/03/19. 12:22 PM.
wv-harrison+county,N 4TH ST CLARKSBURG HARRISON COUNTY,Other,02/03/19. 12:27 PM.
wv-harrison+county,E PIKE ST CLARKSBURG HARRISON COUNTY,Other,02/03/19. 01:23 PM.
wv-harrison+county,WINDING WAY CLARKSBURG HARRISON COUNTY,Other,02/03/19. 02:09 PM.
wv-harrison+county,JOYCE ST CLARKSBURG HARRISON COUNTY,Other,02/03/19. 02:15 PM.
wv-harrison+county,MOUNT CLARE RD MOUNT CLARE HARRISON COUNTY,Other,02/03/19. 02:33 PM.
wv-harrison+county,DUFF AVE CLARKSBURG HARRISON COUNTY,Other,02/03/19. 02:41 PM.
wv-harrison+county,ZACKS RUN RD QUIET DELL HARRISON COUNTY,Other,02/03/19. 03:11 PM.
wv-harrison+county,SIMMONS LN CAMBRIA HARRISON COUNTY,Theft,02/03/19. 03:42 PM.
wv-harrison+county,LOCUST AVE CLARKSBURG HARRISON COUNTY,Other,02/03/19. 04:16 PM.
wv-harrison+county,LAYTON DR EAST VIEW HARRISON COUNTY,Other,02/03/19. 04:16 PM.
wv-harrison+county,CARPENTER ST CLARKSBURG HARRISON COUNTY,Other,02/03/19. 05:31 PM.
wv-harrison+county,WALMART LN GRAFTON HARRISON COUNTY,Theft,02/03/19. 05:58 PM.
wv-harrison+county,DUFF AVE CLARKSBURG HARRISON COUNTY,Vandalism,02/03/19. 06:02 PM.
wv-harrison+county,EMILY DR CLARKSBURG HARRISON COUNTY,Theft,02/03/19. 06:07 PM.
wv-harrison+county,LOWER DOG RUN LAKE SALEM HARRISON COUNTY,Other,02/03/19. 06:13 PM.
wv-harrison+county,HEPZIBAH HEIGHTS RD HEPZIBAH HARRISON COUNTY,Theft,02/03/19. 06:33 PM.
wv-harrison+county,MAIN ST LUMBERPORT HARRISON COUNTY,Other,02/03/19. 06:38 PM.
wv-harrison+county,BUCKHANNON PKE NUTTER FORT HARRISON COUNTY,Other,02/03/19. 07:17 PM.
wv-harrison+county,FITTRO AVE CLARKSBURG HARRISON COUNTY,Other,02/03/19. 07:25 PM.
wv-harrison+county,MILFORD ST CLARKSBURG HARRISON COUNTY,Theft,02/03/19. 07:28 PM.
wv-harrison+county,MEDICAL PARK DR BRIDGEPORT HARRISON COUNTY,Theft,02/03/19. 07:29 PM.
wv-harrison+county,EMILY DR CLARKSBURG HARRISON COUNTY,Other,02/03/19. 08:14 PM.
wv-harrison+county,ENTERPRISE RD ENTERPRISE HARRISON COUNTY,Vandalism,02/03/19. 08:20 PM.
wv-harrison+county,MORITZ AVE GRAFTON HARRISON COUNTY,Other,02/03/19. 09:12 PM.
wv-harrison+county,THOMPSON DR BRIDGEPORT HARRISON COUNTY,Other,02/03/19. 09:18 PM.
wv-harrison+county,RT 19@ GYPSY HILL RD SHINNSTON HARRISON COUNTY,Other,02/03/19. 09:34 PM.
wv-harrison+county,VERMONT AVE CLARKSBURG HARRISON COUNTY,Other,02/03/19. 09:55 PM.
wv-harrison+county,LUCAS DAIRY RD GRAFTON HARRISON COUNTY,Other,02/03/19. 10:28 PM.
wv-harrison+county,LUCAS DAIRY RD GRAFTON HARRISON COUNTY,Other,02/03/19. 10:28 PM.
wv-harrison+county,OAKMOUND DR CLARKSBURG HARRISON COUNTY,Other,02/03/19. 11:40 PM.
wv-harrison+county,BUCKHANNON PKE CRAIGMOOR HARRISON COUNTY,Other,02/03/19. 12:44 AM.
wv-harrison+county,SHINNSTON PKE ERIE HARRISON COUNTY,Other,02/03/19. 01:03 AM.
wv-harrison+county,SHINNSTON PKE CLARKSBURG HARRISON COUNTY,Burglary,02/03/19. 01:13 AM.
wv-harrison+county,LONG ST BRIDGEPORT HARRISON COUNTY,Other,02/03/19. 01:54 AM.
wv-harrison+county,HEWES AVE CLARKSBURG HARRISON COUNTY,Other,02/03/19. 01:56 AM.
wv-harrison+county,I79 123 MILE MARKER BRIDGEPORT HARRISON COUNTY,Other,02/03/19. 02:13 AM.
wv-harrison+county,W PIKE ST CLARKSBURG HARRISON COUNTY,Other,02/03/19. 03:04 AM.
wv-harrison+county,WASHINGTON AVE CLARKSBURG HARRISON COUNTY,Burglary,02/04/19. 05:02 AM.
wv-harrison+county,GAIN ST SALEM HARRISON COUNTY,Other,02/04/19. 05:15 AM.
wv-harrison+county,STONEYBROOK RD CLARKSBURG HARRISON COUNTY,Theft,02/04/19. 06:29 AM.
wv-harrison+county,FORRESTER BLVD BRIDGEPORT HARRISON COUNTY,Other,02/04/19. 06:34 AM.
wv-harrison+county,GAIN ST SALEM HARRISON COUNTY,Other,02/04/19. 06:36 AM.
wv-harrison+county,GAIN ST SALEM HARRISON COUNTY,Other,02/04/19. 08:54 AM.
wv-harrison+county,VINEYARD PL BRIDGEPORT HARRISON COUNTY,Other,02/04/19. 09:16 AM.
wv-harrison+county,W PIKE ST CLARKSBURG HARRISON COUNTY,Other,02/04/19. 09:33 AM.
wv-harrison+county,HILLBILLY LN HEPZIBAH HARRISON COUNTY,Theft,02/04/19. 11:06 AM.
wv-harrison+county,EMILY DR CLARKSBURG HARRISON COUNTY,Assault,02/04/19. 12:40 PM.
wv-harrison+county,MORITZ AVE GRAFTON HARRISON COUNTY,Other,02/04/19. 12:56 PM.
wv-harrison+county,GOFF AVE CLARKSBURG HARRISON COUNTY,Burglary,02/04/19. 01:11 PM.
wv-harrison+county,BUCKHANNON PKE NUTTER FORT HARRISON COUNTY,Other,02/04/19. 01:59 PM.
wv-harrison+county,PIKE ST SHINNSTON HARRISON COUNTY,Theft,02/04/19. 02:03 PM.
wv-harrison+county,LOST CREEK ROMINES MILL RD LOST CREEK HARRISON COUNTY,Other,02/04/19. 02:07 PM.
wv-harrison+county,LIBERTY AVE CLARKSBURG HARRISON COUNTY,Vandalism,02/04/19. 02:06 PM.
wv-harrison+county,W MAIN ST CLARKSBURG HARRISON COUNTY,Other,02/04/19. 02:51 PM.
wv-harrison+county,MILFORD ST CLARKSBURG HARRISON COUNTY,Other,02/04/19. 02:53 PM.
wv-harrison+county,KENWOOD PL CLARKSBURG HARRISON COUNTY,Other,02/04/19. 03:33 PM.
wv-harrison+county,EMILY DR CLARKSBURG HARRISON COUNTY,Other,02/04/19. 03:44 PM.
wv-harrison+county,MEADOWBROOK MALL RD BRIDGEPORT HARRISON COUNTY,Other,02/04/19. 03:53 PM.
wv-harrison+county,PLAINFIELD AVE ANMOORE HARRISON COUNTY,Burglary,02/04/19. 04:04 PM.
wv-harrison+county,BUCKHANNON PKE NUTTER FORT HARRISON COUNTY,Theft,02/04/19. 04:19 PM.
wv-harrison+county,GLEN FALLS RD ARLINGTON HARRISON COUNTY,Other,02/04/19. 04:18 PM.
wv-harrison+county,EMILY DR CLARKSBURG HARRISON COUNTY,Theft,02/04/19. 04:20 PM.
wv-harrison+county,W PIKE CLARKSBURG HARRISON COUNTY,Other,02/04/19. 04:22 PM.
wv-harrison+county,W WASHINGTON ST GRAFTON HARRISON COUNTY,Theft,02/04/19. 04:53 PM.
wv-harrison+county,PENNSYLVANIA AVE BRIDGEPORT HARRISON COUNTY,Vandalism,02/04/19. 05:06 PM.
wv-harrison+county,4TH ST BRIDGE CLARKSBURG HARRISON COUNTY,Other,02/04/19. 05:27 PM.
wv-harrison+county,S PIKE ST SHINNSTON HARRISON COUNTY,Other,02/04/19. 05:45 PM.
wv-harrison+county,I79 119 MILE MARKER BRIDGEPORT HILL HARRISON COUNTY,Other,02/04/19. 05:54 PM.
wv-harrison+county,RT 50 W EMILY DR TO BPT HILL CLARKSBURG HARRISON COUNTY,Other,02/04/19. 06:11 PM.
wv-harrison+county,CRISLIP AVE CLARKSBURG HARRISON COUNTY,Theft,02/04/19. 06:52 PM.
wv-harrison+county,KERZAK LN CAMBRIA HARRISON COUNTY,Other,02/04/19. 06:55 PM.
wv-harrison+county,HOOD AVE ENTERPRISE HARRISON COUNTY,Vandalism,02/04/19. 07:03 PM.
wv-harrison+county,EMILY DR CLARKSBURG HARRISON COUNTY,Theft,02/04/19. 07:10 PM.
wv-harrison+county,FACTORY ST SUMMIT PARK HARRISON COUNTY,Other,02/04/19. 07:15 PM.
wv-harrison+county,CARPENTER ST CLARKSBURG HARRISON COUNTY,Other,02/04/19. 07:16 PM.
wv-harrison+county,HAYMOND HWY CLARKSBURG HARRISON COUNTY,Other,02/04/19. 08:05 PM.
wv-harrison+county,EMILY DR CAVA DR TO ANMOORE CLARKSBURG HARRISON COUNTY,Other,02/04/19. 08:38 PM.
wv-harrison+county,OSAGE CT CLARKSBURG HARRISON COUNTY,Other,02/04/19. 08:53 PM.
wv-harrison+county,BATTLE RUN RD ROCK CAMP HARRISON COUNTY,Other,02/04/19. 08:58 PM.
wv-harrison+county,S 22ND ST CLARKSBURG HARRISON COUNTY,Other,02/04/19. 09:12 PM.
wv-harrison+county,W PIKE ST CLARKSBURG HARRISON COUNTY,Other,02/04/19. 10:18 PM.
wv-harrison+county,WATER ST SALEM HARRISON COUNTY,Other,02/04/19. 10:58 PM.
wv-harrison+county,ARTHUR AVE CLARKSBURG HARRISON COUNTY,Other,02/04/19. 11:05 PM.
wv-harrison+county,RAILROAD ST BRIDGEPORT HARRISON COUNTY,Other,02/04/19. 11:45 PM.
wv-harrison+county,EMILY DR CLARKSBURG HARRISON COUNTY,Other,02/04/19. 11:47 PM.
wv-harrison+county,WICKWIRE RD GRAFTON HARRISON COUNTY,Other,02/04/19. 12:54 AM.
wv-harrison+county,JOHNSON AVE BRIDGEPORT HARRISON COUNTY,Other,02/04/19. 01:51 AM.
wv-harrison+county,ANMOORE RD AND AND I79 ANMOORE HARRISON COUNTY,Other,02/04/19. 04:33 AM.
wv-harrison+county,COBURN FORK RD BRISTOL HARRISON COUNTY,Other,02/05/19. 05:20 AM.
wv-harrison+county,W MAIN ST CLARKSBURG HARRISON COUNTY,Other,02/05/19. 05:29 AM.
wv-harrison+county,ROOSEVELT RD AND AND S CHESTNUT ST CLARKSBURG HARRISON COUNTY,Vandalism,02/05/19. 07:47 AM.
wv-harrison+county,LOST CREEK ROMINES MILL RD LOST CREEK HARRISON COUNTY,Other,02/05/19. 07:49 AM.
wv-harrison+county,MONTICELLO AVE CLARKSBURG HARRISON COUNTY,Assault,02/05/19. 08:13 AM.
wv-harrison+county,N 4TH ST CLARKSBURG HARRISON COUNTY,Other,02/05/19. 08:41 AM.
wv-harrison+county,JARVISVILLE RD JARVISVILLE HARRISON COUNTY,Other,02/05/19. 09:10 AM.
wv-harrison+county,ROSEBUD AVE ROSEBUD TRAILER CT HARRISON COUNTY,Vandalism,02/05/19. 09:33 AM.
wv-harrison+county,W MAIN ST CLARKSBURG HARRISON COUNTY,Other,02/05/19. 09:46 AM.
wv-harrison+county,MOUNT CLARE RD MOUNT CLARE HARRISON COUNTY,Other,02/05/19. 10:49 AM.
wv-harrison+county,GENESIS BLVD BRIDGEPORT HARRISON COUNTY,Other,02/05/19. 10:51 AM.
wv-harrison+county,STONEYBROOK RD CLARKSBURG HARRISON COUNTY,Other,02/05/19. 11:02 AM.
wv-harrison+county,HAMILL AVE CLARKSBURG HARRISON COUNTY,Other,02/05/19. 11:04 AM.
wv-harrison+county,E PIKE ST CLARKSBURG HARRISON COUNTY,Other,02/05/19. 11:11 AM.
wv-harrison+county,CRISLIP AVE CLARKSBURG HARRISON COUNTY,Other,02/05/19. 11:21 AM.
wv-harrison+county,ROSEBUD AVE ROSEBUD TRAILER CT HARRISON COUNTY,Other,02/05/19. 12:01 PM.
wv-harrison+county,E MAIN ST SALEM HARRISON COUNTY,Other,02/05/19. 12:58 PM.
wv-harrison+county,OWINGS RD OWINGS HARRISON COUNTY,Other,02/05/19. 01:04 PM.
wv-harrison+county,W PIKE ST CLARKSBURG HARRISON COUNTY,Other,02/05/19. 01:11 PM.
wv-harrison+county,S 7TH ST CLARKSBURG HARRISON COUNTY,Other,02/05/19. 01:17 PM.
wv-harrison+county,W MAIN ST CLARKSBURG HARRISON COUNTY,Theft,02/05/19. 01:17 PM.
wv-harrison+county,DUFF AVE CLARKSBURG HARRISON COUNTY,Theft,02/05/19. 01:17 PM.
wv-harrison+county,MAGNOLIA AVE CLARKSBURG HARRISON COUNTY,Vandalism,02/05/19. 01:59 PM.
wv-harrison+county,W MAIN ST CLARKSBURG HARRISON COUNTY,Other,02/05/19. 01:59 PM.
wv-harrison+county,WILLARD RD WILLARD HARRISON COUNTY,Other,02/05/19. 03:05 PM.
wv-harrison+county,MILFORD ST AND AND LIBERTY AVE CLARKSBURG HARRISON COUNTY,Other,02/05/19. 03:13 PM.
wv-harrison+county,HORNORS RUN RD ADAMSVILLE HARRISON COUNTY,Assault,02/05/19. 03:51 PM.
wv-harrison+county,HOWARD ST SHINNSTON HARRISON COUNTY,Burglary,02/05/19. 04:09 PM.
wv-harrison+county,S PIKE ST SHINNSTON HARRISON COUNTY,Other,02/05/19. 04:21 PM.
wv-harrison+county,FARNUM RD HEPZIBAH HARRISON COUNTY,Theft,02/05/19. 04:21 PM.
wv-harrison+county,HENDERSON AVE CLARKSBURG HARRISON COUNTY,Other,02/05/19. 04:40 PM.
wv-harrison+county,N 4TH ST CLARKSBURG HARRISON COUNTY,Other,02/05/19. 04:59 PM.
wv-harrison+county,AUSTIN AVE CLARKSBURG HARRISON COUNTY,Assault,02/05/19. 05:01 PM.
wv-harrison+county,W PIKE ST CLARKSBURG HARRISON COUNTY,Other,02/05/19. 05:04 PM.
wv-harrison+county,N OHIO AVE CLARKSBURG HARRISON COUNTY,Other,02/05/19. 05:09 PM.
wv-harrison+county,5TH ST SPELTER HARRISON COUNTY,Vandalism,02/05/19. 05:18 PM.
wv-harrison+county,GAIN ST SALEM HARRISON COUNTY,Theft,02/05/19. 05:22 PM.
wv-harrison+county,N OHIO AVE CLARKSBURG HARRISON COUNTY,Theft,02/05/19. 05:31 PM.
wv-harrison+county,W PIKE ST CLARKSBURG HARRISON COUNTY,Other,02/05/19. 06:34 PM.
wv-harrison+county,WALNUT ST CLARKSBURG HARRISON COUNTY,Assault,02/05/19. 06:42 PM.
wv-harrison+county,S PIKE ST SHINNSTON HARRISON COUNTY,Other,02/05/19. 06:46 PM.
wv-harrison+county,AUSTIN AVE CLARKSBURG HARRISON COUNTY,Other,02/05/19. 06:49 PM.
wv-harrison+county,EMILY DR CLARKSBURG HARRISON COUNTY,Theft,02/05/19. 06:52 PM.
wv-harrison+county,N OHIO AVE CLARKSBURG HARRISON COUNTY,Other,02/05/19. 07:38 PM.
wv-harrison+county,LOOKOUT LN SPELTER HARRISON COUNTY,Other,02/05/19. 08:21 PM.
wv-harrison+county,SHINNSTON PKE CLARKSBURG HARRISON COUNTY,Other,02/05/19. 08:46 PM.
wv-harrison+county,GEORGE WASHINGTON HWY PRUNTYTOWN HARRISON COUNTY,Assault,02/05/19. 09:13 PM.
wv-harrison+county,GOULD AVE CLARKSBURG HARRISON COUNTY,Other,02/05/19. 09:15 PM.
wv-harrison+county,N 15TH ST CLARKSBURG HARRISON COUNTY,Other,02/05/19. 09:52 PM.
wv-harrison+county,FRANCIS MINE RD FRANCIS MINES HARRISON COUNTY,Other,02/05/19. 09:56 PM.
wv-harrison+county,COAL RD MCWHORTER HARRISON COUNTY,Other,02/05/19. 10:03 PM.
wv-harrison+county,E MAIN ST BROADWAY HARRISON COUNTY,Other,02/05/19. 10:34 PM.
wv-harrison+county,N 26TH ST CLARKSBURG HARRISON COUNTY,Theft,02/05/19. 11:07 PM.
wv-harrison+county,HAMILL AVE CLARKSBURG HARRISON COUNTY,Assault,02/05/19. 12:19 AM.
wv-harrison+county,WERNINGER ST CLARKSBURG HARRISON COUNTY,Other,02/05/19. 12:28 AM.
wv-harrison+county,PLATINUM DR BRIDGEPORT HARRISON COUNTY,Other,02/05/19. 12:34 AM.
wv-harrison+county,BRUSHY FORK RD BARBOUR COUNTY HARRISON COUNTY,Other,02/05/19. 12:31 AM.
wv-harrison+county,N 5TH ST CLARKSBURG HARRISON COUNTY,Other,02/05/19. 12:35 AM.
wv-harrison+county,ARTHUR AVE CLARKSBURG HARRISON COUNTY,Other,02/05/19. 12:34 AM.
wv-harrison+county,WENDYS BRIDGEPORT HARRISON COUNTY,Other,02/05/19. 12:38 AM.
wv-harrison+county,WERNINGER ST CLARKSBURG HARRISON COUNTY,Other,02/05/19. 12:56 AM.
wv-harrison+county,SHELHAMMER LN STONEWOOD HARRISON COUNTY,Other,02/05/19. 01:38 AM.
wv-harrison+county,ARTHUR AVE CLARKSBURG HARRISON COUNTY,Other,02/05/19. 01:37 AM.
wv-harrison+county,E MAIN ST CLARKSBURG HARRISON COUNTY,Other,02/05/19. 01:52 AM.
wv-harrison+county,HUNINGTON BANK CLARKSBURG HARRISON COUNTY,Other,02/05/19. 02:02 AM.
wv-harrison+county,CASINO DR ANMOORE HARRISON COUNTY,Other,02/05/19. 02:07 AM.
wv-harrison+county,N 24TH ST CLARKSBURG HARRISON COUNTY,Burglary,02/05/19. 03:57 AM.
wv-harrison+county,PHILIPPI PKE EAST VIEW HARRISON COUNTY,Other,02/05/19. 04:33 AM.
wv-harrison+county,WILLOW GREENE DR ANMOORE HARRISON COUNTY,Other,02/05/19. 04:39 AM.
wv-harrison+county,SIMPSON RD FLEMINGTON HARRISON COUNTY,Other,02/06/19. 06:44 AM.
wv-harrison+county,EMILY DR CLARKSBURG HARRISON COUNTY,Other,02/06/19. 07:01 AM.
wv-harrison+county,BUCKHANNON PKE QUIET DELL HARRISON COUNTY,Other,02/06/19. 07:09 AM.
wv-harrison+county,W MAIN ST CLARKSBURG HARRISON COUNTY,Assault,02/06/19. 08:04 AM.
wv-harrison+county,BENEDUM DR BRIDGEPORT HARRISON COUNTY,Theft,02/06/19. 08:04 AM.
wv-harrison+county,N 3RD ST CLARKSBURG HARRISON COUNTY,Other,02/06/19. 08:33 AM.
wv-harrison+county,DRUMMOND ST CLARKSBURG HARRISON COUNTY,Other,02/06/19. 09:45 AM.
wv-harrison+county,BROADWAY AVE CLARKSBURG HARRISON COUNTY,Theft,02/06/19. 09:50 AM.
wv-harrison+county,WILLOW GREENE DR ANMOORE HARRISON COUNTY,Other,02/06/19. 09:55 AM.
wv-harrison+county,LIBERTY ST LOST CREEK HARRISON COUNTY,Assault,02/06/19. 11:46 AM.
wv-harrison+county,LOCUSTVIEW DR CLARKSBURG HARRISON COUNTY,Theft,02/06/19. 11:47 AM.
wv-harrison+county,JOHNSON AVE BRIDGEPORT HARRISON COUNTY,Other,02/06/19. 11:59 AM.
wv-harrison+county,E MAIN ST CLARKSBURG HARRISON COUNTY,Assault,02/06/19. 12:42 PM.
wv-harrison+county,BUCKHANNON AVE CLARKSBURG HARRISON COUNTY,Assault,02/06/19. 12:48 PM.
wv-harrison+county,W MAIN ST CLARKSBURG HARRISON COUNTY,Assault,02/06/19. 12:53 PM.
wv-harrison+county,HAWK HWY WEST MILFORD HARRISON COUNTY,Other,02/06/19. 01:00 PM.
wv-harrison+county,CAPITOL AVE CLARKSBURG HARRISON COUNTY,Other,02/06/19. 01:13 PM.
wv-harrison+county,SYCAMORE ST CLARKSBURG HARRISON COUNTY,Other,02/06/19. 01:19 PM.
wv-harrison+county,BARNETTS RUN RD BRIDGEPORT HARRISON COUNTY,Other,02/06/19. 01:24 PM.
wv-harrison+county,EMILY DR CLARKSBURG HARRISON COUNTY,Theft,02/06/19. 01:38 PM.
wv-harrison+county,BARNETTS RUN RD BRIDGEPORT HARRISON COUNTY,Other,02/06/19. 02:22 PM.
wv-harrison+county,BUCKHANNON PKE NUTTER FORT HARRISON COUNTY,Theft,02/06/19. 02:36 PM.
wv-harrison+county,W WILFORD ST GRAFTON HARRISON COUNTY,Other,02/06/19. 02:56 PM.
wv-harrison+county,W MAIN ST CLARKSBURG HARRISON COUNTY,Theft,02/06/19. 03:08 PM.
wv-harrison+county,BENEDUM DR BRIDGEPORT HARRISON COUNTY,Theft,02/06/19. 03:16 PM.
wv-harrison+county,COLEMAN AVE CLARKSBURG HARRISON COUNTY,Other,02/06/19. 04:03 PM.
wv-harrison+county,OAK ST ANMOORE HARRISON COUNTY,Other,02/06/19. 04:09 PM.
wv-harrison+county,EMILY DR CLARKSBURG HARRISON COUNTY,Theft,02/06/19. 04:37 PM.
wv-harrison+county,SUN VALLEY RD SUN VALLEY HARRISON COUNTY,Other,02/06/19. 04:58 PM.
wv-harrison+county,WOODLAND DR BRIDGEPORT HARRISON COUNTY,Other,02/06/19. 05:30 PM.
wv-harrison+county,MANDAN RD CLARKSBURG HARRISON COUNTY,Burglary,02/06/19. 05:41 PM.
wv-harrison+county,EMILY DR CLARKSBURG HARRISON COUNTY,Theft,02/06/19. 05:43 PM.
wv-harrison+county,W PIKE ST CLARKSBURG HARRISON COUNTY,Other,02/06/19. 05:43 PM.
wv-harrison+county,W MAIN ST CLARKSBURG HARRISON COUNTY,Other,02/06/19. 05:44 PM.
wv-harrison+county,RT 50 (52) LINE AFG RD ROADWAY BRIDGEPORT HARRISON COUNTY,Other,02/06/19. 06:04 PM.
wv-harrison+county,MEADOWBROOK MALL RD BRIDGEPORT HARRISON COUNTY,Other,02/06/19. 06:25 PM.
wv-harrison+county,DALE AVE CLARKSBURG HARRISON COUNTY,Other,02/06/19. 06:31 PM.
wv-harrison+county,MAIN ST GYPSY HARRISON COUNTY,Other,02/06/19. 06:38 PM.
wv-harrison+county,BUCKHANNON AVE CLARKSBURG HARRISON COUNTY,Other,02/06/19. 06:56 PM.
wv-harrison+county,LIGHTNER ST STONEWOOD HARRISON COUNTY,Other,02/06/19. 08:21 PM.
wv-harrison+county,S PIKE ST SHINNSTON HARRISON COUNTY,Other,02/06/19. 08:47 PM.
wv-harrison+county,GOFF AVE CLARKSBURG HARRISON COUNTY,Burglary,02/06/19. 09:09 PM.
wv-harrison+county,EMILY DR RT 50 TO CAVA DR CLARKSBURG HARRISON COUNTY,Other,02/06/19. 10:27 PM.
wv-harrison+county,VA STRAIGHT CLARKSBURG HARRISON COUNTY,Assault,02/06/19. 11:09 PM.
wv-harrison+county,RAILROAD ST BRIDGEPORT HARRISON COUNTY,Other,02/06/19. 11:43 PM.
wv-harrison+county,I79 117 MILE MARKER ANMOORE HARRISON COUNTY,Other,02/06/19. 11:46 PM.
wv-harrison+county,EMILY DR CLARKSBURG HARRISON COUNTY,Other,02/06/19. 11:47 PM.
wv-harrison+county,POINT ST CLARKSBURG HARRISON COUNTY,Other,02/06/19. 11:53 PM.
wv-harrison+county,EMILY DR CLARKSBURG HARRISON COUNTY,Other,02/06/19. 12:37 AM.
wv-harrison+county,TURKEY RUN RD CENTER BRANCH HARRISON COUNTY,Other,02/06/19. 12:40 AM.
wv-harrison+county,S 5TH ST CLARKSBURG HARRISON COUNTY,Other,02/06/19. 12:54 AM.
wv-harrison+county,WASHINGTON AVE CLARKSBURG HARRISON COUNTY,Burglary,02/06/19. 01:11 AM.
wv-harrison+county,LONG ST BRIDGEPORT HARRISON COUNTY,Other,02/06/19. 01:41 AM.
wv-harrison+county,RT 19 (23) VA-ROSEBUD PLAZA CLARKSBURG HARRISON COUNTY,Other,02/06/19. 03:01 AM.
wv-harrison+county,LEE AVE CLARKSBURG HARRISON COUNTY,Other,02/06/19. 03:02 AM.
wv-harrison+county,WINDING WAY CLARKSBURG HARRISON COUNTY,Other,02/06/19. 04:03 AM.
wv-harrison+county,W PIKE ST CLARKSBURG HARRISON COUNTY,Other,02/06/19. 04:20 AM.
wv-harrison+county,BARNETTS RUN RD BRIDGEPORT HARRISON COUNTY,Other,02/07/19. 08:40 AM.
wv-harrison+county,MINERAL RD KINCHELOE HARRISON COUNTY,Vandalism,02/07/19. 09:34 AM.
wv-harrison+county,YATES AVE GRAFTON HARRISON COUNTY,Assault,02/07/19. 09:35 AM.
wv-harrison+county,W MAIN ST CLARKSBURG HARRISON COUNTY,Other,02/07/19. 09:55 AM.
wv-harrison+county,TRI COUNTY DR BOOTHSVILLE HARRISON COUNTY,Other,02/07/19. 10:11 AM.
wv-harrison+county,BRIDGEPORT CITY BRIDGEPORT HARRISON COUNTY,Other,02/07/19. 10:21 AM.
