Name,Address,Crime,Date
wv-harrison+county,S 3RD ST CLARKSBURG HARRISON COUNTY,Assault,03/17/19. 02:27 PM.
wv-harrison+county,HILL RUN RD- N SECTOR BRIDGEPORT HARRISON COUNTY,Other,03/17/19. 02:43 PM.
wv-harrison+county,LOCUSTVIEW DR CLARKSBURG HARRISON COUNTY,Other,03/17/19. 02:42 PM.
wv-harrison+county,CHICKEN FARM RD REYNOLDSVILLE HARRISON COUNTY,Theft,03/17/19. 03:45 PM.
wv-harrison+county,N 4TH ST CLARKSBURG HARRISON COUNTY,Assault,03/17/19. 03:51 PM.
wv-harrison+county,MULBERRY AVE CLARKSBURG HARRISON COUNTY,Other,03/17/19. 04:08 PM.
wv-harrison+county,WINDING WAY CLARKSBURG HARRISON COUNTY,Other,03/17/19. 04:15 PM.
wv-harrison+county,HEWES AVE CLARKSBURG HARRISON COUNTY,Other,03/17/19. 04:19 PM.
wv-harrison+county,2ND ST GYPSY HARRISON COUNTY,Other,03/17/19. 04:38 PM.
wv-harrison+county,N 4TH ST CLARKSBURG HARRISON COUNTY,Assault,03/17/19. 04:42 PM.
wv-harrison+county,HENNINGS ST GORE HARRISON COUNTY,Assault,03/17/19. 04:49 PM.
wv-harrison+county,HOWARD RUN RD GORE HARRISON COUNTY,Other,03/17/19. 04:48 PM.
wv-harrison+county,GEORGE WASHINGTON HWY BELGIUM HARRISON COUNTY,Other,03/17/19. 04:58 PM.
wv-harrison+county,WILLOW GREENE DR ANMOORE HARRISON COUNTY,Other,03/17/19. 05:23 PM.
wv-harrison+county,DAVISSON RUN RD SUN VALLEY HARRISON COUNTY,Other,03/17/19. 06:19 PM.
wv-harrison+county,WILLOW GREENE DR ANMOORE HARRISON COUNTY,Other,03/17/19. 07:07 PM.
wv-harrison+county,E MAIN ST CLARKSBURG HARRISON COUNTY,Other,03/17/19. 07:29 PM.
wv-harrison+county,EMILY DR CLARKSBURG HARRISON COUNTY,Other,03/17/19. 07:45 PM.
wv-harrison+county,W PIKE ST CLARKSBURG HARRISON COUNTY,Other,03/17/19. 08:24 PM.
wv-harrison+county,MEDICAL PARK DR BRIDGEPORT HARRISON COUNTY,Other,03/17/19. 08:28 PM.
wv-harrison+county,E PIKE ST CLARKSBURG HARRISON COUNTY,Other,03/17/19. 08:27 PM.
wv-harrison+county,MAGNOLIA AVE CLARKSBURG HARRISON COUNTY,Other,03/17/19. 08:40 PM.
wv-harrison+county,BUCKHANNON PKE NUTTER FORT HARRISON COUNTY,Other,03/17/19. 08:48 PM.
wv-harrison+county,E PIKE ST CLARKSBURG HARRISON COUNTY,Theft,03/17/19. 09:49 PM.
wv-harrison+county,ROCK CAMP RD ROCK CAMP HARRISON COUNTY,Other,03/17/19. 10:19 PM.
wv-harrison+county,SARDIS RD SARDIS HARRISON COUNTY,Other,03/17/19. 10:37 PM.
wv-harrison+county,E MAIN ST GRAFTON HARRISON COUNTY,Other,03/17/19. 10:43 PM.
wv-harrison+county,JAMES ST BRIDGEPORT HARRISON COUNTY,Other,03/17/19. 11:42 PM.
wv-harrison+county,ASH AVE CLARKSBURG HARRISON COUNTY,Other,03/17/19. 12:05 AM.
wv-harrison+county,ADAMS AVE CLARKSBURG HARRISON COUNTY,Other,03/17/19. 12:29 AM.
wv-harrison+county,EMILY DR EASTPOINTE HARRISON COUNTY,Vandalism,03/17/19. 12:30 AM.
wv-harrison+county,MAPLE AVE STONEWOOD HARRISON COUNTY,Other,03/17/19. 12:31 AM.
wv-harrison+county,BEECH ST CLARKSBURG HARRISON COUNTY,Burglary,03/17/19. 12:55 AM.
wv-harrison+county,N VIRGINIA AVE BRIDGEPORT HARRISON COUNTY,Other,03/17/19. 01:24 AM.
wv-harrison+county,W BOYD ST GRAFTON HARRISON COUNTY,Other,03/17/19. 01:56 AM.
wv-harrison+county,S PIKE ST SHINNSTON HARRISON COUNTY,Burglary,03/17/19. 04:08 AM.
wv-harrison+county,WILSON ST CLARKSBURG HARRISON COUNTY,Other,03/18/19. 06:34 AM.
wv-harrison+county,C ST SPELTER HARRISON COUNTY,Other,03/18/19. 07:11 AM.
wv-harrison+county,MAPLE AVE STONEWOOD HARRISON COUNTY,Other,03/18/19. 07:45 AM.
wv-harrison+county,BARNETTS RUN RD BRIDGEPORT HARRISON COUNTY,Other,03/18/19. 08:43 AM.
wv-harrison+county,BLAIR LN STONEWOOD HARRISON COUNTY,Theft,03/18/19. 09:06 AM.
wv-harrison+county,WILSONBURG RD WILSONBURG HARRISON COUNTY,Theft,03/18/19. 09:14 AM.
wv-harrison+county,STONEYBROOK RD CLARKSBURG HARRISON COUNTY,Theft,03/18/19. 09:16 AM.
wv-harrison+county,S WEDGE ST BRIDGEPORT HARRISON COUNTY,Theft,03/18/19. 09:19 AM.
wv-harrison+county,KEYSTONE DR BRIDGEPORT HARRISON COUNTY,Other,03/18/19. 09:39 AM.
wv-harrison+county,DUFF AVE CLARKSBURG HARRISON COUNTY,Other,03/18/19. 09:40 AM.
wv-harrison+county,WHITE OAKS BLVD BRIDGEPORT HARRISON COUNTY,Vandalism,03/18/19. 10:02 AM.
wv-harrison+county,MOUNTAINEER DR CLARKSBURG HARRISON COUNTY,Other,03/18/19. 10:05 AM.
wv-harrison+county,W PIKE ST CLARKSBURG HARRISON COUNTY,Other,03/18/19. 11:01 AM.
wv-harrison+county,OAKMONT LN BRIDGEPORT HARRISON COUNTY,Other,03/18/19. 11:01 AM.
wv-harrison+county,SUMMIT PARK AVE SUMMIT PARK HARRISON COUNTY,Theft,03/18/19. 11:33 AM.
wv-harrison+county,BROADWAY AVE CLARKSBURG HARRISON COUNTY,Theft,03/18/19. 11:45 AM.
wv-harrison+county,W MAIN ST BRIDGEPORT HARRISON COUNTY,Theft,03/18/19. 11:47 AM.
wv-harrison+county,GOULD AVE CLARKSBURG HARRISON COUNTY,Theft,03/18/19. 12:26 PM.
wv-harrison+county,HARTLAND AVE CLARKSBURG HARRISON COUNTY,Theft,03/18/19. 12:33 PM.
wv-harrison+county,JEFFREY AVE GRAFTON HARRISON COUNTY,Assault,03/18/19. 12:48 PM.
wv-harrison+county,WALNUT ST SHINNSTON HARRISON COUNTY,Other,03/18/19. 01:40 PM.
wv-harrison+county,W MAIN ST CLARKSBURG HARRISON COUNTY,Assault,03/18/19. 01:40 PM.
wv-harrison+county,NUTTER FORT PRE OWNED AUTO NUTTER FORT HARRISON COUNTY,Theft,03/18/19. 02:13 PM.
wv-harrison+county,EMILY DR CLARKSBURG HARRISON COUNTY,Theft,03/18/19. 02:18 PM.
wv-harrison+county,TRADERS ALY CLARKSBURG HARRISON COUNTY,Other,03/18/19. 02:45 PM.
wv-harrison+county,OAK ST LAUREL VALLEY HARRISON COUNTY,Vandalism,03/18/19. 02:44 PM.
wv-harrison+county,COST AVE @ CHURCH STONEWOOD HARRISON COUNTY,Other,03/18/19. 02:48 PM.
wv-harrison+county,STONEYBROOK RD CLARKSBURG HARRISON COUNTY,Theft,03/18/19. 03:10 PM.
wv-harrison+county,EMILY DR CLARKSBURG HARRISON COUNTY,Theft,03/18/19. 03:42 PM.
wv-harrison+county,PINE BLUFF RD PINE BLUFF HARRISON COUNTY,Other,03/18/19. 03:53 PM.
wv-harrison+county,E PIKE ST CLARKSBURG HARRISON COUNTY,Theft,03/18/19. 04:46 PM.
wv-harrison+county,KELLY ST CLARKSBURG HARRISON COUNTY,Other,03/18/19. 04:53 PM.
wv-harrison+county,WOODSIDE LN LAKE RIDGE HARRISON COUNTY,Burglary,03/18/19. 05:04 PM.
wv-harrison+county,MATHENY HOLLOW RD MOUNT CLARE HARRISON COUNTY,Theft,03/18/19. 05:36 PM.
wv-harrison+county,RIVERWOOD RD LAUREL VALLEY HARRISON COUNTY,Assault,03/18/19. 06:06 PM.
wv-harrison+county,N 26TH ST CLARKSBURG HARRISON COUNTY,Other,03/18/19. 06:11 PM.
wv-harrison+county,WILLIAMS AVE CLARKSBURG HARRISON COUNTY,Other,03/18/19. 06:28 PM.
wv-harrison+county,BUCKHANNON AVE CLARKSBURG HARRISON COUNTY,Other,03/18/19. 06:32 PM.
wv-harrison+county,WASHINGTON AVE CLARKSBURG HARRISON COUNTY,Theft,03/18/19. 06:50 PM.
wv-harrison+county,MATHENY HOLLOW RD MOUNT CLARE HARRISON COUNTY,Theft,03/18/19. 07:08 PM.
wv-harrison+county,PARKVIEW RD GRAFTON HARRISON COUNTY,Assault,03/18/19. 07:45 PM.
wv-harrison+county,SIMPSON AVE CLARKSBURG HARRISON COUNTY,Other,03/18/19. 08:35 PM.
wv-harrison+county,E PIKE ST CLARKSBURG HARRISON COUNTY,Other,03/18/19. 08:43 PM.
wv-harrison+county,EMILY DRIVE CLARKSBURG HARRISON COUNTY,Other,03/18/19. 09:18 PM.
wv-harrison+county,WASHINGTON AVE CLARKSBURG HARRISON COUNTY,Other,03/18/19. 10:15 PM.
wv-harrison+county,WEST VIRGINIA AVE CLARKSBURG HARRISON COUNTY,Other,03/18/19. 10:54 PM.
wv-harrison+county,W PIKE ST CLARKSBURG HARRISON COUNTY,Assault,03/18/19. 11:05 PM.
wv-harrison+county,HAMILL AVE CLARKSBURG HARRISON COUNTY,Other,03/18/19. 01:13 AM.
wv-harrison+county,DODGE CT CLARKSBURG HARRISON COUNTY,Other,03/18/19. 02:20 AM.
wv-harrison+county,PIKE ST SHINNSTON HARRISON COUNTY,Other,03/19/19. 08:04 AM.
wv-harrison+county,MEADOWBROOK MALL RD BRIDGEPORT HARRISON COUNTY,Theft,03/19/19. 08:42 AM.
wv-harrison+county,N 4TH ST CLARKSBURG HARRISON COUNTY,Assault,03/19/19. 09:05 AM.
wv-harrison+county,N 16TH ST CLARKSBURG HARRISON COUNTY,Other,03/19/19. 09:17 AM.
wv-harrison+county,KNOTTSVILLE RD GRAFTON HARRISON COUNTY,Other,03/19/19. 09:27 AM.
wv-harrison+county,W PIKE ST CLARKSBURG HARRISON COUNTY,Other,03/19/19. 11:16 AM.
wv-harrison+county,4TH ST SPELTER HARRISON COUNTY,Theft,03/19/19. 11:40 AM.
wv-harrison+county,ROSEBUD PLAZA DR CLARKSBURG HARRISON COUNTY,Other,03/19/19. 12:05 PM.
wv-harrison+county,BIG ELK RD WALLACE HARRISON COUNTY,Vandalism,03/19/19. 12:41 PM.
wv-harrison+county,MEADOW VIEW DR LAUREL PARK HARRISON COUNTY,Theft,03/19/19. 12:49 PM.
wv-harrison+county,W MAIN ST BRIDGEPORT HARRISON COUNTY,Theft,03/19/19. 01:00 PM.
wv-harrison+county,E @ OLD BPT HILL CLARKSBURG HARRISON COUNTY,Other,03/19/19. 01:14 PM.
wv-harrison+county,EMILY DR CLARKSBURG HARRISON COUNTY,Other,03/19/19. 01:24 PM.
wv-harrison+county,GROVE AVE CLARKSBURG HARRISON COUNTY,Other,03/19/19. 01:32 PM.
wv-harrison+county,N OHIO AVE CLARKSBURG HARRISON COUNTY,Theft,03/19/19. 01:40 PM.
wv-harrison+county,SARDIS RD SARDIS HARRISON COUNTY,Other,03/19/19. 02:00 PM.
wv-harrison+county,JERRY TOTH DR SHINNSTON HARRISON COUNTY,Assault,03/19/19. 02:50 PM.
wv-harrison+county,MEADOWBROOK MALL RD BRIDGEPORT HARRISON COUNTY,Theft,03/19/19. 03:13 PM.
wv-harrison+county,W MAIN ST BRIDGEPORT HARRISON COUNTY,Vandalism,03/19/19. 04:19 PM.
wv-harrison+county,JOHNSON AVE BRIDGEPORT HARRISON COUNTY,Other,03/19/19. 04:36 PM.
wv-harrison+county,TOMS HILL DR SARDIS HARRISON COUNTY,Other,03/19/19. 05:02 PM.
wv-harrison+county,WOOD VIEW DR SALTWELL HARRISON COUNTY,Theft,03/19/19. 05:13 PM.
wv-harrison+county,S 7TH ST CLARKSBURG HARRISON COUNTY,Other,03/19/19. 05:14 PM.
wv-harrison+county,GROVE AVE CLARKSBURG HARRISON COUNTY,Other,03/19/19. 05:42 PM.
wv-harrison+county,MOUNT CLARE RD MOUNT CLARE HARRISON COUNTY,Assault,03/19/19. 05:45 PM.
wv-harrison+county,WINDEMERE CT QUIET DELL HARRISON COUNTY,Burglary,03/19/19. 05:58 PM.
wv-harrison+county,THOMPSON ST CLARKSBURG HARRISON COUNTY,Other,03/19/19. 06:07 PM.
wv-harrison+county,RT 58 (01) ANM-RENZELLI BLVD AND AND EMILY DR ANMOORE HARRISON COUNTY,Other,03/19/19. 06:17 PM.
wv-harrison+county,ASH ST ANMOORE HARRISON COUNTY,Other,03/19/19. 06:26 PM.
wv-harrison+county,JONES RUN RD LUMBERPORT HARRISON COUNTY,Vandalism,03/19/19. 06:33 PM.
wv-harrison+county,WESTWOOD AVE BRIDGEPORT HARRISON COUNTY,Other,03/19/19. 06:41 PM.
wv-harrison+county,WILLISON ST CLARKSBURG HARRISON COUNTY,Other,03/19/19. 06:50 PM.
wv-harrison+county,S PIKE ST SHINNSTON HARRISON COUNTY,Theft,03/19/19. 06:54 PM.
wv-harrison+county,S 5TH ST CLARKSBURG HARRISON COUNTY,Other,03/19/19. 06:55 PM.
wv-harrison+county,S 7TH ST CLARKSBURG HARRISON COUNTY,Other,03/19/19. 07:15 PM.
wv-harrison+county,PENN ST CLARKSBURG HARRISON COUNTY,Other,03/19/19. 07:33 PM.
wv-harrison+county,W PIKE ST CLARKSBURG HARRISON COUNTY,Other,03/19/19. 07:33 PM.
wv-harrison+county,STONEYBROOK RD CLARKSBURG HARRISON COUNTY,Other,03/19/19. 07:51 PM.
wv-harrison+county,E MAIN ST BRIDGEPORT HARRISON COUNTY,Other,03/19/19. 08:29 PM.
wv-harrison+county,E PIKE ST SUMMIT PARK HARRISON COUNTY,Other,03/19/19. 08:49 PM.
wv-harrison+county,WOODLAWN DR SHINNSTON HARRISON COUNTY,Burglary,03/19/19. 09:15 PM.
wv-harrison+county,W PIKE ST CLARKSBURG HARRISON COUNTY,Other,03/19/19. 09:22 PM.
wv-harrison+county,MILFORD ST CLARKSBURG HARRISON COUNTY,Other,03/19/19. 09:19 PM.
wv-harrison+county,WHITE OAKS BLVD BRIDGEPORT HARRISON COUNTY,Other,03/19/19. 09:25 PM.
wv-harrison+county,MILFORD ST CLARKSBURG HARRISON COUNTY,Other,03/19/19. 10:51 PM.
wv-harrison+county,WORLEY AVE CLARKSBURG HARRISON COUNTY,Other,03/19/19. 11:36 PM.
wv-harrison+county,W PIKE ST CLARKSBURG HARRISON COUNTY,Other,03/19/19. 11:56 PM.
wv-harrison+county,JUNKINS AVE CLARKSBURG HARRISON COUNTY,Other,03/19/19. 01:28 AM.
wv-harrison+county,W MAIN ST BRIDGEPORT HARRISON COUNTY,Other,03/19/19. 01:50 AM.
wv-harrison+county,I79 117 MILE MARKER ANMOORE HARRISON COUNTY,Other,03/19/19. 02:53 AM.
wv-harrison+county,OAKMOUND DR CLARKSBURG HARRISON COUNTY,Other,03/19/19. 03:04 AM.
wv-harrison+county,PARK ST LUMBERPORT HARRISON COUNTY,Theft,03/19/19. 03:45 AM.
wv-harrison+county,COST AVE STONEWOOD HARRISON COUNTY,Other,03/20/19. 07:44 AM.
wv-harrison+county,HOSPITAL PLZ CLARKSBURG HARRISON COUNTY,Other,03/20/19. 09:17 AM.
wv-harrison+county,WORTHINGTON DR BRIDGEPORT HARRISON COUNTY,Vandalism,03/20/19. 10:03 AM.
wv-harrison+county,DOG RUN RD SALEM HARRISON COUNTY,Other,03/20/19. 10:11 AM.
wv-harrison+county,W MAIN ST GRAFTON HARRISON COUNTY,Other,03/20/19. 10:11 AM.
wv-harrison+county,BARNETTS RUN RD BRIDGEPORT HARRISON COUNTY,Theft,03/20/19. 11:02 AM.
wv-harrison+county,HICKMAN ST CLARKSBURG HARRISON COUNTY,Theft,03/20/19. 11:21 AM.
wv-harrison+county,W MAIN ST CLARKSBURG HARRISON COUNTY,Other,03/20/19. 11:22 AM.
wv-harrison+county,TOLLEY DR CLARKSBURG HARRISON COUNTY,Theft,03/20/19. 11:36 AM.
wv-harrison+county,W MAIN ST BRIDGEPORT HARRISON COUNTY,Other,03/20/19. 12:33 PM.
wv-harrison+county,W MAIN ST BRIDGEPORT HARRISON COUNTY,Other,03/20/19. 12:46 PM.
wv-harrison+county,POPLAR AVE CUSTER ADDITION HARRISON COUNTY,Assault,03/20/19. 01:14 PM.
wv-harrison+county,HICKMAN ST CLARKSBURG HARRISON COUNTY,Other,03/20/19. 02:07 PM.
wv-harrison+county,W WASHINGTON ST GRAFTON HARRISON COUNTY,Other,03/20/19. 02:41 PM.
wv-harrison+county,DUFF AVE CLARKSBURG HARRISON COUNTY,Other,03/20/19. 02:41 PM.
wv-harrison+county,STOUT ST BRIDGEPORT HARRISON COUNTY,Other,03/20/19. 02:49 PM.
wv-harrison+county,SYCAMORE ST CLARKSBURG HARRISON COUNTY,Theft,03/20/19. 03:00 PM.
wv-harrison+county,LEE AVE CLARKSBURG HARRISON COUNTY,Theft,03/20/19. 03:06 PM.
wv-harrison+county,MAIN ST WEST MILFORD HARRISON COUNTY,Other,03/20/19. 03:10 PM.
wv-harrison+county,HOFFMAN AVE CLARKSBURG HARRISON COUNTY,Burglary,03/20/19. 04:37 PM.
wv-harrison+county,RIVER RD CLARKSBURG HARRISON COUNTY,Vandalism,03/20/19. 04:51 PM.
wv-harrison+county,BRIDGE ST SALEM HARRISON COUNTY,Assault,03/20/19. 04:55 PM.
wv-harrison+county,HICKMAN ST CLARKSBURG HARRISON COUNTY,Theft,03/20/19. 06:12 PM.
wv-harrison+county,WINDING WAY CLARKSBURG HARRISON COUNTY,Other,03/20/19. 06:44 PM.
wv-harrison+county,EMILY DR CLARKSBURG HARRISON COUNTY,Theft,03/20/19. 06:48 PM.
wv-harrison+county,EMILY DR CLARKSBURG HARRISON COUNTY,Theft,03/20/19. 07:08 PM.
wv-harrison+county,CLAY ST CLARKSBURG HARRISON COUNTY,Assault,03/20/19. 07:37 PM.
wv-harrison+county,RIDGEWAY DR BRIDGEPORT HARRISON COUNTY,Other,03/20/19. 07:41 PM.
wv-harrison+county,ARBUTUS DR CLARKSBURG HARRISON COUNTY,Other,03/20/19. 07:42 PM.
wv-harrison+county,STONEYBROOK RD CLARKSBURG HARRISON COUNTY,Other,03/20/19. 07:46 PM.
wv-harrison+county,HOFFMAN AVE CLARKSBURG HARRISON COUNTY,Burglary,03/20/19. 08:13 PM.
wv-harrison+county,ORAL LAKE RD BRIDGEPORT HARRISON COUNTY,Other,03/20/19. 09:48 PM.
wv-harrison+county,W MAIN ST GRAFTON HARRISON COUNTY,Other,03/20/19. 10:00 PM.
wv-harrison+county,SYCAMORE RD SYCAMORE HARRISON COUNTY,Other,03/20/19. 10:37 PM.
wv-harrison+county,WOOD VIEW DR SALTWELL HARRISON COUNTY,Other,03/20/19. 10:59 PM.
wv-harrison+county,EMILY DR CLARKSBURG HARRISON COUNTY,Theft,03/20/19. 12:01 AM.
wv-harrison+county,PENN ST CLARKSBURG HARRISON COUNTY,Assault,03/20/19. 12:10 AM.
wv-harrison+county,LOWER LAKE BRIDGEPORT HARRISON COUNTY,Other,03/20/19. 12:25 AM.
wv-harrison+county,TOYS R US BRIDGEPORT HARRISON COUNTY,Other,03/20/19. 12:45 AM.
wv-harrison+county,W FRANCIS ST GRAFTON HARRISON COUNTY,Assault,03/20/19. 01:31 AM.
wv-harrison+county,JAMES ST BRIDGEPORT HARRISON COUNTY,Other,03/20/19. 01:40 AM.
wv-harrison+county,TERRY LN SARDIS HARRISON COUNTY,Other,03/20/19. 02:42 AM.
wv-harrison+county,VITO`S CLARKSBURG HARRISON COUNTY,Other,03/20/19. 03:26 AM.
wv-harrison+county,JUNKINS AVE CLARKSBURG HARRISON COUNTY,Other,03/20/19. 04:28 AM.
wv-harrison+county,GOULD AVE CLARKSBURG HARRISON COUNTY,Theft,03/20/19. 04:45 AM.
wv-harrison+county,W MAIN ST GRAFTON HARRISON COUNTY,Other,03/20/19. 04:57 AM.
wv-harrison+county,HEWES AVE CLARKSBURG HARRISON COUNTY,Other,03/21/19. 06:50 AM.
wv-harrison+county,RACCOON RUN RD BRISTOL HARRISON COUNTY,Other,03/21/19. 07:38 AM.
wv-harrison+county,REBECCA ST SHINNSTON HARRISON COUNTY,Other,03/21/19. 08:16 AM.
wv-harrison+county,SIMPSON AVE CLARKSBURG HARRISON COUNTY,Other,03/21/19. 08:47 AM.
wv-harrison+county,FOREST DR MIDDLEVILLE HARRISON COUNTY,Other,03/21/19. 08:54 AM.
wv-harrison+county,LAUREL DR CLARKSBURG HARRISON COUNTY,Assault,03/21/19. 09:01 AM.
wv-harrison+county,SP BARRACKS GRAFTON HARRISON COUNTY,Other,03/21/19. 09:24 AM.
wv-harrison+county,DENHAM ST CLARKSBURG HARRISON COUNTY,Other,03/21/19. 09:30 AM.
wv-harrison+county,FRANKLIN DR LAKE RIDGE HARRISON COUNTY,Other,03/21/19. 09:40 AM.
wv-harrison+county,MAPLEVIEW DR CLARKSBURG HARRISON COUNTY,Theft,03/21/19. 10:27 AM.
wv-harrison+county,W PIKE ST CLARKSBURG HARRISON COUNTY,Other,03/21/19. 10:30 AM.
wv-harrison+county,TITAN ST BOOTHSVILLE HARRISON COUNTY,Theft,03/21/19. 10:56 AM.
wv-harrison+county,EMILY DR CLARKSBURG HARRISON COUNTY,Theft,03/21/19. 11:00 AM.
wv-harrison+county,GOOD HOPE PKE CLARKSBURG HARRISON COUNTY,Other,03/21/19. 11:16 AM.
wv-harrison+county,LAUREL DR CLARKSBURG HARRISON COUNTY,Other,03/21/19. 11:39 AM.
wv-harrison+county,CONFERENCE CENTER WAY BRIDGEPORT HARRISON COUNTY,Other,03/21/19. 12:35 PM.
wv-harrison+county,STONEYBROOK RD CLARKSBURG HARRISON COUNTY,Theft,03/21/19. 01:01 PM.
wv-harrison+county,JOHNSON AVE BRIDGEPORT HARRISON COUNTY,Other,03/21/19. 01:09 PM.
wv-harrison+county,W MAIN ST BRIDGEPORT HARRISON COUNTY,Other,03/21/19. 01:32 PM.
wv-harrison+county,MOUNTAINEER DR CLARKSBURG HARRISON COUNTY,Other,03/21/19. 01:34 PM.
wv-harrison+county,MOUNTAINEER DR CLARKSBURG HARRISON COUNTY,Assault,03/21/19. 01:35 PM.
wv-harrison+county,S 22ND ST CLARKSBURG HARRISON COUNTY,Theft,03/21/19. 01:46 PM.
wv-harrison+county,N 13TH ST CLARKSBURG HARRISON COUNTY,Burglary,03/21/19. 01:48 PM.
wv-harrison+county,RT 50 (08) CITY LIMITS SUN VAL REYNOLDSVILLE HARRISON COUNTY,Other,03/21/19. 01:50 PM.
wv-harrison+county,BARBARA HEIGHTS DR SHINNSTON HARRISON COUNTY,Burglary,03/21/19. 01:53 PM.
wv-harrison+county,MAIN ST GYPSY HARRISON COUNTY,Other,03/21/19. 02:29 PM.
wv-harrison+county,CLAY ST CLARKSBURG HARRISON COUNTY,Other,03/21/19. 02:32 PM.
wv-harrison+county,WATKINS LN CLARKSBURG HARRISON COUNTY,Other,03/21/19. 02:35 PM.
wv-harrison+county,GOFF AVE CLARKSBURG HARRISON COUNTY,Other,03/21/19. 02:40 PM.
wv-harrison+county,RANDOLPH ST SALEM HARRISON COUNTY,Other,03/21/19. 03:10 PM.
wv-harrison+county,DUFF AVE CLARKSBURG HARRISON COUNTY,Assault,03/21/19. 03:25 PM.
wv-harrison+county,EMILY DR CLARKSBURG HARRISON COUNTY,Theft,03/21/19. 03:28 PM.
wv-harrison+county,BOE CLARKSBURG HARRISON COUNTY,Other,03/21/19. 03:34 PM.
wv-harrison+county,HEWES AVE CLARKSBURG HARRISON COUNTY,Other,03/21/19. 04:34 PM.
wv-harrison+county,MEADOWBROOK MALL RD BRIDGEPORT HARRISON COUNTY,Theft,03/21/19. 04:40 PM.
wv-harrison+county,EMILY DR CLARKSBURG HARRISON COUNTY,Theft,03/21/19. 04:52 PM.
wv-harrison+county,MAPLE LAKE COMMUNITY MAPLE LAKE HARRISON COUNTY,Other,03/21/19. 05:13 PM.
wv-harrison+county,MEADOWBROOK MALL RD BRIDGEPORT HARRISON COUNTY,Theft,03/21/19. 05:22 PM.
wv-harrison+county,MEADOWBROOK MALL RD BRIDGEPORT HARRISON COUNTY,Theft,03/21/19. 05:41 PM.
wv-harrison+county,GEORGE WASHINGTON HWY GRAFTON HARRISON COUNTY,Other,03/21/19. 05:43 PM.
wv-harrison+county,COLUMBIA BLVD CLARKSBURG HARRISON COUNTY,Other,03/21/19. 06:03 PM.
wv-harrison+county,W MAIN ST BRIDGEPORT HARRISON COUNTY,Theft,03/21/19. 06:08 PM.
wv-harrison+county,RECREATION DR COUNTRY CLUB HARRISON COUNTY,Other,03/21/19. 06:44 PM.
wv-harrison+county,STONEYBROOK RD CLARKSBURG HARRISON COUNTY,Other,03/21/19. 07:13 PM.
wv-harrison+county,W PIKE ST CLARKSBURG HARRISON COUNTY,Assault,03/21/19. 07:52 PM.
wv-harrison+county,WALNUT ST CLARKSBURG HARRISON COUNTY,Assault,03/21/19. 08:11 PM.
wv-harrison+county,MARYLAND AVE NUTTER FORT HARRISON COUNTY,Other,03/21/19. 09:01 PM.
wv-harrison+county,JOHNSON AVE BRIDGEPORT HARRISON COUNTY,Theft,03/21/19. 09:06 PM.
wv-harrison+county,W WILFORD ST GRAFTON HARRISON COUNTY,Other,03/21/19. 09:53 PM.
wv-harrison+county,EMILY DR CLARKSBURG HARRISON COUNTY,Other,03/21/19. 10:15 PM.
wv-harrison+county,WALNUT ST CLARKSBURG HARRISON COUNTY,Other,03/21/19. 10:34 PM.
wv-harrison+county,WINDING WAY CLARKSBURG HARRISON COUNTY,Other,03/21/19. 11:04 PM.
wv-harrison+county,BUCKHANNON PKE CENTER BRANCH HARRISON COUNTY,Other,03/21/19. 11:12 PM.
wv-harrison+county,KOVAR RD GLEN FALLS HARRISON COUNTY,Other,03/21/19. 11:54 PM.
wv-harrison+county,BIRCH ST CLARKSBURG HARRISON COUNTY,Other,03/22/19. 06:44 AM.
wv-harrison+county,PURDYS RUN RD ADAMSVILLE HARRISON COUNTY,Vandalism,03/22/19. 08:04 AM.
wv-harrison+county,CRISLIP AVE CLARKSBURG HARRISON COUNTY,Other,03/22/19. 08:41 AM.
wv-harrison+county,WALNUT ST LAUREL VALLEY HARRISON COUNTY,Other,03/22/19. 08:49 AM.
wv-harrison+county,CHARLES ST SHINNSTON HARRISON COUNTY,Assault,03/22/19. 09:02 AM.
wv-harrison+county,WALNUT ST LAUREL VALLEY HARRISON COUNTY,Other,03/22/19. 09:08 AM.
wv-harrison+county,MAPLEWOOD DR BRIDGEPORT HARRISON COUNTY,Theft,03/22/19. 10:02 AM.
wv-harrison+county,N 4TH ST GLEN ELK HARRISON COUNTY,Other,03/22/19. 10:05 AM.
wv-harrison+county,W WILFORD ST GRAFTON HARRISON COUNTY,Other,03/22/19. 10:15 AM.
wv-harrison+county,COST AVE STONEWOOD HARRISON COUNTY,Assault,03/22/19. 10:14 AM.
wv-harrison+county,POINT ST CLARKSBURG HARRISON COUNTY,Assault,03/22/19. 10:27 AM.
wv-harrison+county,MOUNTAINEER DR CLARKSBURG HARRISON COUNTY,Other,03/22/19. 11:04 AM.
wv-harrison+county,CHICKERELL ST EAST VIEW HARRISON COUNTY,Other,03/22/19. 11:07 AM.
wv-harrison+county,W MAIN ST CLARKSBURG HARRISON COUNTY,Theft,03/22/19. 11:17 AM.
wv-harrison+county,OAKMOUND DR CLARKSBURG HARRISON COUNTY,Other,03/22/19. 12:21 PM.
wv-harrison+county,ANMOORE RD ANMOORE HARRISON COUNTY,Theft,03/22/19. 12:23 PM.
wv-harrison+county,UHAUL ANMOORE HARRISON COUNTY,Theft,03/22/19. 12:59 PM.
wv-harrison+county,EMILY DR CLARKSBURG HARRISON COUNTY,Theft,03/22/19. 01:05 PM.
wv-harrison+county,S 4TH ST CLARKSBURG HARRISON COUNTY,Theft,03/22/19. 01:08 PM.
wv-harrison+county,COUNTRY MEADOWS LN BRIDGEPORT HARRISON COUNTY,Other,03/22/19. 02:10 PM.
wv-harrison+county,PRIDE AVE CLARKSBURG HARRISON COUNTY,Other,03/22/19. 02:56 PM.
wv-harrison+county,SHINNSTON PKE CLARKSBURG HARRISON COUNTY,Other,03/22/19. 03:05 PM.
wv-harrison+county,W MAIN ST BRIDGEPORT HARRISON COUNTY,Other,03/22/19. 03:12 PM.
wv-harrison+county,BUCKHANNON AVE CLARKSBURG HARRISON COUNTY,Theft,03/22/19. 03:18 PM.
wv-harrison+county,LAWMAN AVE BRIDGEPORT HARRISON COUNTY,Other,03/22/19. 03:34 PM.
wv-harrison+county,FOWLER AVE CLARKSBURG HARRISON COUNTY,Other,03/22/19. 03:40 PM.
wv-harrison+county,BARNETTS RUN RD BRIDGEPORT HARRISON COUNTY,Theft,03/22/19. 03:47 PM.
wv-harrison+county,ASH ST ANMOORE HARRISON COUNTY,Theft,03/22/19. 04:05 PM.
wv-harrison+county,LOCUSTVIEW DR CLARKSBURG HARRISON COUNTY,Assault,03/22/19. 04:06 PM.
wv-harrison+county,MEADOW VIEW DR LAUREL PARK HARRISON COUNTY,Other,03/22/19. 04:10 PM.
wv-harrison+county,HEPZIBAH HEIGHTS RD HEPZIBAH HARRISON COUNTY,Other,03/22/19. 04:42 PM.
wv-harrison+county,SHEILA LN WEST MILFORD HARRISON COUNTY,Other,03/22/19. 04:47 PM.
wv-harrison+county,EMILY DR CLARKSBURG HARRISON COUNTY,Theft,03/22/19. 04:50 PM.
wv-harrison+county,MAIN ST LUMBERPORT HARRISON COUNTY,Other,03/22/19. 04:50 PM.
wv-harrison+county,RINEHART RD WALLACE HARRISON COUNTY,Other,03/22/19. 04:51 PM.
wv-harrison+county,E MAIN ST SALEM HARRISON COUNTY,Other,03/22/19. 04:55 PM.
wv-harrison+county,WILSON RIDGE RD HAYMOND HARRISON COUNTY,Other,03/22/19. 05:24 PM.
wv-harrison+county,LOCUSTVIEW DR CLARKSBURG HARRISON COUNTY,Vandalism,03/22/19. 05:41 PM.
wv-harrison+county,I 79 124 EXIT SB BRIDGEPORT HARRISON COUNTY,Other,03/22/19. 06:31 PM.
wv-harrison+county,FRISHE DR GOOD HOPE HARRISON COUNTY,Other,03/22/19. 06:32 PM.
wv-harrison+county,SARDIS RD SARDIS HARRISON COUNTY,Assault,03/22/19. 06:59 PM.
wv-harrison+county,BIDDIE LN WEST MILFORD HARRISON COUNTY,Other,03/22/19. 07:20 PM.
wv-harrison+county,WILLARD RD WILLARD HARRISON COUNTY,Other,03/22/19. 07:26 PM.
wv-harrison+county,DAVIS ST CLARKSBURG HARRISON COUNTY,Assault,03/22/19. 08:16 PM.
wv-harrison+county,WILD TURKEY DR BRUSHY FORK HARRISON COUNTY,Other,03/22/19. 08:41 PM.
wv-harrison+county,BUCKHANNON PKE NUTTER FORT HARRISON COUNTY,Theft,03/22/19. 08:43 PM.
wv-harrison+county,SOUTHERN AVE STONEWOOD HARRISON COUNTY,Theft,03/22/19. 09:11 PM.
wv-harrison+county,HICKORY DR TAPPAN HARRISON COUNTY,Other,03/22/19. 09:31 PM.
wv-harrison+county,WILSON RIDGE RD HAYMOND HARRISON COUNTY,Assault,03/22/19. 09:45 PM.
wv-harrison+county,HAMILL AVE CLARKSBURG HARRISON COUNTY,Other,03/22/19. 10:13 PM.
wv-harrison+county,HELENS PL EAST VIEW HARRISON COUNTY,Other,03/22/19. 10:22 PM.
wv-harrison+county,BUCKHANNON PKE CRAIGMOOR HARRISON COUNTY,Other,03/22/19. 10:54 PM.
wv-harrison+county,CHARLES ST SHINNSTON HARRISON COUNTY,Other,03/22/19. 12:09 AM.
wv-harrison+county,OAKMOUND DR CLARKSBURG HARRISON COUNTY,Other,03/22/19. 12:16 AM.
wv-harrison+county,HEWES AVE CLARKSBURG HARRISON COUNTY,Other,03/22/19. 01:19 AM.
wv-harrison+county,HUNTINGTON BANK CLARKSBURG HARRISON COUNTY,Other,03/22/19. 01:45 AM.
wv-harrison+county,MILFORD ST CLARKSBURG HARRISON COUNTY,Other,03/22/19. 03:35 AM.
wv-harrison+county,W MAIN ST GRAFTON HARRISON COUNTY,Vandalism,03/23/19. 06:28 AM.
wv-harrison+county,LITTLE ELK RD WALLACE HARRISON COUNTY,Other,03/23/19. 07:36 AM.
wv-harrison+county,CONFERENCE CENTER WAY BRIDGEPORT HARRISON COUNTY,Other,03/23/19. 08:04 AM.
wv-harrison+county,EMILY DR CLARKSBURG HARRISON COUNTY,Theft,03/23/19. 11:18 AM.
wv-harrison+county,TOLLEY DR CLARKSBURG HARRISON COUNTY,Other,03/23/19. 11:25 AM.
wv-harrison+county,EMILY DR CLARKSBURG HARRISON COUNTY,Theft,03/23/19. 11:58 AM.
wv-harrison+county,WILLOW WAY MEADLAND HARRISON COUNTY,Other,03/23/19. 12:41 PM.
wv-harrison+county,MATHENY HILL RD ENTERPRISE HARRISON COUNTY,Other,03/23/19. 01:58 PM.
wv-harrison+county,MEDICAL CENTER DR CLARKSBURG HARRISON COUNTY,Other,03/23/19. 02:17 PM.
wv-harrison+county,PEARLMAN AVE CLARKSBURG HARRISON COUNTY,Burglary,03/23/19. 03:26 PM.
wv-harrison+county,MAPLE AVE STONEWOOD HARRISON COUNTY,Other,03/23/19. 03:45 PM.
