Name,Address,Crime,Date
wv-harrison+county,STONEYBROOK RD CLARKSBURG HARRISON COUNTY,Other,05/07/19. 11:07 PM.
wv-harrison+county,HARRISON ST CLARKSBURG HARRISON COUNTY,Other,05/07/19. 11:21 PM.
wv-harrison+county,HARRISON ST CLARKSBURG HARRISON COUNTY,Other,05/07/19. 11:26 PM.
wv-harrison+county,OAK ST SALEM HARRISON COUNTY,Other,05/07/19. 11:40 PM.
wv-harrison+county,ELM ST LAUREL VALLEY HARRISON COUNTY,Other,05/07/19. 11:44 PM.
wv-harrison+county,PARK BLVD CLARKSBURG HARRISON COUNTY,Other,05/07/19. 03:25 AM.
wv-harrison+county,W WOODLAND AVE CLARKSBURG HARRISON COUNTY,Other,05/07/19. 04:21 AM.
wv-harrison+county,BROADWAY AT EASTERN SUPPLIES SALVAGE CLARKSBURG HARRISON COUNTY,Other,05/07/19. 04:26 AM.
wv-harrison+county,HICKORY VIEW WAY BRIDGEPORT HARRISON COUNTY,Theft,05/07/19. 04:42 AM.
wv-harrison+county,RAILROAD ST SHINNSTON HARRISON COUNTY,Other,05/07/19. 04:51 AM.
wv-harrison+county,N OHIO AVE CLARKSBURG HARRISON COUNTY,Other,05/07/19. 05:02 AM.
wv-harrison+county,THORNTON PKE GRAFTON HARRISON COUNTY,Other,05/08/19. 06:38 AM.
wv-harrison+county,CUNNINGHAM RUN RD PEORA HARRISON COUNTY,Theft,05/08/19. 07:15 AM.
wv-harrison+county,E PIKE ST SUMMIT PARK HARRISON COUNTY,Other,05/08/19. 07:25 AM.
wv-harrison+county,PHILIPPI PKE EAST VIEW HARRISON COUNTY,Other,05/08/19. 07:30 AM.
wv-harrison+county,W MAIN ST CLARKSBURG HARRISON COUNTY,Theft,05/08/19. 09:57 AM.
wv-harrison+county,WILSONBURG RD WILSONBURG HARRISON COUNTY,Vandalism,05/08/19. 10:53 AM.
wv-harrison+county,S PIKE ST SHINNSTON HARRISON COUNTY,Other,05/08/19. 11:40 AM.
wv-harrison+county,I79 117 MILE MARKER ANMOORE HARRISON COUNTY,Other,05/08/19. 11:38 AM.
wv-harrison+county,CHARLES ST SHINNSTON HARRISON COUNTY,Other,05/08/19. 11:48 AM.
wv-harrison+county,SUN VALLEY RD SUN VALLEY HARRISON COUNTY,Other,05/08/19. 11:51 AM.
wv-harrison+county,BALTIMORE AVE CLARKSBURG HARRISON COUNTY,Theft,05/08/19. 11:59 AM.
wv-harrison+county,HORNOR AVE LUMBERPORT HARRISON COUNTY,Assault,05/08/19. 12:08 PM.
wv-harrison+county,CARMICHAEL CT CLARKSBURG HARRISON COUNTY,Assault,05/08/19. 12:37 PM.
wv-harrison+county,ELK AVE STONEWOOD HARRISON COUNTY,Other,05/08/19. 01:03 PM.
wv-harrison+county,S 22ND ST CLARKSBURG HARRISON COUNTY,Other,05/08/19. 01:51 PM.
wv-harrison+county,ANMOORE RD ANMOORE HARRISON COUNTY,Vandalism,05/08/19. 02:21 PM.
wv-harrison+county,OAK LN BRIDGEPORT HARRISON COUNTY,Other,05/08/19. 02:40 PM.
wv-harrison+county,WASHINGTON AVE AND S 5TH ST CLARKSBURG HARRISON COUNTY,Other,05/08/19. 02:57 PM.
wv-harrison+county,N 16TH ST CLARKSBURG HARRISON COUNTY,Other,05/08/19. 03:28 PM.
wv-harrison+county,MORNING DOVE DR COUNTRY CLUB HARRISON COUNTY,Theft,05/08/19. 03:39 PM.
wv-harrison+county,CUNNINGHAM RUN RD PEORA HARRISON COUNTY,Other,05/08/19. 03:59 PM.
wv-harrison+county,W PIKE ST CLARKSBURG HARRISON COUNTY,Theft,05/08/19. 04:04 PM.
wv-harrison+county,EMILY DR CAVA DR TO ANMOORE CLARKSBURG HARRISON COUNTY,Theft,05/08/19. 04:09 PM.
wv-harrison+county,JOHNSON AVE BRIDGEPORT HARRISON COUNTY,Other,05/08/19. 04:22 PM.
wv-harrison+county,HEWES AVE CLARKSBURG HARRISON COUNTY,Other,05/08/19. 04:26 PM.
wv-harrison+county,HAPPY HOLLOW RD EAST VIEW HARRISON COUNTY,Other,05/08/19. 04:27 PM.
wv-harrison+county,ROSEBUD PLAZA DR CLARKSBURG HARRISON COUNTY,Theft,05/08/19. 04:50 PM.
wv-harrison+county,GOULD AVE CLARKSBURG HARRISON COUNTY,Other,05/08/19. 04:54 PM.
wv-harrison+county,MEADOWBROOK MALL RD BRIDGEPORT HARRISON COUNTY,Theft,05/08/19. 05:03 PM.
wv-harrison+county,MURPHYS RUN RD SUMMIT PARK HARRISON COUNTY,Assault,05/08/19. 05:13 PM.
wv-harrison+county,SNIDER LN STONEWOOD HARRISON COUNTY,Other,05/08/19. 05:14 PM.
wv-harrison+county,EMILY DR CLARKSBURG HARRISON COUNTY,Theft,05/08/19. 05:18 PM.
wv-harrison+county,MOUNT CLARE RD LOST CREEK HARRISON COUNTY,Other,05/08/19. 05:24 PM.
wv-harrison+county,LEE AVE CLARKSBURG HARRISON COUNTY,Assault,05/08/19. 05:26 PM.
wv-harrison+county,ROBLEY ST GRAFTON HARRISON COUNTY,Other,05/08/19. 05:35 PM.
wv-harrison+county,HILL VIEW TER ENTERPRISE HARRISON COUNTY,Theft,05/08/19. 06:04 PM.
wv-harrison+county,WALNUT ST GRAFTON HARRISON COUNTY,Other,05/08/19. 06:17 PM.
wv-harrison+county,W PIKE ST CLARKSBURG HARRISON COUNTY,Other,05/08/19. 06:38 PM.
wv-harrison+county,FARNUM RD HEPZIBAH HARRISON COUNTY,Other,05/08/19. 06:39 PM.
wv-harrison+county,JAMES ST BRIDGEPORT HARRISON COUNTY,Other,05/08/19. 07:08 PM.
wv-harrison+county,N 24TH ST CLARKSBURG HARRISON COUNTY,Other,05/08/19. 08:04 PM.
wv-harrison+county,JAMES ST BRIDGEPORT HARRISON COUNTY,Other,05/08/19. 08:07 PM.
wv-harrison+county,VERMONT AVE CLARKSBURG HARRISON COUNTY,Other,05/08/19. 08:13 PM.
wv-harrison+county,LUCAS RD PEORA HARRISON COUNTY,Other,05/08/19. 08:17 PM.
wv-harrison+county,HASTINGS RUN RD CRAIGMOOR HARRISON COUNTY,Other,05/08/19. 09:09 PM.
wv-harrison+county,BEN ST CLARKSBURG HARRISON COUNTY,Other,05/08/19. 09:12 PM.
wv-harrison+county,LOCUST AVE CLARKSBURG HARRISON COUNTY,Other,05/08/19. 09:22 PM.
wv-harrison+county,W PIKE ST CLARKSBURG HARRISON COUNTY,Other,05/08/19. 09:36 PM.
wv-harrison+county,STONEYBROOK RD CLARKSBURG HARRISON COUNTY,Other,05/08/19. 09:42 PM.
wv-harrison+county,PRESTON ST CLARKSBURG HARRISON COUNTY,Robbery,05/08/19. 09:55 PM.
wv-harrison+county,GOULD AVE CLARKSBURG HARRISON COUNTY,Other,05/08/19. 10:25 PM.
wv-harrison+county,INDIANA AVE STONEWOOD HARRISON COUNTY,Theft,05/08/19. 10:49 PM.
wv-harrison+county,GOOD HOPE PKE WEST MILFORD HARRISON COUNTY,Other,05/08/19. 11:20 PM.
wv-harrison+county,MAIN AND PIKE SHINNSTON HARRISON COUNTY,Other,05/08/19. 11:34 PM.
wv-harrison+county,HOWARD ST CLARKSBURG HARRISON COUNTY,Assault,05/08/19. 12:10 AM.
wv-harrison+county,OHIO AVE NUTTER FORT HARRISON COUNTY,Other,05/08/19. 12:15 AM.
wv-harrison+county,ARLINGTON DR ARLINGTON HARRISON COUNTY,Other,05/08/19. 12:47 AM.
wv-harrison+county,OAKMOUND DR CLARKSBURG HARRISON COUNTY,Other,05/08/19. 01:27 AM.
wv-harrison+county,MILFORD ST CLARKSBURG HARRISON COUNTY,Other,05/08/19. 01:40 AM.
wv-harrison+county,BROADWAY AVE CLARKSBURG HARRISON COUNTY,Other,05/08/19. 02:22 AM.
wv-harrison+county,MARIGOLD LN ARLINGTON HARRISON COUNTY,Other,05/08/19. 02:33 AM.
wv-harrison+county,EUCLID AVE CLARKSBURG HARRISON COUNTY,Burglary,05/08/19. 02:42 AM.
wv-harrison+county,MAGNOLIA AVE CLARKSBURG HARRISON COUNTY,Other,05/08/19. 02:44 AM.
wv-harrison+county,HEWES AVE CLARKSBURG HARRISON COUNTY,Other,05/08/19. 03:16 AM.
wv-harrison+county,PARK BLVD CLARKSBURG HARRISON COUNTY,Other,05/08/19. 03:58 AM.
wv-harrison+county,MILFORD ST AND ALEXANDER AVE CLARKSBURG HARRISON COUNTY,Other,05/08/19. 04:28 AM.
wv-harrison+county,W PIKE ST CLARKSBURG HARRISON COUNTY,Assault,05/08/19. 04:30 AM.
wv-harrison+county,N 4TH ST CLARKSBURG HARRISON COUNTY,Other,05/08/19. 05:36 AM.
wv-harrison+county,PLATINUM DR BRIDGEPORT HARRISON COUNTY,Other,05/09/19. 06:08 AM.
wv-harrison+county,HIGH ST GRAFTON HARRISON COUNTY,Other,05/09/19. 06:13 AM.
wv-harrison+county,E PIKE ST CLARKSBURG HARRISON COUNTY,Other,05/09/19. 06:54 AM.
wv-harrison+county,S PIKE ST SHINNSTON HARRISON COUNTY,Other,05/09/19. 07:01 AM.
wv-harrison+county,NORTHCOTT ST CLARKSBURG HARRISON COUNTY,Other,05/09/19. 07:05 AM.
wv-harrison+county,MURPHY RUN SUMMIT PARK HARRISON COUNTY,Other,05/09/19. 08:02 AM.
wv-harrison+county,HOOP POLE HOLLOW RD CENTER BRANCH HARRISON COUNTY,Theft,05/09/19. 08:12 AM.
wv-harrison+county,PRIDE AVE CLARKSBURG HARRISON COUNTY,Theft,05/09/19. 09:08 AM.
wv-harrison+county,ADAMS AVE CLARKSBURG HARRISON COUNTY,Burglary,05/09/19. 09:30 AM.
wv-harrison+county,COST AVE STONEWOOD HARRISON COUNTY,Other,05/09/19. 09:39 AM.
wv-harrison+county,W MAIN ST BRIDGEPORT HARRISON COUNTY,Other,05/09/19. 09:39 AM.
wv-harrison+county,LAUREL DR CLARKSBURG HARRISON COUNTY,Other,05/09/19. 09:43 AM.
wv-harrison+county,S PIKE ST SHINNSTON HARRISON COUNTY,Other,05/09/19. 10:08 AM.
wv-harrison+county,STONEYBROOK RD CLARKSBURG HARRISON COUNTY,Other,05/09/19. 10:24 AM.
wv-harrison+county,GABRIEL BROTHERS PLAZA BRIDGEPORT HARRISON COUNTY,Other,05/09/19. 10:26 AM.
wv-harrison+county,W PIKE ST CLARKSBURG HARRISON COUNTY,Other,05/09/19. 10:41 AM.
wv-harrison+county,MILFORD ST CLARKSBURG HARRISON COUNTY,Other,05/09/19. 10:48 AM.
wv-harrison+county,W MAIN ST CLARKSBURG HARRISON COUNTY,Other,05/09/19. 10:51 AM.
wv-harrison+county,RIVENDELL DR BRIDGEPORT HARRISON COUNTY,Other,05/09/19. 11:37 AM.
wv-harrison+county,EUCLID AVE CLARKSBURG HARRISON COUNTY,Other,05/09/19. 11:44 AM.
wv-harrison+county,MEADOWBROOK MALL RD BRIDGEPORT HARRISON COUNTY,Theft,05/09/19. 12:49 PM.
wv-harrison+county,HAWK HWY WEST MILFORD HARRISON COUNTY,Theft,05/09/19. 01:09 PM.
wv-harrison+county,CEDAR HEIGHTS DR CLARKSBURG HARRISON COUNTY,Burglary,05/09/19. 01:10 PM.
wv-harrison+county,W MAIN ST BRIDGEPORT HARRISON COUNTY,Theft,05/09/19. 01:35 PM.
wv-harrison+county,CLAY ST CLARKSBURG HARRISON COUNTY,Assault,05/09/19. 01:33 PM.
wv-harrison+county,N 14TH ST CLARKSBURG HARRISON COUNTY,Other,05/09/19. 02:04 PM.
wv-harrison+county,MEADOW VIEW DR LAUREL PARK HARRISON COUNTY,Other,05/09/19. 02:27 PM.
wv-harrison+county,W PIKE ST CLARKSBURG HARRISON COUNTY,Other,05/09/19. 02:52 PM.
wv-harrison+county,ELLIOTT ST CLARKSBURG HARRISON COUNTY,Theft,05/09/19. 02:55 PM.
wv-harrison+county,EMILY DR CLARKSBURG HARRISON COUNTY,Other,05/09/19. 03:05 PM.
wv-harrison+county,WEBSTER PKE WEBSTER HARRISON COUNTY,Other,05/09/19. 03:19 PM.
wv-harrison+county,GROVE AVE CLARKSBURG HARRISON COUNTY,Other,05/09/19. 03:31 PM.
wv-harrison+county,W MAIN ST CLARKSBURG HARRISON COUNTY,Assault,05/09/19. 03:36 PM.
wv-harrison+county,W PIKE ST CLARKSBURG HARRISON COUNTY,Other,05/09/19. 04:10 PM.
wv-harrison+county,E PIKE ST CLARKSBURG HARRISON COUNTY,Other,05/09/19. 04:18 PM.
wv-harrison+county,DJS AUTO CLARKSBURG HARRISON COUNTY,Other,05/09/19. 04:46 PM.
wv-harrison+county,GREEN AVE CLARKSBURG HARRISON COUNTY,Other,05/09/19. 05:06 PM.
wv-harrison+county,FLORENCE HOLLOW RD MOUNT CLARE HARRISON COUNTY,Other,05/09/19. 05:08 PM.
wv-harrison+county,E PIKE ST CLARKSBURG HARRISON COUNTY,Other,05/09/19. 05:19 PM.
wv-harrison+county,EMILY DR CLARKSBURG HARRISON COUNTY,Other,05/09/19. 05:49 PM.
wv-harrison+county,MILFORD ST CLARKSBURG HARRISON COUNTY,Other,05/09/19. 05:55 PM.
wv-harrison+county,ALLISON AVE BRIDGEPORT HARRISON COUNTY,Other,05/09/19. 06:02 PM.
wv-harrison+county,GOFF AVE CLARKSBURG HARRISON COUNTY,Other,05/09/19. 06:09 PM.
wv-harrison+county,GREEN AVE CLARKSBURG HARRISON COUNTY,Assault,05/09/19. 06:20 PM.
wv-harrison+county,COST AVE STONEWOOD HARRISON COUNTY,Assault,05/09/19. 06:18 PM.
wv-harrison+county,STONEYBROOK RD CLARKSBURG HARRISON COUNTY,Other,05/09/19. 06:28 PM.
wv-harrison+county,W PIKE ST CLARKSBURG HARRISON COUNTY,Other,05/09/19. 06:31 PM.
wv-harrison+county,HARRISON ST CLARKSBURG HARRISON COUNTY,Other,05/09/19. 06:31 PM.
wv-harrison+county,JACK RUN RD LUMBERPORT HARRISON COUNTY,Other,05/09/19. 06:41 PM.
wv-harrison+county,HEWES AVE PARKING GARAGE CLARKSBURG HARRISON COUNTY,Other,05/09/19. 06:47 PM.
wv-harrison+county,EMILY DR CLARKSBURG HARRISON COUNTY,Other,05/09/19. 06:46 PM.
wv-harrison+county,LINDEN AVE ANMOORE HARRISON COUNTY,Assault,05/09/19. 06:57 PM.
wv-harrison+county,W WOODLAND AVE CLARKSBURG HARRISON COUNTY,Other,05/09/19. 07:08 PM.
wv-harrison+county,WENDEL RD BELGIUM HARRISON COUNTY,Other,05/09/19. 07:13 PM.
wv-harrison+county,W MAIN ST CLARKSBURG HARRISON COUNTY,Other,05/09/19. 07:31 PM.
wv-harrison+county,E PIKE ST CLARKSBURG HARRISON COUNTY,Other,05/09/19. 07:30 PM.
wv-harrison+county,GREENS PLZ GRAFTON HARRISON COUNTY,Other,05/09/19. 07:38 PM.
wv-harrison+county,LOCUST CT CLARKSBURG HARRISON COUNTY,Other,05/09/19. 07:43 PM.
wv-harrison+county,W WOODLAND AVE CLARKSBURG HARRISON COUNTY,Other,05/09/19. 07:59 PM.
wv-harrison+county,CHARLES ST SHINNSTON HARRISON COUNTY,Assault,05/09/19. 08:49 PM.
wv-harrison+county,JERRY DOVE DR BRIDGEPORT HARRISON COUNTY,Other,05/09/19. 09:11 PM.
wv-harrison+county,MARYLAND AVE AND NUTTER ST NUTTER FORT HARRISON COUNTY,Other,05/09/19. 09:31 PM.
wv-harrison+county,PROSPECT VALLEY RD LUMBERPORT HARRISON COUNTY,Assault,05/09/19. 09:59 PM.
wv-harrison+county,MONARCH ST SUMMIT PARK HARRISON COUNTY,Other,05/09/19. 10:11 PM.
wv-harrison+county,HARTLAND PLANING MILL CLARKSBURG HARRISON COUNTY,Other,05/09/19. 10:51 PM.
wv-harrison+county,MARYLAND AVE NUTTER FORT HARRISON COUNTY,Other,05/09/19. 10:54 PM.
wv-harrison+county,CORBIN BRANCH RD BRIDGEPORT HARRISON COUNTY,Theft,05/09/19. 10:56 PM.
wv-harrison+county,BOYLES CT CLARKSBURG HARRISON COUNTY,Other,05/09/19. 11:15 PM.
wv-harrison+county,N OHIO AVE CLARKSBURG HARRISON COUNTY,Other,05/09/19. 11:31 PM.
wv-harrison+county,BUCKHANNON PKE NUTTER FORT HARRISON COUNTY,Other,05/09/19. 11:36 PM.
wv-harrison+county,TRI COUNTY DR BOOTHSVILLE HARRISON COUNTY,Other,05/09/19. 11:41 PM.
wv-harrison+county,WALNUT ST GRAFTON HARRISON COUNTY,Other,05/09/19. 11:59 PM.
wv-harrison+county,BEARDS RUN RD GREEN VALLEY HARRISON COUNTY,Other,05/09/19. 12:10 AM.
wv-harrison+county,SOUTH VIEW DR BRIDGEPORT HARRISON COUNTY,Other,05/09/19. 12:25 AM.
wv-harrison+county,TIMBER RIDGE RD BRIDGEPORT HARRISON COUNTY,Other,05/09/19. 12:38 AM.
wv-harrison+county,W PIKE ST CLARKSBURG HARRISON COUNTY,Other,05/09/19. 01:11 AM.
wv-harrison+county,PIZZA HUT ADAMSTON HARRISON COUNTY,Other,05/09/19. 01:40 AM.
wv-harrison+county,COURT ST CLARKSBURG HARRISON COUNTY,Other,05/09/19. 01:41 AM.
wv-harrison+county,GOULD AVE CLARKSBURG HARRISON COUNTY,Other,05/09/19. 02:19 AM.
wv-harrison+county,DODGE CT CLARKSBURG HARRISON COUNTY,Other,05/09/19. 03:43 AM.
wv-harrison+county,THORNTON PKE GRAFTON HARRISON COUNTY,Other,05/09/19. 04:24 AM.
wv-harrison+county,MAGNOLIA AVE CLARKSBURG HARRISON COUNTY,Other,05/09/19. 04:50 AM.
wv-harrison+county,SUMMIT CT CLARKSBURG HARRISON COUNTY,Other,05/09/19. 05:36 AM.
wv-harrison+county,HICKMAN ST CLARKSBURG HARRISON COUNTY,Other,05/10/19. 07:58 AM.
wv-harrison+county,HOOD AVE ENTERPRISE HARRISON COUNTY,Theft,05/10/19. 08:15 AM.
wv-harrison+county,WEBSTER PKE WEBSTER HARRISON COUNTY,Other,05/10/19. 08:23 AM.
wv-harrison+county,JAMES ST BRIDGEPORT HARRISON COUNTY,Other,05/10/19. 08:31 AM.
wv-harrison+county,JERRY TOTH DR SHINNSTON HARRISON COUNTY,Theft,05/10/19. 08:38 AM.
wv-harrison+county,I79 124 MILE MARKER BRIDGEPORT HARRISON COUNTY,Vandalism,05/10/19. 08:58 AM.
wv-harrison+county,KRAMER DR CLARKSBURG HARRISON COUNTY,Assault,05/10/19. 09:00 AM.
wv-harrison+county,COST AVE STONEWOOD HARRISON COUNTY,Other,05/10/19. 09:05 AM.
wv-harrison+county,NORTH ST SHINNSTON HARRISON COUNTY,Other,05/10/19. 09:16 AM.
wv-harrison+county,CARMICHAEL CT CLARKSBURG HARRISON COUNTY,Assault,05/10/19. 09:27 AM.
wv-harrison+county,GREEN AVE CLARKSBURG HARRISON COUNTY,Other,05/10/19. 09:30 AM.
wv-harrison+county,WATER ST SALEM HARRISON COUNTY,Other,05/10/19. 10:00 AM.
wv-harrison+county,BROADWAY AVE CLARKSBURG HARRISON COUNTY,Other,05/10/19. 10:11 AM.
wv-harrison+county,MEIGS AVE CLARKSBURG HARRISON COUNTY,Other,05/10/19. 10:23 AM.
wv-harrison+county,GREEN AVE CLARKSBURG HARRISON COUNTY,Other,05/10/19. 10:36 AM.
wv-harrison+county,PHILIPPI PKE EAST VIEW HARRISON COUNTY,Other,05/10/19. 11:05 AM.
wv-harrison+county,SYCAMORE CIR BRIDGEPORT HARRISON COUNTY,Other,05/10/19. 12:06 PM.
wv-harrison+county,W MAIN ST GRAFTON HARRISON COUNTY,Burglary,05/10/19. 12:08 PM.
wv-harrison+county,BEECHWOOD AVE STONEWOOD HARRISON COUNTY,Assault,05/10/19. 12:10 PM.
wv-harrison+county,VERMONT AVE CLARKSBURG HARRISON COUNTY,Other,05/10/19. 12:10 PM.
wv-harrison+county,EMILY DR CLARKSBURG HARRISON COUNTY,Theft,05/10/19. 12:41 PM.
wv-harrison+county,GREEN AVE CLARKSBURG HARRISON COUNTY,Other,05/10/19. 01:09 PM.
wv-harrison+county,FOWLER AVE CLARKSBURG HARRISON COUNTY,Other,05/10/19. 01:16 PM.
wv-harrison+county,HOOD AVE ENTERPRISE HARRISON COUNTY,Other,05/10/19. 01:28 PM.
wv-harrison+county,CARMICHAEL CT CLARKSBURG HARRISON COUNTY,Other,05/10/19. 01:36 PM.
wv-harrison+county,SIMPSON ST SUMMIT PARK HARRISON COUNTY,Other,05/10/19. 01:33 PM.
wv-harrison+county,JONES RUN RD LUMBERPORT HARRISON COUNTY,Other,05/10/19. 01:36 PM.
wv-harrison+county,EMILY DR CLARKSBURG HARRISON COUNTY,Theft,05/10/19. 02:23 PM.
wv-harrison+county,WASHINGTON AVE CLARKSBURG HARRISON COUNTY,Vandalism,05/10/19. 02:45 PM.
wv-harrison+county,WEST VIRGINIA AVE NUTTER FORT HARRISON COUNTY,Other,05/10/19. 02:46 PM.
wv-harrison+county,BEECHWOOD AVE SUMMIT PARK HARRISON COUNTY,Other,05/10/19. 02:52 PM.
wv-harrison+county,CRUMMITT LN EAST VIEW HARRISON COUNTY,Other,05/10/19. 02:56 PM.
wv-harrison+county,PROSPECT VALLEY RD LUMBERPORT HARRISON COUNTY,Theft,05/10/19. 03:16 PM.
wv-harrison+county,ROSEBUD PLAZA DR CLARKSBURG HARRISON COUNTY,Theft,05/10/19. 03:22 PM.
wv-harrison+county,FOWLER AVE CLARKSBURG HARRISON COUNTY,Other,05/10/19. 03:29 PM.
wv-harrison+county,N 25TH ST CLARKSBURG HARRISON COUNTY,Assault,05/10/19. 03:31 PM.
wv-harrison+county,HOWARD ST CLARKSBURG HARRISON COUNTY,Other,05/10/19. 03:33 PM.
wv-harrison+county,PENN ST CLARKSBURG HARRISON COUNTY,Other,05/10/19. 03:46 PM.
wv-harrison+county,CARMICHAEL CT CLARKSBURG HARRISON COUNTY,Assault,05/10/19. 04:19 PM.
wv-harrison+county,LOCUST AVE CLARKSBURG HARRISON COUNTY,Other,05/10/19. 04:32 PM.
wv-harrison+county,W MAIN ST BRIDGEPORT HARRISON COUNTY,Other,05/10/19. 04:40 PM.
wv-harrison+county,W MAIN ST GRAFTON HARRISON COUNTY,Assault,05/10/19. 04:45 PM.
wv-harrison+county,W MAIN ST GRAFTON HARRISON COUNTY,Theft,05/10/19. 04:45 PM.
wv-harrison+county,EMILY DR CLARKSBURG HARRISON COUNTY,Other,05/10/19. 04:45 PM.
wv-harrison+county,BEAUMONT RD GRAFTON HARRISON COUNTY,Other,05/10/19. 04:49 PM.
wv-harrison+county,MEADOWBROOK MALL RD BRIDGEPORT HARRISON COUNTY,Other,05/10/19. 04:55 PM.
wv-harrison+county,CARMICHAEL CT CLARKSBURG HARRISON COUNTY,Assault,05/10/19. 05:17 PM.
wv-harrison+county,LOCUST AVE CLARKSBURG HARRISON COUNTY,Vandalism,05/10/19. 05:46 PM.
wv-harrison+county,LOCUST AVE CLARKSBURG HARRISON COUNTY,Vandalism,05/10/19. 06:03 PM.
wv-harrison+county,BALTIMORE AVE CLARKSBURG HARRISON COUNTY,Other,05/10/19. 06:44 PM.
wv-harrison+county,CROOKED RUN RD WILSONBURG HARRISON COUNTY,Other,05/10/19. 07:15 PM.
wv-harrison+county,JOHNSON AVE BRIDGEPORT HARRISON COUNTY,Other,05/10/19. 07:19 PM.
wv-harrison+county,CARMICHAEL CT CLARKSBURG HARRISON COUNTY,Assault,05/10/19. 07:26 PM.
wv-harrison+county,FARNUM RD HEPZIBAH HARRISON COUNTY,Other,05/10/19. 07:31 PM.
wv-harrison+county,MILFORD ST CLARKSBURG HARRISON COUNTY,Theft,05/10/19. 07:37 PM.
wv-harrison+county,LOCUSTVIEW DR CLARKSBURG HARRISON COUNTY,Other,05/10/19. 08:45 PM.
wv-harrison+county,SHINNSTON PKE MEADOWBROOK HARRISON COUNTY,Other,05/10/19. 08:56 PM.
wv-harrison+county,LITTLE ST CLARKSBURG HARRISON COUNTY,Other,05/10/19. 09:00 PM.
wv-harrison+county,MILFORD ST CLARKSBURG HARRISON COUNTY,Assault,05/10/19. 09:07 PM.
wv-harrison+county,SENECA DR AND CIMMARON RD CLARKSBURG HARRISON COUNTY,Other,05/10/19. 09:54 PM.
wv-harrison+county,FOWLER AVE CLARKSBURG HARRISON COUNTY,Other,05/10/19. 10:08 PM.
wv-harrison+county,FRESA PKWY MEADOWBROOK HARRISON COUNTY,Theft,05/10/19. 11:12 PM.
wv-harrison+county,LOCUST AVE CLARKSBURG HARRISON COUNTY,Other,05/10/19. 11:15 PM.
wv-harrison+county,LOCUST AVE CLARKSBURG HARRISON COUNTY,Other,05/10/19. 11:26 PM.
wv-harrison+county,PRIDE ST SALEM HARRISON COUNTY,Burglary,05/10/19. 11:43 PM.
wv-harrison+county,DELAWARE ST CLARKSBURG HARRISON COUNTY,Other,05/10/19. 01:00 AM.
wv-harrison+county,MEDICAL PARK DR BRIDGEPORT HARRISON COUNTY,Other,05/10/19. 01:07 AM.
wv-harrison+county,SHEETZ @ WHITE OAKS BRIDGEPORT HARRISON COUNTY,Other,05/10/19. 01:23 AM.
wv-harrison+county,NORTH ST SHINNSTON HARRISON COUNTY,Other,05/10/19. 01:45 AM.
wv-harrison+county,1ST AVE NUTTER FORT HARRISON COUNTY,Other,05/10/19. 01:46 AM.
wv-harrison+county,DOUBLE POND DR GREEN VALLEY HARRISON COUNTY,Other,05/10/19. 02:46 AM.
wv-harrison+county,TIFFANY TER EAST VIEW HARRISON COUNTY,Other,05/10/19. 04:02 AM.
wv-harrison+county,LATE AVE BRIDGEPORT HARRISON COUNTY,Burglary,05/10/19. 04:41 AM.
wv-harrison+county,ADAMS AVE CLARKSBURG HARRISON COUNTY,Other,05/11/19. 06:06 AM.
wv-harrison+county,PROFESSIONAL PL BRIDGEPORT HARRISON COUNTY,Other,05/11/19. 07:13 AM.
wv-harrison+county,DUFF AVE CLARKSBURG HARRISON COUNTY,Other,05/11/19. 07:18 AM.
wv-harrison+county,LEE AVE CLARKSBURG HARRISON COUNTY,Other,05/11/19. 08:56 AM.
wv-harrison+county,GRASS RUN RD MARSHVILLE HARRISON COUNTY,Theft,05/11/19. 09:01 AM.
wv-harrison+county,DALE AVE CLARKSBURG HARRISON COUNTY,Vandalism,05/11/19. 09:08 AM.
wv-harrison+county,EMILY DR CLARKSBURG HARRISON COUNTY,Other,05/11/19. 10:15 AM.
wv-harrison+county,HOSPITAL PLAZA GRAFTON HARRISON COUNTY,Other,05/11/19. 10:38 AM.
wv-harrison+county,W MAIN ST CLARKSBURG HARRISON COUNTY,Vandalism,05/11/19. 12:09 PM.
wv-harrison+county,GOODWIN CT NUTTER FORT HARRISON COUNTY,Other,05/11/19. 12:15 PM.
wv-harrison+county,N 26TH ST CLARKSBURG HARRISON COUNTY,Other,05/11/19. 12:26 PM.
wv-harrison+county,W MAIN ST SALEM HARRISON COUNTY,Theft,05/11/19. 12:32 PM.
wv-harrison+county,BLUE RIDGE DR GREEN VALLEY HARRISON COUNTY,Other,05/11/19. 01:43 PM.
wv-harrison+county,EMILY DR CLARKSBURG HARRISON COUNTY,Other,05/11/19. 02:07 PM.
wv-harrison+county,W WASHINGTON ST GRAFTON HARRISON COUNTY,Theft,05/11/19. 03:00 PM.
wv-harrison+county,ROSEBUD PLAZA DR CLARKSBURG HARRISON COUNTY,Other,05/11/19. 03:18 PM.
wv-harrison+county,STEALEY AVE CLARKSBURG HARRISON COUNTY,Other,05/11/19. 03:45 PM.
wv-harrison+county,W MAIN ST CLARKSBURG HARRISON COUNTY,Other,05/11/19. 03:58 PM.
wv-harrison+county,HICKMAN ST CLARKSBURG HARRISON COUNTY,Other,05/11/19. 04:01 PM.
wv-harrison+county,N 4TH ST CLARKSBURG HARRISON COUNTY,Other,05/11/19. 04:31 PM.
wv-harrison+county,INDIANA AVE NUTTER FORT HARRISON COUNTY,Other,05/11/19. 05:08 PM.
wv-harrison+county,MAPLE LAKE RD MAPLE LAKE HARRISON COUNTY,Theft,05/11/19. 05:33 PM.
wv-harrison+county,W MAIN ST BRIDGEPORT HARRISON COUNTY,Other,05/11/19. 05:59 PM.
wv-harrison+county,ONEIL HILL RD WILSONBURG HARRISON COUNTY,Theft,05/11/19. 05:57 PM.
wv-harrison+county,MAIN ST CLARKSBURG HARRISON COUNTY,Other,05/11/19. 06:15 PM.
wv-harrison+county,E MAIN ST SALEM HARRISON COUNTY,Assault,05/11/19. 07:23 PM.
wv-harrison+county,ONEIL HILL RD WILSONBURG HARRISON COUNTY,Assault,05/11/19. 07:31 PM.
wv-harrison+county,N 6TH ST CLARKSBURG HARRISON COUNTY,Other,05/11/19. 07:33 PM.
wv-harrison+county,W MAIN ST CLARKSBURG HARRISON COUNTY,Theft,05/11/19. 08:10 PM.
wv-harrison+county,DUNCAN AVE CLARKSBURG HARRISON COUNTY,Assault,05/11/19. 08:11 PM.
wv-harrison+county,BUCKHANNON PKE CENTER BRANCH HARRISON COUNTY,Other,05/11/19. 08:32 PM.
wv-harrison+county,E PIKE ST SUMMIT PARK HARRISON COUNTY,Other,05/11/19. 08:40 PM.
wv-harrison+county,W WOODLAND AVE CLARKSBURG HARRISON COUNTY,Other,05/11/19. 09:15 PM.
wv-harrison+county,EMILY DR CLARKSBURG HARRISON COUNTY,Theft,05/11/19. 09:32 PM.
wv-harrison+county,BUCKHANNON PKE QUIET DELL HARRISON COUNTY,Theft,05/11/19. 09:35 PM.
wv-harrison+county,S 5TH ST CLARKSBURG HARRISON COUNTY,Other,05/11/19. 09:45 PM.
wv-harrison+county,CLARK ST CLARKSBURG HARRISON COUNTY,Assault,05/11/19. 10:19 PM.
wv-harrison+county,CHARLES ST CLARKSBURG HARRISON COUNTY,Other,05/11/19. 10:48 PM.
wv-harrison+county,HICKMAN ST CLARKSBURG HARRISON COUNTY,Other,05/11/19. 10:58 PM.
wv-harrison+county,PEORA COMMUNITY PEORA HARRISON COUNTY,Other,05/11/19. 12:36 AM.
wv-harrison+county,PECK CT AND LOCUST AVE CLARKSBURG HARRISON COUNTY,Other,05/11/19. 12:57 AM.
wv-harrison+county,W PIKE ST CLARKSBURG HARRISON COUNTY,Other,05/11/19. 01:12 AM.
wv-harrison+county,MICHIGAN AVE NUTTER FORT HARRISON COUNTY,Other,05/11/19. 01:35 AM.
wv-harrison+county,RAILROAD ST BRIDGEPORT HARRISON COUNTY,Assault,05/11/19. 01:42 AM.
wv-harrison+county,W MAIN ST CLARKSBURG HARRISON COUNTY,Other,05/11/19. 02:51 AM.
wv-harrison+county,W MAIN ST CLARKSBURG HARRISON COUNTY,Other,05/11/19. 03:06 AM.
wv-harrison+county,DUFF AVE CLARKSBURG HARRISON COUNTY,Other,05/11/19. 03:23 AM.
wv-harrison+county,E PIKE ST SUMMIT PARK HARRISON COUNTY,Other,05/12/19. 08:17 AM.
wv-harrison+county,MEADOWBROOK RD BRIDGEPORT HARRISON COUNTY,Other,05/12/19. 09:19 AM.
wv-harrison+county,W PIKE ST CLARKSBURG HARRISON COUNTY,Other,05/12/19. 09:49 AM.
wv-harrison+county,W MAIN ST CLARKSBURG HARRISON COUNTY,Other,05/12/19. 11:06 AM.
wv-harrison+county,ADAMS AVE CLARKSBURG HARRISON COUNTY,Other,05/12/19. 11:42 AM.
wv-harrison+county,W PIKE ST CLARKSBURG HARRISON COUNTY,Other,05/12/19. 11:43 AM.
wv-harrison+county,ADAMS AVE CLARKSBURG HARRISON COUNTY,Other,05/12/19. 11:54 AM.
wv-harrison+county,N 17TH ST AND HAMILL AVE CLARKSBURG HARRISON COUNTY,Other,05/12/19. 12:10 PM.
wv-harrison+county,SIMPSON AVE CLARKSBURG HARRISON COUNTY,Other,05/12/19. 01:24 PM.
wv-harrison+county,NORTH ST SHINNSTON HARRISON COUNTY,Other,05/12/19. 02:37 PM.
wv-harrison+county,E MAIN ST BRIDGEPORT HARRISON COUNTY,Other,05/12/19. 02:41 PM.
wv-harrison+county,BUENA VISTA AVE CLARKSBURG HARRISON COUNTY,Other,05/12/19. 03:13 PM.
wv-harrison+county,EMILY DR CLARKSBURG HARRISON COUNTY,Theft,05/12/19. 03:20 PM.
wv-harrison+county,CHICKEN FARM RD REYNOLDSVILLE HARRISON COUNTY,Burglary,05/12/19. 03:18 PM.
wv-harrison+county,CARPENTER ST CLARKSBURG HARRISON COUNTY,Other,05/12/19. 03:29 PM.
wv-harrison+county,SIMPSON ST SUMMIT PARK HARRISON COUNTY,Theft,05/12/19. 03:52 PM.
wv-harrison+county,BARNETTS RUN RD BRIDGEPORT HARRISON COUNTY,Theft,05/12/19. 04:41 PM.
wv-harrison+county,N 26TH ST CLARKSBURG HARRISON COUNTY,Burglary,05/12/19. 04:54 PM.
wv-harrison+county,MILFORD ST CLARKSBURG HARRISON COUNTY,Theft,05/12/19. 05:07 PM.
wv-harrison+county,S 22ND ST CLARKSBURG HARRISON COUNTY,Other,05/12/19. 05:14 PM.
wv-harrison+county,N 19TH ST CLARKSBURG HARRISON COUNTY,Assault,05/12/19. 05:26 PM.
wv-harrison+county,FRESA PKWY MEADOWBROOK HARRISON COUNTY,Other,05/12/19. 05:42 PM.
